Product,United Kingdom,France,Australia,Netherlands,Germany,Norway,EIRE,Switzerland,Spain,Poland,Portugal,Italy,Belgium,Lithuania,Japan,Iceland,Channel Islands,Denmark,Cyprus,Sweden,Austria,Israel,Finland,BahrainMEASURING TAPE BABUSHKA BLUE,147,0,0,0,0,0,0,0,0,0,0,0,0,0,0,0,0,0,0,0,0,0,0,0PENCIL CASE LIFE IS BEAUTIFUL,34,0,0,1,78,0,6,0,0,0,0,0,0,0,0,0,0,0,0,0,0,0,0,0WOODEN ROUNDERS GARDEN SET ,41,0,0,0,0,0,0,0,0,0,0,0,0,0,0,0,0,0,0,0,0,0,0,0CHILDS BREAKFAST SET DOLLY GIRL ,64,2,0,0,0,0,0,0,0,0,0,0,0,0,0,0,0,0,0,0,0,0,0,0CHILDS BREAKFAST SET SPACEBOY ,79,2,0,0,10,0,0,0,0,0,0,0,0,0,0,0,0,0,0,0,0,0,0,0CAKE PLATE LOVEBIRD WHITE,304,24,0,0,3,0,0,0,0,0,0,0,0,0,0,0,0,0,0,0,0,0,0,0WOODEN ADVENT CALENDAR RED,14,0,0,0,0,0,2,0,0,0,0,0,0,0,0,0,0,0,0,0,0,0,0,0GREEN CHRISTMAS TREE CARD HOLDER,64,0,0,0,0,0,0,0,0,0,0,0,0,0,0,0,0,0,0,0,0,0,0,0STRING OF STARS CARD HOLDER,21,0,0,0,0,0,0,0,0,0,0,0,0,0,0,0,0,0,0,0,0,0,0,0SET/12 TAPER CANDLES,64,0,0,0,0,0,0,0,0,0,0,0,0,0,0,0,0,0,0,0,0,0,0,0MINT KITCHEN SCALES,46,0,0,0,10,0,6,0,0,0,0,0,0,0,0,0,0,0,0,0,0,0,0,0WHITE WOOD GARDEN PLANT LADDER,23,0,0,0,0,0,0,0,0,0,0,0,0,0,0,0,0,0,0,0,0,0,0,0GLASS JAR ENGLISH CONFECTIONERY,62,0,0,0,0,0,0,0,0,0,0,0,0,0,0,0,0,0,0,0,0,0,0,0GLASS JAR DIGESTIVE BISCUITS,20,0,0,0,0,0,0,0,0,0,0,0,0,0,0,0,0,0,0,0,0,0,0,0MILK BOTTLE WITH GLASS STOPPER ,18,0,0,0,0,0,0,0,0,0,0,0,0,0,0,0,0,0,0,0,0,0,0,0WELCOME  WOODEN BLOCK LETTERS,19,0,0,0,0,0,0,0,6,0,0,0,0,0,0,0,0,0,0,0,0,0,0,0SET/4 MODERN VINTAGE COTTON NAPKINS,10,0,0,0,0,0,0,0,0,0,0,0,0,0,0,0,0,0,0,0,0,0,0,0VINTAGE UNION JACK APRON,36,0,0,0,3,0,0,0,0,0,0,0,0,0,0,0,0,0,0,0,0,0,0,0SWALLOW SQUARE TISSUE BOX,21,0,0,0,0,0,0,0,0,0,0,0,0,0,0,0,0,0,0,0,0,0,0,0NO JUNK MAIL METAL SIGN,52,0,0,0,0,0,12,0,0,0,0,0,0,0,0,0,0,0,0,0,0,0,0,0SLATE TILE NATURAL HANGING,35,0,0,0,0,0,0,0,0,0,0,0,0,0,0,0,0,0,0,0,0,0,0,0VINTAGE GLASS COFFEE CADDY,55,0,0,0,0,0,0,0,0,0,0,0,0,0,0,0,0,0,0,0,0,0,0,0SILVER GLASS T-LIGHT SET,19,0,0,0,0,0,0,0,0,0,0,0,0,0,0,0,0,0,0,0,0,0,0,0RIDGED GLASS FINGER BOWL,13,0,0,0,0,0,0,0,0,0,0,0,0,0,0,0,0,0,0,0,0,0,0,0GLASS  BEURRE DISH,155,0,0,0,1,0,0,0,0,0,0,0,0,0,0,0,0,0,0,0,0,0,0,0GIN & TONIC DIET GREETING CARD ,190,0,0,0,0,0,0,0,12,0,0,0,0,0,0,0,0,0,0,0,0,0,0,0BIRTHDAY CARD- RETRO SPOT,156,0,0,0,0,0,0,0,12,0,0,0,0,0,0,0,0,0,0,0,0,0,0,0FANCY FONT BIRTHDAY CARD- ,344,24,0,0,0,24,0,12,24,0,0,0,0,0,12,0,0,0,0,0,0,0,0,0WRAP RED APPLES ,225,25,0,0,0,0,25,0,0,0,0,0,0,0,0,0,0,0,0,0,0,0,0,0RED RETROSPOT WRAP ,650,0,0,0,0,0,0,0,0,0,0,0,0,0,0,0,0,0,0,0,0,0,0,0WRAP CHRISTMAS SCREEN PRINT,300,0,0,0,0,0,50,0,0,0,0,0,0,0,0,0,0,0,0,0,0,0,0,0FANCY FONTS BIRTHDAY WRAP,125,0,0,0,0,0,0,0,0,0,0,0,0,0,0,0,0,0,0,0,0,0,0,0CLASSIC WHITE FRAME,25,0,0,0,0,0,0,0,0,0,0,0,0,0,0,0,0,0,0,0,0,0,0,0BLACK DINER WALL CLOCK,7,0,0,0,0,0,0,0,0,0,0,0,0,0,0,0,0,0,0,0,0,0,0,0DOORMAT PEACE ON EARTH BLUE,22,0,0,0,0,12,0,0,0,0,0,0,0,0,0,0,2,0,0,0,0,0,0,0BOX OF 24 COCKTAIL PARASOLS,809,25,0,0,0,100,0,0,1,0,0,0,0,0,0,0,0,0,0,0,0,0,0,0GROW YOUR OWN PLANT IN A CAN ,327,0,0,0,0,96,0,0,0,0,24,0,0,0,0,0,0,0,0,0,0,0,0,0PLASTERS IN TIN STRONGMAN,393,12,12,96,48,72,0,12,0,0,0,0,12,0,0,0,0,0,0,0,0,0,0,0MINI JIGSAW DINOSAUR ,14,0,0,0,0,48,0,0,0,0,0,0,0,0,0,0,0,0,0,0,0,0,0,0MINI JIGSAW BAKE A CAKE ,5,0,0,0,0,48,0,0,0,0,0,0,0,0,0,0,0,0,0,0,0,0,0,0MINI JIGSAW DOLLY GIRL,73,24,0,0,0,48,0,24,0,0,0,0,0,0,0,0,0,0,0,0,0,0,0,0WOODEN SCHOOL COLOURING SET,231,0,0,0,0,48,0,0,0,0,12,0,0,0,0,0,0,0,0,0,0,0,0,0PACK OF 12 TRADITIONAL CRAYONS,345,0,0,0,24,48,24,0,0,0,0,0,0,0,0,0,0,0,0,144,0,0,0,0CARD PARTY GAMES ,49,0,0,0,0,24,0,0,0,0,0,0,0,0,0,0,0,0,0,0,0,0,0,0BOOZE & WOMEN GREETING CARD ,50,0,0,0,0,24,0,0,0,0,0,0,0,0,0,0,0,0,0,0,0,0,0,0PACK OF 12 SUKI TISSUES ,465,26,0,0,24,96,0,0,0,0,0,0,0,0,0,0,0,0,0,0,0,0,144,0PACK OF 12 WOODLAND TISSUES ,102,25,0,12,24,96,0,0,0,0,0,0,0,0,0,0,0,0,0,0,0,0,144,0PACK OF 12 SKULL TISSUES,289,0,0,0,24,96,0,0,0,0,0,0,0,0,0,0,0,0,0,0,0,0,0,0PACK OF 12 CIRCUS PARADE TISSUES ,55,24,0,0,0,96,0,0,0,0,0,0,0,0,0,0,0,0,0,0,0,0,0,0PACK OF 12 SPACEBOY TISSUES,89,24,0,0,0,96,0,0,0,0,0,0,0,0,0,0,0,0,0,0,0,0,0,0LADS ONLY TISSUE BOX,391,0,0,0,0,24,0,0,0,0,0,0,0,0,0,0,0,0,0,0,0,0,0,0RED RETROSPOT TISSUE BOX,18,1,0,0,0,24,0,0,0,0,0,0,0,0,0,0,0,0,0,0,0,0,0,0GINGERBREAD MAN COOKIE CUTTER,564,36,0,0,12,48,24,0,0,0,12,0,0,0,0,0,0,0,0,0,0,0,0,0GIN AND TONIC MUG,192,0,0,0,0,48,0,0,0,0,0,0,0,0,0,0,0,0,0,0,0,0,0,0IF YOU CAN'T STAND THE HEAT MUG,315,0,0,0,0,48,0,0,0,0,0,0,0,0,0,0,0,0,0,0,0,0,0,0I CAN ONLY PLEASE ONE PERSON MUG,454,0,0,0,0,48,0,0,0,0,0,0,0,0,0,0,0,0,0,0,0,0,0,0PINK HEART SHAPE EGG FRYING PAN,853,12,0,0,6,144,0,12,0,0,0,0,0,0,0,0,0,0,0,0,0,0,0,0200 RED + WHITE BENDY STRAWS,71,0,0,1,0,24,0,0,0,0,0,0,0,0,0,0,0,0,0,0,0,0,0,0RECIPE BOX RETROSPOT ,241,6,0,0,0,24,0,0,0,0,18,0,0,0,0,0,0,0,0,0,0,0,0,0RECIPE BOX PANTRY YELLOW DESIGN,408,0,0,0,0,24,12,0,0,0,6,0,0,0,0,0,0,0,0,0,0,0,0,0RECIPE BOX BLUE SKETCHBOOK DESIGN,136,0,0,0,0,24,6,0,0,0,6,0,0,0,0,0,0,0,0,0,0,0,0,020 DOLLY PEGS RETROSPOT,240,0,24,0,12,48,0,0,0,0,0,0,24,0,96,0,0,12,0,0,0,0,0,0NO SINGING METAL SIGN,367,12,0,0,0,48,0,0,0,0,0,0,0,0,0,0,0,0,0,0,0,0,0,0BISCUIT TIN VINTAGE RED,22,0,0,0,2,12,2,0,0,0,0,0,0,0,0,0,0,0,0,0,0,0,0,0EMERGENCY FIRST AID TIN ,77,0,0,0,0,48,0,0,2,0,0,0,0,0,0,12,0,0,0,0,0,0,0,0POLKADOT PEN,496,0,0,0,0,0,0,0,0,0,0,0,0,0,0,0,0,0,0,0,0,0,0,0DECORATIVE PLANT POT WITH FRIEZE,5,0,0,0,0,0,0,0,0,0,0,0,0,0,0,0,0,0,0,0,0,0,0,0FRENCH BLUE METAL DOOR SIGN 5,49,0,0,0,0,0,0,0,0,0,0,0,0,0,0,0,0,0,0,0,0,0,0,0CHEST OF DRAWERS GINGHAM HEART ,19,0,0,0,1,0,0,0,0,0,0,0,0,0,0,0,0,0,0,0,0,0,0,0RED RETROSPOT CAKE STAND,204,4,0,0,0,0,6,0,0,0,0,0,0,0,0,0,0,0,0,0,0,0,0,0JOY WOODEN BLOCK LETTERS,31,0,0,0,0,0,0,0,0,0,0,0,0,0,0,0,0,0,0,0,0,0,0,0NOEL WOODEN BLOCK LETTERS ,46,0,0,0,0,0,12,0,0,0,0,0,0,0,0,0,0,0,0,0,0,0,0,0PEACE WOODEN BLOCK LETTERS,25,0,0,0,0,0,9,0,0,0,0,0,0,0,0,0,0,0,0,0,0,0,0,0OFFICE MUG WARMER BLACK+SILVER ,88,0,0,0,0,0,0,0,0,0,0,0,0,0,0,0,0,0,0,0,0,0,0,0SET OF 2 CHRISTMAS DECOUPAGE CANDLE,56,0,0,0,0,0,24,0,0,0,0,0,0,0,0,0,0,0,0,0,0,0,0,0COSMETIC BAG VINTAGE ROSE PAISLEY,47,0,0,0,0,0,0,0,0,0,20,0,0,0,0,0,0,0,0,0,0,0,0,0PINK ROSE FABRIC MIRROR,108,0,0,0,0,0,0,0,0,0,0,0,0,0,0,0,0,0,0,0,0,0,0,0SILVER PLATE CANDLE BOWL SMALL,49,0,0,0,0,0,0,0,0,0,0,0,0,0,0,0,0,0,0,0,0,0,0,0SMALL REGAL  SILVER CANDLEPOT ,31,0,0,0,0,0,0,0,0,0,0,0,0,0,0,0,0,0,0,0,0,0,0,0ANTIQUE TALL SWIRLGLASS TRINKET POT,157,0,0,0,0,0,4,0,0,0,0,0,0,0,0,0,0,0,0,0,0,0,0,0ANTIQUE GLASS PEDESTAL BOWL,107,1,0,0,0,0,4,0,0,0,0,0,0,0,0,0,0,0,0,0,0,0,0,0GUMBALL MAGAZINE RACK,41,0,0,0,2,0,0,0,0,0,0,0,0,0,0,0,0,0,0,0,0,0,0,0RED FLOWER CROCHET FOOD COVER,16,0,0,0,0,0,0,0,0,0,0,0,0,0,0,0,0,0,0,0,0,0,0,0CHERRY CROCHET FOOD COVER,7,0,0,0,0,0,0,0,0,0,0,0,0,0,0,0,0,0,0,0,0,0,0,0STRAWBERRY RAFFIA FOOD COVER,18,0,0,0,0,0,0,0,0,0,0,0,0,0,0,0,0,0,0,0,0,0,0,0POLKA DOT RAFFIA FOOD COVER,8,0,0,0,0,0,6,0,0,0,0,0,0,0,0,0,0,0,0,0,0,0,0,0DOORMAT SPOTTY HOME SWEET HOME,196,0,0,0,0,0,2,0,0,0,0,0,0,0,0,0,0,0,0,0,0,0,0,0T-LIGHT GLASS FLUTED ANTIQUE,783,0,0,0,0,0,0,0,0,0,0,12,0,0,0,0,0,0,0,0,0,0,0,0SILVER  CANDLEPOT JARDIN ,19,0,0,0,0,0,0,0,0,0,0,0,0,0,0,0,0,0,0,0,0,0,0,0POLKADOT MUG PINK ,30,0,0,0,0,0,0,0,0,0,0,0,0,0,0,0,0,0,0,0,0,0,0,0PAPER BUNTING COLOURED LACE,16,0,0,0,0,0,0,0,0,0,0,0,0,0,40,0,0,0,1,0,0,0,0,0ANTIQUE GLASS HEART DECORATION ,273,0,0,0,0,0,0,0,0,0,0,0,0,0,0,0,0,0,0,0,0,0,0,0SET OF 6 KASHMIR FOLKART BAUBLES,28,0,0,0,0,0,0,0,0,0,0,0,0,0,0,0,0,0,0,0,0,0,0,0CHRISTMAS RETROSPOT ANGEL WOOD,176,12,0,0,24,0,0,0,0,0,0,0,0,0,0,0,0,0,0,0,0,0,0,0CHRISTMAS RETROSPOT STAR WOOD,265,0,0,0,12,0,0,0,0,0,0,0,0,0,0,0,0,0,0,0,0,0,0,0HEART WOODEN CHRISTMAS DECORATION,391,0,0,0,12,0,36,0,0,0,0,0,0,0,0,0,0,0,0,0,0,0,0,0LARGE HANGING IVORY & RED WOOD BIRD,139,0,0,0,0,0,0,0,0,0,0,0,0,0,0,0,0,0,0,0,0,0,0,0SMALL HANGING IVORY/RED WOOD BIRD,306,0,0,0,0,0,0,0,0,0,0,0,0,0,0,0,0,0,0,0,0,0,0,0GRAND CHOCOLATECANDLE,528,0,0,0,0,0,0,0,0,0,9,9,0,0,0,0,0,0,18,0,0,0,0,0FAIRY CAKE BIRTHDAY CANDLE SET,21,4,0,0,0,0,0,0,0,0,0,0,0,0,0,0,0,0,0,0,0,0,0,03 HOOK PHOTO SHELF ANTIQUE WHITE,63,0,0,0,12,0,2,0,0,0,0,0,0,0,0,0,0,0,0,0,0,0,0,0CREAM SWEETHEART WALL CABINET,6,0,0,0,0,0,0,0,0,0,0,0,0,0,0,0,0,0,0,0,0,0,0,0DOORMAT ENGLISH ROSE ,142,0,0,0,0,0,10,0,0,0,0,0,0,0,0,0,0,0,0,0,0,0,0,0DOORMAT UNION FLAG,199,22,20,0,0,0,0,0,0,0,0,0,20,0,0,0,2,0,0,0,0,0,0,0ROMANTIC IMAGES NOTEBOOK SET,29,0,0,0,0,0,0,0,0,0,0,0,0,0,0,0,0,0,0,0,0,0,0,0CURIOUS  IMAGES NOTEBOOK SET,4,0,0,0,0,0,0,0,0,0,0,0,0,0,0,0,0,0,0,0,0,0,0,0VINTAGE KEEPSAKE BOX PARIS DAYS,15,0,0,0,0,0,0,0,0,0,0,0,0,0,0,0,0,0,0,0,0,0,0,0RED GINGHAM ROSE JEWELLERY BOX,260,0,0,0,10,0,0,0,0,0,0,0,0,24,0,0,0,0,0,0,0,0,0,0BLUE CHARLIE+LOLA PERSONAL DOORSIGN,25,0,0,0,0,0,6,0,0,0,0,0,0,0,0,0,0,0,0,0,0,0,0,0"CHARLIE+LOLA""EXTREMELY BUSY"" SIGN",23,0,0,0,0,0,6,0,0,0,0,0,0,0,0,0,0,0,0,0,0,0,0,0CHARLOTTE BAG SUKI DESIGN,1821,0,0,102,30,0,50,0,0,0,0,0,0,0,0,0,0,0,0,0,0,0,0,0LOLITA  DESIGN  COTTON TOTE BAG,7,0,0,0,0,0,6,0,0,0,0,0,0,0,0,0,0,0,0,0,0,0,0,0LETS GO SHOPPING COTTON TOTE BAG,9,2,0,0,0,0,6,0,0,0,0,0,0,0,0,0,0,0,0,0,0,0,0,0PAINT YOUR OWN CANVAS SET,140,0,0,0,0,0,36,0,0,0,0,0,0,0,0,0,0,0,0,0,0,0,0,0CAMOUFLAGE LED TORCH,393,0,0,0,0,0,12,0,0,0,0,0,0,0,0,0,0,0,0,0,0,0,0,0BLUE DRAGONFLY HELICOPTER,33,0,0,0,0,0,2,0,0,0,0,0,0,0,0,0,0,0,0,0,0,0,0,0YELLOW SHARK HELICOPTER,25,0,0,0,0,0,2,0,0,0,0,0,0,0,0,0,0,0,0,0,0,0,0,0RED SHARK HELICOPTER,20,0,0,0,0,0,2,0,0,0,0,0,0,0,0,0,0,0,0,0,0,0,0,0TOOL BOX SOFT TOY ,25,6,0,0,0,0,4,0,0,0,0,0,0,0,0,0,0,0,0,0,0,0,0,0DOCTOR'S BAG SOFT TOY,20,0,0,0,0,0,4,0,0,0,0,0,0,0,0,0,0,0,0,0,0,0,0,0CARRIAGE,1,1,0,0,0,0,7,0,0,0,0,0,0,0,0,0,1,0,0,0,0,0,0,0JUMBO BAG SCANDINAVIAN PAISLEY,849,0,0,0,0,0,0,0,10,0,10,0,0,0,0,0,0,0,0,0,0,0,0,0JUMBO BAG TOYS ,313,0,0,0,0,0,0,0,0,0,0,0,0,0,0,0,0,0,0,0,0,0,0,0DECORATIVE ROSE BATHROOM BOTTLE,209,0,0,0,0,0,0,0,0,0,0,0,0,0,0,0,0,0,0,0,0,0,0,0DECORATIVE CATS BATHROOM BOTTLE,141,12,0,0,0,0,0,0,0,0,0,0,0,0,0,0,0,0,0,0,0,0,0,0RAIN PONCHO RETROSPOT,252,24,0,0,24,0,0,0,0,0,0,0,0,0,0,0,0,0,0,0,0,0,0,0CHRISTMAS TREE DECORATION WITH BELL,555,0,0,0,0,0,0,0,0,0,0,0,0,0,0,0,0,0,0,0,0,0,0,0CHRISTMAS TREE HEART DECORATION,603,0,0,0,0,0,0,0,0,0,0,0,0,0,0,0,0,0,0,0,0,0,0,0CHRISTMAS TREE STAR DECORATION,617,0,0,0,0,0,0,0,0,0,0,0,0,0,0,0,0,0,0,0,0,0,0,0CHRISTMAS HANGING TREE WITH BELL,152,0,0,0,0,0,0,0,0,0,0,0,0,0,0,0,0,0,0,0,0,0,0,0GLITTER STAR GARLAND WITH BELLS ,24,0,0,0,0,0,0,0,0,0,0,0,0,0,0,0,0,0,0,0,0,0,0,0GLITTER CHRISTMAS TREE WITH BELLS,53,0,0,0,0,0,0,0,0,0,0,0,0,0,0,0,0,0,0,0,0,0,0,0LILAC DIAMANTE PEN IN GIFT BOX,25,0,0,0,0,0,0,0,0,0,0,0,0,0,0,0,0,0,0,0,0,0,0,0HEARTS GIFT TAPE,500,0,0,0,0,0,0,0,2,0,0,0,0,0,0,0,0,0,0,0,0,0,0,0CAKES AND BOWS GIFT  TAPE,258,0,0,0,48,0,0,0,0,0,0,0,0,0,0,0,0,0,0,0,0,0,0,0BINGO SET,117,0,0,0,0,0,16,0,0,0,12,0,0,0,0,0,0,0,0,0,0,0,0,0GARDEN METAL SIGN ,59,0,0,0,0,0,0,0,0,0,0,0,0,0,0,0,0,0,0,0,0,0,0,0UNION STRIPE WITH FRINGE  HAMMOCK,10,0,0,0,0,0,0,0,0,0,0,0,0,0,0,0,0,0,0,0,0,0,0,0SUKI  SHOULDER BAG,208,0,0,100,0,0,0,0,10,0,0,0,0,0,0,0,0,0,0,0,0,0,0,0SKULLS DESIGN FLANNEL,51,0,0,0,0,0,0,0,0,0,0,0,0,0,0,0,0,0,0,0,0,0,0,0KITTENS DESIGN FLANNEL,16,0,0,0,0,0,0,0,0,0,0,0,0,0,0,0,0,0,0,0,0,0,0,0SET OF 6 STRAWBERRY CHOPSTICKS,190,0,0,0,12,0,0,0,0,0,0,0,0,0,0,0,0,0,0,0,0,0,0,0MODERN FLORAL STATIONERY SET,69,0,0,0,0,0,0,0,0,0,0,0,0,0,0,0,0,0,0,0,0,0,0,0BOHEMIAN COLLAGE STATIONERY SET,29,0,0,0,0,0,0,0,0,0,0,0,0,0,0,0,0,0,0,0,0,0,0,0FLORAL FOLK STATIONERY SET,69,0,0,0,0,0,0,0,0,0,0,0,0,0,0,0,0,0,0,0,0,0,0,0ROBOT BIRTHDAY CARD,144,24,0,0,0,0,0,12,0,0,0,0,0,0,0,0,0,0,0,0,0,0,0,0CHRISTMAS CARD SCREEN PRINT ,30,0,0,0,0,0,0,0,0,0,0,0,0,0,0,0,0,0,0,0,0,0,0,0CHRISTMAS PUDDING TRINKET POT ,187,0,0,0,0,0,0,0,0,0,0,0,0,0,0,0,0,0,0,0,0,0,0,0CHOC TRUFFLE GOLD TRINKET POT ,38,0,0,0,0,0,0,0,0,0,0,0,0,0,0,0,0,0,0,0,0,0,0,0BROWN  PIRATE TREASURE CHEST ,46,0,0,0,0,0,0,0,0,0,0,0,0,0,0,0,0,0,0,0,0,0,0,0SMALL WHITE RETROSPOT MUG IN BOX ,19,0,0,0,0,0,0,0,0,0,0,0,0,0,0,0,0,0,5,0,0,0,0,06 RIBBONS EMPIRE  ,66,1,0,0,12,0,0,0,0,0,0,0,0,0,0,0,0,0,0,0,0,0,0,0RIBBON REEL POLKADOTS ,67,10,120,0,10,0,0,0,0,0,0,0,120,0,0,0,0,0,0,0,0,0,0,0RIBBON REEL FLORA + FAUNA ,30,0,0,0,0,0,0,0,0,0,0,0,0,0,0,0,0,0,0,0,0,0,0,0PAPER BUNTING RETROSPOT,138,6,0,0,0,0,0,0,0,0,0,0,0,0,0,0,0,0,0,0,0,0,0,0LADLE LOVE HEART RED ,24,0,0,0,0,0,0,0,0,0,0,0,0,0,0,0,0,0,0,0,0,0,0,0LADLE LOVE HEART PINK,39,0,0,0,0,0,0,0,0,0,0,0,0,0,0,0,0,0,0,0,0,0,0,0ANGEL DECORATION 3 BUTTONS ,1090,0,0,0,0,0,0,0,0,0,0,0,0,0,0,0,0,0,0,0,0,0,0,0STAR DECORATION RUSTIC,392,0,0,0,0,0,0,0,0,0,0,0,0,0,0,0,0,0,0,0,0,0,0,0HEART DECORATION WITH PEARLS ,150,0,0,0,0,0,0,0,0,0,0,0,0,0,0,0,0,0,0,0,0,0,0,0HEART DECORATION RUSTIC HANGING ,233,0,0,0,0,0,0,0,0,0,0,0,0,0,0,0,0,0,0,0,0,0,0,0HEART GARLAND RUSTIC PADDED,98,0,0,0,0,0,0,0,0,0,0,0,0,0,0,0,0,0,0,0,0,0,0,0FAMILY ALBUM WHITE PICTURE FRAME,108,0,0,0,0,0,4,0,0,0,0,0,0,0,0,0,0,0,0,0,0,0,0,0CAKE STAND VICTORIAN FILIGREE SMALL,13,0,0,0,0,0,0,0,0,0,0,0,0,0,0,0,0,0,0,0,0,0,0,0LOCAL CAFE MUG,104,0,0,0,24,0,0,12,0,0,0,0,0,0,0,0,0,0,0,0,0,0,0,0MILK PAN RED RETROSPOT,30,0,0,0,4,0,0,0,0,0,0,0,0,0,0,0,0,0,0,0,0,0,0,0FRYING PAN UNION FLAG,145,0,0,0,0,0,0,0,0,0,0,0,0,0,0,0,0,0,0,0,0,0,0,0EASTER DECORATION NATURAL CHICK,68,0,0,0,0,0,0,0,0,0,0,0,0,0,0,0,0,0,0,0,0,0,0,0WASH BAG VINTAGE ROSE PAISLEY,66,0,0,0,0,0,0,0,0,0,0,0,0,0,0,0,0,0,0,0,0,0,0,0PIG KEYRING WITH LIGHT & SOUND ,157,0,0,0,0,0,24,0,0,0,0,0,0,0,0,0,0,0,0,0,0,0,0,0COFFEE MUG DOG + BALL DESIGN,111,12,0,0,6,0,0,12,0,0,0,0,0,18,0,0,0,0,0,0,0,0,0,0COFFEE MUG CAT + BIRD DESIGN,154,18,0,0,6,0,0,12,0,0,0,0,0,18,0,0,0,0,0,0,0,0,0,0TEA COSY RED  STRIPE,33,0,0,0,0,0,0,0,0,0,0,0,0,0,0,0,0,0,0,0,0,0,0,0OFFICE MUG WARMER CHOC+BLUE,155,12,0,0,0,0,0,12,0,0,0,0,0,0,0,0,0,0,0,0,0,0,0,0HEART DECORATION PAINTED ZINC ,100,0,0,0,0,0,0,0,2,0,0,0,0,0,0,0,0,0,96,0,0,0,0,0DOVE DECORATION PAINTED ZINC ,65,0,0,0,0,0,24,0,0,0,0,0,0,0,0,0,0,0,0,0,0,0,0,0PARTY PIZZA DISH BLUE POLKADOT,141,0,0,216,36,0,0,0,0,0,0,0,0,0,0,0,0,0,0,0,0,0,0,0TEA BAG PLATE RED RETROSPOT,259,60,0,0,0,0,12,0,0,0,0,0,0,0,0,0,0,0,0,288,0,0,0,0CHARLOTTE BAG PINK POLKADOT,610,10,0,0,0,0,0,0,0,0,0,0,0,0,0,0,0,0,0,0,0,0,0,0GLASS JAR KINGS CHOICE,14,0,0,0,0,0,0,0,0,0,0,0,0,0,0,0,0,0,0,0,0,0,0,0GLASS JAR DAISY FRESH COTTON WOOL,19,0,0,0,0,0,0,0,0,0,0,0,0,0,0,0,0,0,0,0,0,0,0,0AIRLINE BAG VINTAGE JET SET BROWN,45,1,0,0,0,0,0,0,0,0,0,0,0,0,0,4,0,0,0,0,0,0,0,0WALL TIDY RETROSPOT ,505,0,60,300,40,0,0,0,0,0,5,0,60,0,0,0,0,0,0,20,0,0,0,0TOY TIDY SPACEBOY  ,68,0,0,0,0,0,0,0,0,0,0,0,0,0,0,0,0,0,0,0,0,0,0,0PAPERWEIGHT KINGS CHOICE ,74,0,0,0,0,0,0,0,0,0,0,0,0,0,0,0,0,0,0,0,0,0,0,0MAGNETS PACK OF 4 RETRO PHOTO,48,0,0,240,24,0,0,0,0,0,0,0,0,0,0,0,0,0,0,0,0,0,0,0LIPSTICK PEN RED,302,0,0,0,100,0,0,0,0,0,0,0,0,0,0,0,0,0,0,0,0,0,0,0TOOTHPASTE TUBE PEN,87,0,0,0,0,0,0,12,0,0,0,0,0,0,0,0,0,0,0,0,0,0,0,0ENAMEL WATERING CAN CREAM,22,0,0,0,0,0,0,0,0,0,0,0,0,0,0,0,0,0,0,0,0,0,0,0WATERING CAN PINK BUNNY,35,0,0,0,0,0,0,0,0,0,0,0,0,0,0,0,0,0,0,0,0,0,0,0SET OF 9 BLACK SKULL BALLOONS,62,20,0,0,0,0,0,0,0,0,0,0,0,0,0,0,0,0,0,0,0,0,0,0TV DINNER TRAY AIR HOSTESS ,124,0,0,40,0,0,0,0,0,0,3,0,0,0,0,0,0,0,0,0,0,0,0,0EMPIRE UNION JACK TV DINNER TRAY,59,0,0,0,0,0,0,0,0,0,0,0,0,0,0,0,0,0,0,0,0,0,0,0WATERING CAN GARDEN MARKER,27,0,0,0,0,0,0,0,0,0,0,0,0,0,0,0,0,0,0,0,0,0,0,0BIRDHOUSE GARDEN MARKER ,32,0,0,0,0,0,0,0,0,0,0,0,0,0,0,0,0,0,0,0,0,0,0,0DAISY GARDEN MARKER,10,0,0,0,0,0,0,0,0,0,0,0,0,0,0,0,0,0,0,0,0,0,0,0SET OF 2 TINS VINTAGE BATHROOM ,29,0,0,0,0,0,0,0,2,0,0,0,0,0,0,4,0,0,0,0,0,0,0,0CHILDS GARDEN SPADE PINK,20,0,36,0,0,0,0,0,0,0,0,0,36,0,0,0,0,0,0,0,0,0,0,0CHILDS GARDEN RAKE PINK,8,0,36,0,0,0,0,0,0,0,0,0,36,0,0,0,0,0,0,0,0,0,0,0CHILDS GARDEN BRUSH PINK,28,0,36,0,0,0,0,0,0,0,0,0,36,0,0,0,0,0,0,0,0,0,0,0MINI JIGSAW BUNNIES,32,0,0,0,0,0,0,24,0,0,0,0,0,0,0,0,0,0,0,0,0,0,0,0HOLIDAY FUN LUDO,73,0,0,0,4,0,4,0,0,0,0,0,0,0,0,0,0,0,0,0,0,0,0,0TRADITIONAL MODELLING CLAY,586,24,0,0,0,0,24,0,0,0,0,0,0,0,0,0,0,0,0,0,0,0,0,0CARDHOLDER GINGHAM STAR,83,0,0,0,0,0,0,0,0,0,0,0,0,0,0,0,0,0,0,0,0,0,0,0WOODEN CROQUET GARDEN SET,26,0,0,0,2,0,0,0,0,0,0,0,0,0,0,0,0,0,0,0,0,0,0,0SET OF 4 NAPKIN CHARMS HEARTS,88,0,0,0,0,0,0,0,0,0,0,0,0,0,0,0,0,0,0,0,0,0,0,0RED BABY BUNTING ,89,0,0,0,0,0,0,0,0,0,0,0,0,0,0,0,0,0,0,0,0,0,0,0FRENCH KITCHEN SIGN BLUE METAL,45,0,0,0,0,0,0,0,0,0,0,0,0,0,0,0,0,0,0,0,0,0,0,0SET OF 6 RIBBONS VINTAGE CHRISTMAS,117,0,0,0,0,0,0,0,0,0,0,0,0,0,0,0,0,0,0,0,0,0,0,0FUNKY DIVA PEN,198,0,0,0,96,0,0,0,0,0,0,0,0,0,0,0,0,0,0,0,0,0,0,0SMALL PURPLE BABUSHKA NOTEBOOK ,109,0,0,0,0,0,0,0,0,0,0,0,0,0,0,0,0,0,0,0,0,0,0,0LARGE RED BABUSHKA NOTEBOOK ,59,0,0,0,0,0,0,0,0,0,0,0,0,0,0,0,0,0,0,12,0,0,0,0LARGE PURPLE BABUSHKA NOTEBOOK  ,47,0,0,0,0,0,0,0,0,0,0,0,0,0,0,0,0,0,0,12,0,0,0,0CHALKBOARD KITCHEN ORGANISER,7,0,0,0,0,0,4,0,0,0,0,0,0,0,0,0,0,0,0,0,0,0,0,0FLUTED ANTIQUE CANDLE HOLDER,325,0,0,0,0,0,0,0,0,0,0,0,0,0,0,0,0,0,0,0,0,0,0,0CARD MOTORBIKE SANTA,643,0,0,0,12,0,24,0,0,0,0,0,0,0,0,0,0,0,0,0,0,0,0,0CARD CHRISTMAS VILLAGE,360,0,0,0,24,0,0,0,0,0,0,0,0,0,0,0,0,0,0,0,0,0,0,0CREAM WALL PLANTER HEART SHAPED,39,0,0,0,0,0,0,0,0,0,0,0,0,0,0,0,0,0,0,0,0,0,0,0VINTAGE CREAM DOG FOOD CONTAINER,47,0,0,0,0,0,4,0,0,4,0,0,0,0,0,0,0,0,0,0,0,0,0,0BREAD BIN DINER STYLE IVORY,28,0,0,0,9,0,7,0,0,0,1,0,0,0,0,0,0,8,0,0,0,0,0,0LOVE HEART NAPKIN BOX ,93,0,0,0,0,0,0,0,1,0,0,0,0,0,0,0,0,0,0,0,0,0,0,0NUMBER TILE COTTAGE GARDEN 8,9,0,0,0,0,0,0,0,0,0,0,0,0,0,0,0,0,0,0,0,0,0,0,0YELLOW GIANT GARDEN THERMOMETER,7,0,0,0,0,0,0,0,0,0,0,0,0,0,0,0,0,0,0,0,0,0,0,0METAL DECORATION NAUGHTY CHILDREN ,75,24,0,0,24,0,24,0,0,0,0,0,0,0,0,0,0,0,0,0,0,0,0,036 DOILIES DOLLY GIRL,11,0,0,0,12,0,0,0,0,0,0,0,0,0,0,0,0,0,0,144,0,0,0,0CIRCUS PARADE CHILDRENS EGG CUP ,191,36,0,0,12,0,0,0,0,0,0,0,0,0,0,0,0,0,0,0,0,0,0,0BLUE VICTORIAN FABRIC OVAL BOX,12,0,0,0,0,0,0,0,0,0,0,0,0,0,0,0,0,0,0,0,0,0,0,0RED VICTORIAN FABRIC OVAL BOX,18,0,0,0,0,0,0,0,0,0,0,0,0,0,0,0,0,0,0,0,0,0,0,0SET OF 3 BIRD LIGHT PINK FEATHER ,39,0,0,0,0,0,0,0,0,0,0,0,0,0,0,0,0,0,0,0,0,0,0,0PINK/WHITE CHRISTMAS TREE 60CM,40,0,0,0,0,0,0,0,0,0,0,0,0,0,0,0,0,0,0,0,0,0,0,0PINK AND WHITE CHRISTMAS TREE 120CM,7,0,0,0,0,0,0,0,0,0,0,0,0,0,0,0,0,0,0,0,0,0,0,0PINK CHRISTMAS FLOCK DROPLET ,10,0,0,0,0,0,0,0,0,0,0,0,0,0,0,0,0,0,0,0,0,0,0,0ACRYLIC JEWEL ICICLE- PINK,1,0,0,0,0,0,0,0,0,0,0,0,0,0,0,0,0,0,0,0,0,0,0,0SMALLFOLKART BAUBLE CHRISTMAS DEC,562,0,0,0,0,0,96,0,0,0,0,0,0,0,0,0,0,0,0,0,0,0,0,0FOLKART ZINC HEART CHRISTMAS DEC,267,0,0,0,0,0,0,0,2,0,0,0,0,0,0,0,0,0,12,0,0,0,0,0ROSE FOLKART HEART DECORATIONS,97,0,0,0,0,0,0,0,0,0,0,0,0,0,0,0,0,0,0,0,0,0,0,0CERAMIC CAKE STAND + HANGING CAKES,105,0,0,0,0,0,0,0,0,0,0,0,0,0,0,0,0,0,0,0,8,0,0,0CONDIMENT TRAY 4 BOWLS AND 4 SPOONS,4,0,0,0,0,0,0,0,0,0,0,0,0,0,0,0,0,0,0,0,0,0,0,0TEA TIME OVEN GLOVE,313,0,0,0,20,0,20,0,0,0,0,0,0,0,0,0,0,0,0,0,0,0,0,0SCOTTIES CHILDRENS APRON,113,0,0,0,0,0,0,0,0,0,0,0,0,0,0,0,0,0,0,0,0,0,0,0PINK FAIRY CAKE CHILDRENS APRON,418,0,0,0,0,0,8,0,0,0,8,0,0,0,0,0,0,0,0,0,0,0,0,0SCOTTIE DOGS BABY BIB,46,0,0,0,0,0,0,0,0,0,0,0,0,0,0,0,0,0,0,0,0,0,0,0DOORMAT WELCOME PUPPIES,28,0,0,0,0,0,4,0,0,0,0,0,0,0,0,0,0,0,0,0,0,0,0,0HANGING JAM JAR T-LIGHT HOLDER,728,0,0,0,0,0,0,0,0,0,0,0,0,0,0,0,0,0,0,0,0,0,0,0SET OF 6 HALLOWEEN GHOST T-LIGHTS,4,0,0,0,0,0,0,0,0,0,0,0,0,0,0,0,0,0,0,0,0,0,0,0IVORY PILLAR CANDLE SILVER FLOCK,50,0,0,0,0,0,0,0,0,0,0,0,0,0,0,0,0,0,0,0,0,0,0,0IVORY PILLAR CANDLE GOLD FLOCK,21,0,0,0,0,0,0,0,0,0,0,0,0,0,0,0,0,0,0,0,0,0,0,0SET/3 ROSE CANDLE IN JEWELLED BOX,98,0,0,0,0,0,0,0,0,0,0,0,0,0,0,0,0,0,0,0,0,0,0,0SET/3 OCEAN SCENT CANDLE JEWEL BOX,74,0,0,0,0,0,8,0,0,0,0,0,0,0,0,0,0,0,0,0,0,0,0,0SET/3 VANILLA SCENTED CANDLE IN BOX,80,0,0,0,0,0,8,0,0,0,0,4,0,0,0,0,0,0,0,0,0,0,0,0SET/3 CHRISTMAS DECOUPAGE CANDLES,116,0,0,0,0,0,24,0,0,0,0,0,0,0,0,0,0,0,0,0,0,0,0,0TUMBLER- BAROQUE,19,0,0,0,0,0,0,0,0,0,0,0,0,0,0,0,0,0,0,0,0,0,0,0TUMBLER- NEW ENGLAND,3,0,0,0,0,0,0,0,0,0,0,0,0,0,0,0,0,0,0,0,0,0,0,0LAUNDRY 15C METAL SIGN,123,0,0,0,0,0,0,0,0,0,0,0,0,0,0,0,0,0,0,0,0,0,0,0HOT BATHS METAL SIGN,452,0,0,0,0,0,0,0,0,0,0,0,0,0,0,0,0,0,0,0,0,0,0,0METAL SIGN-CUPCAKE SINGLE HOOK,428,20,0,0,20,0,0,0,0,0,0,0,0,0,0,0,0,0,0,0,0,0,0,0METAL SIGN CUPCAKE SINGLE HOOK,252,20,0,0,20,0,0,0,0,0,0,0,0,0,0,0,0,0,0,0,0,0,0,0CHARLIE+LOLA RED HOT WATER BOTTLE ,128,0,0,0,0,0,0,0,0,0,0,3,0,0,0,0,0,0,0,0,0,0,0,0CHARLIE LOLA BLUE HOT WATER BOTTLE ,76,0,0,0,0,0,0,0,0,0,0,0,0,0,0,0,0,0,0,0,0,0,0,0CHARLIE+LOLA PINK HOT WATER BOTTLE,295,0,0,0,0,0,24,0,0,0,0,0,0,0,0,0,0,0,0,0,0,0,0,0PINK/PURPLE RETRO RADIO,23,0,0,0,0,0,0,0,0,0,0,0,0,0,0,0,0,0,0,0,0,0,0,0CHERRY BLOSSOM  DECORATIVE FLASK,25,8,0,0,0,0,0,0,0,0,0,0,0,0,0,0,0,0,0,0,0,0,0,0SET OF 12  VINTAGE POSTCARD SET,161,0,0,0,0,0,0,0,0,0,0,0,0,0,6,0,0,0,0,0,0,0,0,0SET OF 6 VINTAGE NOTELETS KIT,10,0,0,0,0,0,0,0,0,0,0,0,0,0,6,0,0,0,0,0,0,0,0,0ENVELOPE 50 ROMANTIC IMAGES,9,0,0,0,0,0,0,0,0,0,0,0,0,0,0,0,0,0,0,0,0,0,0,0ENVELOPE 50 BLOSSOM IMAGES,34,0,0,0,0,0,0,0,0,0,0,0,0,0,48,0,0,0,0,0,0,0,0,0YULETIDE IMAGES GIFT WRAP SET,38,0,0,0,0,0,12,0,0,0,0,0,0,0,0,0,0,0,0,0,0,0,0,0SET/4 RED MINI ROSE CANDLE IN BOWL,54,0,0,0,0,0,0,0,0,0,0,0,0,0,0,0,0,0,0,0,0,0,0,015CM CHRISTMAS GLASS BALL 20 LIGHTS,104,0,0,0,0,0,0,0,0,0,0,0,0,0,0,0,0,0,0,0,0,0,0,0CREAM SWEETHEART LETTER RACK,206,0,0,0,0,0,0,0,0,0,0,0,0,0,0,0,0,0,0,0,0,0,0,0SMALL SQUARE CUT GLASS CANDLESTICK,18,0,0,0,0,0,0,0,0,0,0,0,0,0,0,0,0,0,0,0,0,0,0,0BEADED CRYSTAL HEART PINK SMALL,19,0,0,0,0,0,0,0,0,0,0,0,0,0,0,0,0,0,0,0,0,0,0,0BEADED CRYSTAL HEART GREEN ON STICK,53,0,0,0,0,0,0,0,0,0,0,0,0,0,0,0,0,0,0,0,0,0,0,0CHARLIE + LOLA BISCUITS TINS,23,0,0,0,0,0,0,0,0,0,0,0,0,0,0,0,0,0,0,0,0,0,0,0RED DRAGONFLY HELICOPTER,40,2,0,0,0,0,0,0,0,0,0,0,0,0,0,0,0,0,0,0,0,0,0,0SEWING SUSAN 21 NEEDLE SET,48,0,0,0,0,0,0,0,0,0,0,0,0,0,0,0,0,0,0,0,0,0,0,0BASKET OF FLOWERS SEWING KIT,29,0,0,0,0,0,0,0,0,0,0,0,0,0,96,0,0,0,0,0,0,0,0,0VICTORIAN SEWING KIT,220,0,0,0,0,0,0,0,0,0,0,0,0,0,0,0,0,0,0,144,0,0,0,0EASTER BUNNY GARLAND OF FLOWERS,4,0,0,0,0,0,0,0,0,0,0,0,0,0,0,0,0,0,0,0,0,0,0,0SET OF 3 BABUSHKA STACKING TINS,26,0,0,0,0,0,0,0,0,0,0,0,0,0,0,0,0,0,0,240,0,0,0,0MIDNIGHT BLUE PAIR HEART HAIR SLIDE,3,0,0,0,0,0,0,0,0,0,0,0,0,0,0,0,0,0,0,0,0,0,0,0SILVER M.O.P ORBIT DROP EARRINGS,6,0,0,0,0,0,0,0,0,0,0,0,0,0,0,0,0,0,0,0,0,0,0,0EDWARDIAN DROP EARRINGS JET BLACK,7,0,0,0,0,0,0,0,0,0,0,0,0,0,0,0,0,0,0,0,0,0,0,0RUBY GLASS CLUSTER EARRINGS,12,0,0,0,0,0,0,0,0,0,0,0,0,0,0,0,0,0,0,0,0,0,0,0NECKLACE+BRACELET SET BLUE HIBISCUS,7,0,0,0,0,0,0,0,0,0,0,0,0,0,0,0,0,0,0,0,0,0,0,0FRUIT SALAD BAG CHARM,3,0,0,0,0,0,0,0,0,0,0,0,0,0,0,0,0,0,0,0,0,0,0,0GREEN MURANO TWIST BRACELET,8,0,0,0,0,0,0,0,0,0,0,0,0,0,0,0,0,0,0,0,0,0,0,0PINK GLASS TASSLE BAG CHARM ,16,0,0,0,0,0,0,0,0,0,0,0,0,0,0,0,0,0,0,0,0,0,0,0TURQUOISE GLASS TASSLE BAG CHARM ,26,0,0,0,0,0,0,0,0,0,0,0,0,0,0,0,0,0,0,0,0,0,0,0ANT COPPER RED BOUDICCA BRACELET,6,0,0,0,0,0,0,0,0,0,0,0,0,0,0,0,0,0,0,0,0,0,0,0SILVER/AMETHYST DROP EARRINGS LEAF,6,0,0,0,0,0,0,0,0,0,0,0,0,0,0,0,0,0,0,0,0,0,0,0SILVER LARIAT BLACK STONE EARRINGS,4,0,0,0,0,0,0,0,0,0,0,0,0,0,0,0,0,0,0,0,0,0,0,0GREEN ENAMEL+GLASS HAIR COMB,14,0,0,0,0,0,0,0,0,0,0,0,0,0,0,0,0,0,0,0,0,0,0,0"LETTER ""D"" BLING KEY RING",5,0,0,0,0,0,0,0,0,0,0,0,0,0,0,0,0,0,0,0,0,0,0,0"LETTER ""G"" BLING KEY RING",5,0,0,0,0,0,0,0,0,0,0,0,0,0,0,0,0,0,0,0,0,0,0,0"LETTER ""H"" BLING KEY RING",8,0,0,0,0,0,0,0,0,0,0,0,0,0,0,0,0,0,0,0,0,0,0,0"LETTER ""J"" BLING KEY RING",10,0,0,0,0,0,0,0,0,0,0,0,0,0,0,0,0,0,0,0,0,0,0,0"LETTER ""R"" BLING KEY RING",6,0,0,0,0,0,0,0,0,0,0,0,0,0,0,0,0,0,0,0,0,0,0,0DOTCOM POSTAGE,59,0,0,0,0,0,0,0,0,0,0,0,0,0,0,0,0,0,0,0,0,0,0,0FAIRY CAKE NOTEBOOK A5 SIZE,54,0,0,0,0,0,0,0,0,0,0,0,0,0,0,0,0,0,0,0,0,0,0,0FAIRY CAKES NOTEBOOK A6 SIZE,86,0,0,0,0,0,0,0,0,0,0,0,0,0,0,0,0,0,0,0,0,0,0,0ENGLISH ROSE NOTEBOOK A7 SIZE,228,0,0,0,0,0,0,0,0,0,0,0,0,0,0,0,0,0,0,0,0,0,0,0FAIRY CAKES NOTEBOOK A7 SIZE,102,0,0,0,0,0,0,0,0,0,0,0,0,0,0,0,0,0,0,0,0,0,0,0MOUSE TOY WITH PINK T-SHIRT,40,0,0,0,0,0,0,0,0,0,0,0,0,0,0,0,0,0,0,0,0,0,0,0DOG TOY WITH PINK CROCHET SKIRT,7,0,0,0,0,0,0,0,0,0,0,0,0,0,0,0,0,0,0,0,0,0,0,0BOYS ALPHABET IRON ON PATCHES,61,0,0,0,0,0,0,0,0,0,0,0,0,0,0,0,0,0,0,0,0,0,0,0GREEN ROSE WASHBAG,34,0,0,0,0,0,0,0,0,0,0,0,0,0,0,0,0,0,0,0,0,0,0,0SOFT PINK ROSE TOWEL ,37,0,0,0,0,0,0,0,0,0,0,0,0,0,0,0,0,0,0,0,0,0,0,0MINT GREEN ROSE TOWEL,38,0,0,0,0,0,0,0,0,0,0,0,0,0,0,0,0,0,0,0,0,0,0,0PINK BUTTERFLY HANDBAG W BOBBLES,25,0,0,0,0,0,0,0,0,0,0,0,0,0,0,0,0,0,0,0,0,0,0,0ANTIQUE SILVER TEA GLASS ETCHED,2220,0,0,0,0,0,0,0,0,0,0,0,0,0,0,0,0,0,0,0,0,0,0,0SET OF 72 PINK HEART PAPER DOILIES,125,0,0,0,12,0,0,0,0,0,0,0,0,0,120,0,0,0,0,0,0,0,48,0DENIM PATCH PURSE PINK BUTTERFLY,41,0,0,0,0,0,0,0,0,0,0,0,0,0,0,0,0,0,0,0,0,0,0,0BLUE PATCH PURSE PINK HEART,81,0,0,0,0,0,0,0,0,0,0,0,0,0,0,0,0,0,0,0,0,0,0,0RED SPOTTY BISCUIT TIN,95,0,0,48,0,0,0,0,0,0,0,0,0,0,24,0,0,0,0,0,0,0,0,0VINTAGE CREAM CAT FOOD CONTAINER,51,0,0,0,0,0,4,0,0,0,0,0,0,0,0,0,0,0,0,0,0,0,0,0ASSTD DESIGN RACING CAR PEN,58,0,0,0,0,0,16,0,0,0,0,0,0,0,0,0,0,0,0,0,0,0,0,0KITTY PENCIL ERASERS,60,0,0,0,0,0,0,0,0,0,0,0,0,0,0,0,0,0,0,0,0,0,0,0BROCADE RING PURSE ,1943,0,0,0,36,0,0,0,0,0,0,0,0,0,0,0,0,0,0,0,0,0,0,0ORIGAMI SANDLEWOOD INCENSE+FLOWER,2,0,0,0,0,0,0,0,0,0,0,0,0,0,0,0,0,0,0,0,0,0,0,0ORIGAMI VANILLA INCENSE/CANDLE SET ,34,0,0,0,0,0,0,0,0,0,0,0,0,0,0,0,0,0,0,0,0,0,0,0ORIGAMI JASMINE INCENSE/CANDLE SET,38,0,0,0,0,0,6,0,0,0,0,0,0,0,0,0,0,0,0,0,0,0,0,0ORIGAMI LAVENDER INCENSE/CANDL SET ,132,0,0,0,0,0,0,0,0,0,0,0,0,0,0,0,0,0,0,0,0,0,0,0ORIGAMI ROSE INCENSE/CANDLE SET ,9,0,0,0,0,0,6,0,0,0,0,0,0,0,0,0,0,0,0,0,0,0,0,0ORIGAMI OPIUM INCENSE/CANDLE SET ,62,0,0,0,0,0,6,0,0,0,0,0,0,0,0,0,0,0,0,0,0,0,0,0ORIGAMI SANDLEWOOD INCENSE/CAND SET,31,0,0,0,0,0,12,0,0,0,0,0,0,0,0,0,0,0,0,0,0,0,0,0BLUE GLASS GEMS IN BAG,5,0,0,0,0,0,0,0,0,0,0,0,0,0,0,0,0,0,0,0,0,0,0,0PORCELAIN BUTTERFLY OIL BURNER,184,0,0,0,0,0,0,0,0,0,0,0,0,0,0,0,0,0,0,0,0,0,0,0VIPPASSPORT COVER ,57,0,0,0,0,0,0,0,0,0,0,0,0,0,0,0,0,0,0,0,0,0,0,0RED RETROSPOT LUGGAGE TAG,40,0,0,0,0,0,0,0,0,0,12,0,0,0,0,0,0,0,0,0,0,0,0,0