Product,United Kingdom,France,Australia,Netherlands,Germany,Norway,EIRE,Switzerland,Spain,Poland,Portugal,Italy,Belgium,Lithuania,Japan,Iceland,Channel Islands,Denmark,Cyprus,Sweden,Austria,Israel,Finland,BahrainWHITE HANGING HEART T-LIGHT HOLDER,4215,0,0,0,0,0,48,0,1,0,6,0,0,0,0,0,0,0,64,0,0,0,0,0WHITE METAL LANTERN,225,0,0,0,0,0,0,0,0,0,0,0,0,0,0,0,0,0,0,0,0,0,0,0CREAM CUPID HEARTS COAT HANGER,288,0,0,0,0,0,0,0,0,0,0,0,0,0,0,0,0,0,0,0,0,0,0,0KNITTED UNION FLAG HOT WATER BOTTLE,1274,0,0,0,0,0,0,0,0,0,0,0,0,0,0,0,0,0,0,0,0,0,0,0RED WOOLLY HOTTIE WHITE HEART.,1826,4,0,0,0,0,0,0,8,0,0,0,0,0,0,0,0,0,0,0,0,0,0,0SET 7 BABUSHKA NESTING BOXES,464,2,0,0,32,0,6,0,0,0,0,0,0,0,0,0,0,24,0,0,0,0,0,0GLASS STAR FROSTED T-LIGHT HOLDER,213,0,0,0,0,0,0,0,0,0,0,0,0,0,0,0,0,0,0,0,0,0,0,0HAND WARMER UNION JACK,963,0,0,0,0,0,0,0,0,0,0,0,0,0,0,0,0,0,0,0,0,0,0,0HAND WARMER RED POLKA DOT,120,0,0,0,0,0,0,0,0,0,0,0,0,0,0,0,0,0,0,0,0,0,0,0ASSORTED COLOUR BIRD ORNAMENT,2571,120,0,0,16,0,0,0,0,0,0,0,0,0,0,0,0,0,24,0,0,0,0,0POPPY'S PLAYHOUSE BEDROOM ,165,6,0,0,12,0,6,0,0,0,0,0,0,0,0,0,0,0,1,0,0,0,0,0POPPY'S PLAYHOUSE KITCHEN,173,12,0,0,6,0,6,0,0,0,0,0,0,0,0,0,0,0,1,0,0,0,0,0FELTCRAFT PRINCESS CHARLOTTE DOLL,136,5,0,48,0,0,4,0,0,0,0,0,0,0,16,0,0,0,2,12,0,0,0,0IVORY KNITTED MUG COSY ,165,0,0,0,0,0,0,0,0,0,0,0,0,0,0,0,0,0,0,0,0,0,0,0BOX OF 6 ASSORTED COLOUR TEASPOONS,48,0,0,0,0,0,0,0,0,0,0,0,0,0,0,6,0,0,0,0,0,0,0,0BOX OF VINTAGE JIGSAW BLOCKS ,63,0,0,0,0,0,6,0,0,0,3,0,0,0,20,0,0,0,0,0,0,0,0,0BOX OF VINTAGE ALPHABET BLOCKS,340,0,0,0,0,0,6,0,0,0,2,0,0,0,0,0,0,0,0,0,0,0,0,0HOME BUILDING BLOCK WORD,377,0,0,0,0,0,11,0,6,0,3,0,0,0,0,0,0,0,0,0,0,0,0,0LOVE BUILDING BLOCK WORD,181,0,0,0,0,0,0,0,9,0,0,0,0,0,0,0,0,0,0,0,0,0,0,0RECIPE BOX WITH METAL HEART,12,0,0,0,0,0,0,0,0,0,0,0,0,0,0,0,0,0,0,0,0,0,0,0DOORMAT NEW ENGLAND,215,0,0,0,0,0,2,0,0,0,0,0,0,0,0,0,0,0,0,0,0,0,0,0JAM MAKING SET WITH JARS,550,0,0,1,24,0,30,0,0,0,12,0,0,0,0,0,0,6,0,0,0,0,0,0RED COAT RACK PARIS FASHION,22,0,0,0,6,0,0,0,1,0,0,0,0,0,0,0,0,0,0,0,0,0,0,0YELLOW COAT RACK PARIS FASHION,33,0,0,0,0,0,0,0,1,0,0,0,0,0,0,0,0,0,0,0,0,0,0,0BLUE COAT RACK PARIS FASHION,41,0,0,0,3,0,6,0,1,0,0,0,0,0,0,0,0,6,0,0,0,0,0,0BATH BUILDING BLOCK WORD,75,0,0,0,0,0,0,0,0,0,3,0,0,0,0,0,0,0,0,0,0,0,0,0ALARM CLOCK BAKELIKE PINK,267,28,4,0,36,0,0,4,0,0,0,0,4,0,0,4,0,12,0,0,0,0,0,0ALARM CLOCK BAKELIKE RED ,488,28,4,0,12,0,0,4,0,0,0,0,4,0,0,4,0,12,0,0,0,0,0,0ALARM CLOCK BAKELIKE GREEN,476,16,4,0,0,0,0,4,2,0,0,0,4,0,0,4,0,12,0,0,0,0,0,0PANDA AND BUNNIES STICKER SHEET,40,12,0,0,0,0,0,0,0,0,0,0,0,0,0,0,0,0,0,0,0,0,0,0STARS GIFT TAPE ,293,48,0,0,36,0,0,0,2,0,0,0,0,0,0,0,0,0,0,0,0,0,0,0INFLATABLE POLITICAL GLOBE ,203,108,0,0,0,0,12,0,0,0,0,0,0,0,0,0,0,0,0,0,0,0,0,0VINTAGE HEADS AND TAILS CARD GAME ,1159,60,12,0,12,0,0,0,0,0,12,0,12,0,0,0,0,0,0,0,0,0,0,0SET/2 RED RETROSPOT TEA TOWELS ,94,18,0,0,18,0,0,0,0,0,0,0,0,0,0,0,0,0,0,0,0,0,0,0ROUND SNACK BOXES SET OF4 WOODLAND ,133,66,0,192,114,0,0,30,0,0,0,0,0,0,0,0,0,12,0,6,0,0,0,0SPACEBOY LUNCH BOX ,697,24,0,128,36,0,0,12,0,0,0,0,0,0,0,0,0,0,0,0,0,0,0,0LUNCH BOX I LOVE LONDON,1476,36,64,0,24,0,0,12,0,0,0,0,64,0,0,0,0,0,0,0,0,0,0,0CIRCUS PARADE LUNCH BOX ,49,25,0,0,12,0,0,12,1,0,0,0,0,0,0,0,0,0,0,0,0,0,0,0CHARLOTTE BAG DOLLY GIRL DESIGN,99,50,0,0,0,0,0,0,0,0,0,0,0,0,100,0,0,0,0,0,0,0,0,0RED TOADSTOOL LED NIGHT LIGHT,1213,192,0,288,108,0,0,24,0,0,0,0,0,0,0,12,0,0,0,48,0,0,0,0 SET 2 TEA TOWELS I LOVE LONDON ,294,24,0,0,0,0,0,0,0,0,0,0,0,0,0,0,0,0,0,0,0,0,0,0VINTAGE SEASIDE JIGSAW PUZZLES,29,12,0,0,0,0,0,0,0,0,0,0,0,0,0,0,0,0,0,0,0,0,0,0MINI JIGSAW CIRCUS PARADE ,59,24,0,0,0,48,0,24,0,0,24,0,0,0,0,0,0,0,0,0,0,0,0,0MINI JIGSAW SPACEBOY,242,48,0,0,0,48,0,24,0,0,0,0,0,0,0,0,0,0,0,0,0,0,0,0MINI PAINT SET VINTAGE ,2494,108,576,0,0,0,36,0,0,0,0,0,576,0,0,36,0,0,0,0,0,0,0,0POSTAGE,1,59,0,2,109,0,0,2,5,0,14,5,0,0,0,0,0,8,0,5,3,0,6,0PAPER CHAIN KIT 50'S CHRISTMAS ,2459,6,0,0,0,0,6,0,0,0,0,0,0,0,0,0,0,0,0,0,0,0,0,0EDWARDIAN PARASOL RED,97,27,0,0,12,0,9,0,0,0,0,0,0,12,0,0,0,0,0,0,0,0,0,0RETRO COFFEE MUGS ASSORTED,521,0,0,0,0,0,0,0,0,0,0,0,0,0,0,0,0,0,0,0,0,0,0,0SAVE THE PLANET MUG,298,0,0,0,12,0,0,24,0,0,0,0,0,0,0,0,0,0,0,0,0,0,0,0VINTAGE BILLBOARD DRINK ME MUG,254,0,0,0,0,0,0,0,0,0,0,0,0,0,0,0,0,0,0,0,0,0,0,0VINTAGE BILLBOARD LOVE/HATE MUG,347,0,0,0,0,0,0,0,0,0,0,0,0,0,0,0,0,0,0,0,0,0,0,0WOOD 2 DRAWER CABINET WHITE FINISH,349,0,0,0,0,0,0,0,0,0,0,0,0,0,0,0,0,0,0,0,0,0,0,0WOOD S/3 CABINET ANT WHITE FINISH,268,0,0,0,0,0,0,0,0,0,0,0,0,0,0,0,0,0,0,0,0,0,0,0WOODEN PICTURE FRAME WHITE FINISH,603,0,0,0,0,0,12,0,0,0,0,0,0,0,0,0,0,0,0,0,0,0,0,0WOODEN FRAME ANTIQUE WHITE ,835,0,0,0,6,0,6,0,0,0,6,0,0,0,0,0,0,0,0,0,0,0,0,0VICTORIAN SEWING BOX LARGE,273,0,0,0,16,0,1,0,0,0,0,0,0,0,0,0,0,0,0,0,0,0,0,0HOT WATER BOTTLE TEA AND SYMPATHY,1170,4,0,0,0,16,16,0,0,0,4,0,0,0,0,0,0,0,0,0,0,0,0,0RED HANGING HEART T-LIGHT HOLDER,705,0,0,0,0,12,24,0,0,32,0,0,0,0,0,0,0,0,16,0,0,0,0,0JUMBO BAG PINK POLKADOT,739,10,0,0,10,0,0,0,10,0,0,0,0,0,0,0,0,0,0,0,0,0,0,0JUMBO  BAG BAROQUE BLACK WHITE,1205,0,0,0,0,0,0,0,10,0,0,0,0,0,0,0,0,0,0,0,0,0,0,0JUMBO BAG CHARLIE AND LOLA TOYS,125,0,0,0,0,0,0,0,0,0,0,0,0,0,0,0,0,0,0,0,0,0,0,0STRAWBERRY CHARLOTTE BAG,454,0,0,0,0,0,0,0,0,0,0,0,0,0,0,0,0,0,0,0,0,0,0,0RED 3 PIECE RETROSPOT CUTLERY SET,646,6,0,72,0,0,0,0,0,0,0,0,0,0,0,6,0,0,0,0,0,0,0,0BLUE 3 PIECE POLKADOT CUTLERY SET,113,6,0,72,0,0,0,0,0,0,0,0,0,0,0,6,0,0,0,0,0,0,0,0SET/6 RED SPOTTY PAPER PLATES,655,12,0,0,0,0,0,0,0,0,0,0,0,0,0,0,0,0,0,0,0,0,0,0LUNCH BAG RED RETROSPOT,945,60,10,0,0,0,10,0,70,0,10,0,10,0,0,0,0,0,0,0,0,0,0,0STRAWBERRY LUNCH BOX WITH CUTLERY,150,42,0,0,6,0,0,0,0,0,0,0,0,0,0,0,0,0,0,0,0,0,0,0LUNCH BOX WITH CUTLERY RETROSPOT ,97,48,0,60,6,0,0,0,0,0,6,0,0,0,0,0,0,0,0,0,0,0,0,0PACK OF 72 RETROSPOT CAKE CASES,3320,72,0,240,72,48,72,0,0,0,0,0,0,0,0,0,0,0,0,240,0,0,0,0PACK OF 60 DINOSAUR CAKE CASES,693,24,0,0,24,0,0,0,0,0,0,0,0,0,0,0,0,0,0,0,0,0,0,0PACK OF 60 PINK PAISLEY CAKE CASES,1177,24,0,0,24,48,24,0,0,0,0,24,0,0,0,0,0,0,0,240,0,0,144,060 TEATIME FAIRY CAKE CASES,1338,0,0,0,48,48,96,0,0,0,0,0,0,0,0,0,0,0,0,0,0,0,144,0TOMATO CHARLIE+LOLA COASTER SET,83,0,0,0,0,0,0,0,0,0,0,0,0,0,0,0,0,0,0,0,0,0,0,0CHARLIE & LOLA WASTEPAPER BIN FLORA,58,0,0,0,0,0,0,0,0,0,0,0,0,0,0,0,0,0,0,0,0,0,0,0RED CHARLIE+LOLA PERSONAL DOORSIGN,106,0,0,0,0,0,0,0,0,0,0,0,0,0,0,0,0,0,0,0,0,0,0,0JUMBO STORAGE BAG SUKI,688,0,0,1,0,0,0,0,0,0,20,0,0,0,0,0,0,0,0,0,0,0,0,0JUMBO BAG PINK VINTAGE PAISLEY,769,0,0,0,0,0,0,0,0,0,10,0,0,0,0,0,0,0,0,0,0,0,0,0JAM MAKING SET PRINTED,1384,60,0,0,144,48,48,0,0,12,0,0,0,0,60,0,0,0,0,0,0,0,0,0RETROSPOT TEA SET CERAMIC 11 PC ,56,0,0,0,0,0,0,0,0,0,0,0,0,0,0,0,0,0,0,0,0,0,0,0GIRLY PINK TOOL SET,5,0,0,0,0,0,0,0,0,0,0,0,0,0,0,0,0,0,0,0,0,0,0,0JUMBO SHOPPER VINTAGE RED PAISLEY,734,0,0,0,0,0,20,0,0,0,20,0,0,0,0,0,0,0,0,0,0,0,0,0AIRLINE LOUNGE-METAL SIGN,59,0,0,0,0,0,0,0,0,0,0,0,0,0,0,0,0,0,0,0,0,0,0,0WHITE SPOT RED CERAMIC DRAWER KNOB,325,0,0,0,12,0,48,0,0,0,0,0,0,0,0,0,0,0,0,0,0,0,0,0RED DRAWER KNOB ACRYLIC EDWARDIAN,398,0,0,0,0,0,0,0,0,0,0,0,0,0,0,12,0,0,0,0,0,0,0,0CLEAR DRAWER KNOB ACRYLIC EDWARDIAN,462,0,0,0,0,0,0,0,0,0,0,0,0,0,0,12,0,0,0,0,0,0,0,0PHOTO CLIP LINE,6,0,0,0,0,0,0,0,0,0,0,0,0,0,0,0,0,0,0,0,0,0,0,0FELT EGG COSY CHICKEN,76,0,0,0,0,0,0,0,0,0,0,0,0,0,0,0,0,0,0,0,0,0,0,0PIGGY BANK RETROSPOT ,200,0,0,0,0,0,0,0,0,0,12,0,0,0,0,0,0,0,0,0,0,0,0,0SKULL SHOULDER BAG,154,0,0,0,0,0,0,0,10,0,0,0,0,0,0,0,0,0,0,0,0,0,0,0YOU'RE CONFUSING ME METAL SIGN ,165,0,0,0,0,0,0,0,0,0,0,0,0,0,0,0,12,0,0,0,0,0,0,0COOK WITH WINE METAL SIGN ,659,0,0,0,0,24,12,0,0,0,0,0,0,0,0,0,0,0,0,0,0,0,0,0GIN + TONIC DIET METAL SIGN,468,0,0,0,12,0,0,0,0,0,0,0,0,0,0,0,0,0,0,0,0,0,0,0YELLOW BREAKFAST CUP AND SAUCER,6,0,0,0,0,0,0,0,0,0,0,0,0,0,0,0,0,0,0,0,0,0,0,0PINK BREAKFAST CUP AND SAUCER ,3,0,0,0,0,0,0,0,0,0,0,0,0,0,0,0,0,0,0,0,0,0,0,0PAPER CHAIN KIT RETROSPOT,485,0,0,0,0,0,0,0,0,0,0,0,0,0,0,0,0,0,1,0,0,0,0,0SMALL HEART FLOWERS HOOK ,176,0,0,0,0,0,0,0,0,0,0,0,0,0,0,0,0,0,0,0,0,0,0,0TEA TIME DES TEA COSY,64,0,0,0,0,0,0,0,0,0,0,0,0,0,0,0,0,0,0,0,0,0,0,0FELT EGG COSY WHITE RABBIT ,30,0,0,0,0,0,0,0,0,0,0,0,0,0,0,0,0,0,0,0,0,0,0,0ZINC WILLIE WINKIE  CANDLE STICK,225,0,0,0,0,0,12,0,0,0,0,0,0,0,0,0,0,0,0,0,0,0,0,0CERAMIC CHERRY CAKE MONEY BANK,323,24,0,0,24,0,0,0,0,0,0,0,0,0,0,0,0,0,0,0,0,0,0,0RETROSPOT LARGE MILK JUG,83,15,0,0,0,0,6,0,0,0,0,0,0,0,0,0,0,0,0,0,0,0,0,0SET OF 6 FUNKY BEAKERS,68,0,0,0,0,0,0,0,0,0,0,0,0,0,0,0,0,0,0,0,0,0,0,0EDWARDIAN PARASOL BLACK,228,30,0,0,0,0,9,0,0,0,0,0,0,12,0,0,0,0,0,0,0,0,0,0EDWARDIAN PARASOL NATURAL,136,6,0,0,0,0,6,0,0,0,0,3,0,12,0,0,0,0,0,0,0,0,0,0CERAMIC STRAWBERRY CAKE MONEY BANK,461,0,0,0,36,0,0,0,1,0,0,0,0,0,0,0,0,0,0,0,0,0,0,0BLUE OWL SOFT TOY,24,0,0,0,0,0,0,0,0,0,0,0,0,0,0,0,0,0,0,0,0,0,0,0BALLOON ART MAKE YOUR OWN FLOWERS,52,0,0,0,0,0,0,0,0,0,0,0,0,0,0,0,0,0,0,0,0,0,0,0GLASS CLOCHE SMALL,82,0,0,0,8,0,0,0,0,0,0,0,0,0,0,0,0,0,0,0,0,0,0,0GUMBALL MONOCHROME COAT RACK,105,0,0,0,0,0,0,0,0,0,0,0,0,0,0,0,0,0,0,0,0,0,0,0DOORMAT FANCY FONT HOME SWEET HOME,189,0,0,0,0,0,14,0,0,0,0,0,0,0,0,0,2,0,0,0,0,0,0,0Discount,0,0,0,0,0,0,0,0,0,0,0,0,0,0,0,0,0,0,0,0,0,0,0,0VINTAGE SNAKES & LADDERS,123,0,0,0,0,0,8,0,0,0,0,0,0,0,0,0,0,0,0,0,0,0,0,0CHOCOLATE CALCULATOR,120,0,0,0,0,0,24,24,0,0,12,0,0,0,0,0,0,0,0,0,0,0,0,0RECYCLING BAG RETROSPOT ,1066,0,100,0,5,0,0,0,0,0,0,0,100,0,0,0,0,0,0,0,0,0,0,0TOY TIDY PINK POLKADOT,237,0,0,0,0,0,0,0,0,0,0,0,0,0,0,0,0,0,0,0,0,0,0,0ANTIQUE GLASS DRESSING TABLE POT,215,0,0,0,0,0,8,0,0,0,0,0,0,0,0,0,0,0,0,0,0,0,0,0IVORY GIANT GARDEN THERMOMETER,87,0,12,0,4,0,0,0,0,0,0,0,12,0,0,0,0,0,0,0,0,0,0,03 TIER CAKE TIN GREEN AND CREAM,35,0,0,0,0,0,0,0,0,0,0,0,0,0,0,0,0,0,0,0,0,0,0,03 TIER CAKE TIN RED AND CREAM,25,0,0,0,0,0,0,0,0,0,0,0,0,0,0,0,0,0,0,0,0,0,0,0SET 3 WICKER OVAL BASKETS W LIDS,52,0,0,0,0,0,0,0,0,0,0,0,0,0,0,0,0,0,0,0,0,0,0,0SET OF 3 COLOURED  FLYING DUCKS,318,0,6,0,0,0,0,0,0,0,0,0,6,0,0,0,0,0,0,0,0,0,0,0WOOD BLACK BOARD ANT WHITE FINISH,1387,0,0,0,0,0,0,0,0,0,0,0,0,0,0,0,0,0,0,0,0,0,0,0COLOUR GLASS T-LIGHT HOLDER HANGING,452,0,0,0,0,0,0,0,0,0,0,0,0,0,0,0,0,0,0,0,0,0,0,0HANGING METAL HEART LANTERN,175,0,0,0,0,0,0,0,0,0,0,0,0,0,0,0,0,0,0,0,0,0,0,0HANGING MEDINA LANTERN SMALL,15,0,0,0,0,0,0,0,0,0,0,0,0,0,0,0,0,0,0,0,0,0,0,0NATURAL SLATE HEART CHALKBOARD ,813,0,0,0,0,0,0,0,0,0,6,0,0,0,0,0,0,0,0,0,0,0,0,0HEART OF WICKER SMALL,2069,2,0,0,0,0,0,0,1,0,0,0,0,0,0,0,0,0,0,0,0,0,0,0HEART OF WICKER LARGE,1167,0,0,0,0,0,0,0,0,0,0,0,0,0,0,0,0,0,0,0,0,0,0,0WHITE LOVEBIRD LANTERN,48,0,0,0,0,0,0,0,0,0,0,0,0,0,0,0,0,0,0,0,0,0,0,0CLASSIC METAL BIRDCAGE PLANT HOLDER,53,0,0,0,0,0,0,0,8,0,0,0,0,0,0,0,0,0,0,0,0,0,0,0CREAM HEART CARD HOLDER,2296,0,0,0,0,0,16,0,0,0,0,0,0,0,0,0,0,0,0,0,0,0,0,0ENAMEL FLOWER JUG CREAM,68,0,0,0,0,0,0,0,0,0,0,0,0,0,0,0,0,0,0,0,0,0,0,0ENAMEL FIRE BUCKET CREAM,33,0,0,0,0,0,0,0,0,0,0,0,0,0,0,0,0,0,0,0,0,0,0,0ENAMEL BREAD BIN CREAM,54,0,0,0,0,0,0,0,0,0,0,0,0,0,0,0,0,0,0,0,0,0,0,0JUMBO BAG DOLLY GIRL DESIGN,88,0,0,0,0,0,0,0,0,0,0,0,0,0,0,0,0,0,0,0,0,0,0,0TRADITIONAL CHRISTMAS RIBBONS,392,12,0,0,0,0,0,0,0,0,0,0,0,0,0,0,0,0,0,0,0,0,0,0ORGANISER WOOD ANTIQUE WHITE ,18,0,0,0,0,0,0,0,0,0,0,0,0,0,0,0,0,0,0,0,0,0,0,0LUNCH BAG DOLLY GIRL DESIGN,159,3,0,0,0,0,0,0,0,0,0,0,0,0,60,0,0,0,0,0,0,0,0,0WHITE WIRE EGG HOLDER,101,0,0,0,0,0,0,0,0,0,0,0,0,0,12,0,0,0,0,0,0,0,0,0JUMBO BAG RED RETROSPOT,2860,0,10,0,40,0,10,0,10,0,10,0,10,0,0,0,0,0,0,0,0,0,0,0CHILLI LIGHTS,2394,0,0,0,0,0,4,0,0,0,0,0,0,0,0,0,0,0,0,0,0,0,0,0LIGHT GARLAND BUTTERFILES PINK,431,0,0,0,0,0,0,0,0,0,0,0,0,0,0,0,0,0,0,0,0,0,0,0WOODEN OWLS LIGHT GARLAND ,462,0,0,0,0,0,0,0,0,0,0,0,0,0,0,0,0,48,0,0,0,0,0,0FAIRY TALE COTTAGE NIGHTLIGHT,1013,24,0,0,0,0,0,0,0,0,0,0,0,0,0,0,0,0,0,12,0,0,0,0HOME SMALL WOOD LETTERS,51,0,0,0,0,0,3,0,0,0,0,0,0,0,0,0,0,0,0,0,0,0,0,0GINGHAM HEART  DOORSTOP RED,65,0,0,0,0,0,9,0,0,0,0,0,0,0,0,0,0,0,0,0,0,0,0,0FIVE HEART HANGING DECORATION,58,6,0,0,0,0,0,0,0,0,0,0,0,0,0,0,0,0,0,0,0,0,0,0ASSORTED BOTTLE TOP  MAGNETS ,220,12,120,0,0,0,0,0,0,0,0,0,120,0,0,0,0,0,0,120,0,0,0,0FRIDGE MAGNETS US DINER ASSORTED,153,0,0,0,0,0,0,0,0,0,0,0,0,0,0,0,0,0,0,0,0,0,0,0HOMEMADE JAM SCENTED CANDLES,1133,0,0,0,48,0,48,0,0,12,0,12,0,0,0,0,0,0,0,0,0,0,0,0FRIDGE MAGNETS LES ENFANTS ASSORTED,127,0,0,0,36,0,0,0,0,0,12,0,0,0,0,0,0,0,0,0,0,0,0,0ROSE CARAVAN DOORSTOP,21,0,0,0,0,0,0,0,0,0,0,0,0,0,0,0,0,0,0,0,0,0,0,05 HOOK HANGER MAGIC TOADSTOOL,135,0,0,0,24,0,0,0,0,0,0,0,0,0,36,0,0,0,0,12,0,0,0,0CHRISTMAS LIGHTS 10 REINDEER,128,0,6,0,0,0,12,0,0,0,0,0,6,0,0,0,0,0,0,0,0,0,0,0VINTAGE UNION JACK CUSHION COVER,43,0,8,0,4,0,0,0,0,0,0,0,8,0,0,0,0,0,0,0,0,0,0,0SET OF 3 GOLD FLYING DUCKS,0,0,4,0,0,0,0,0,0,0,0,0,4,0,0,0,0,0,0,0,0,0,0,0RED RETROSPOT UMBRELLA,73,0,6,0,12,0,0,0,0,0,6,0,6,0,0,0,0,0,0,0,0,0,0,0BLACK/BLUE POLKADOT UMBRELLA,75,0,3,0,0,0,0,0,0,0,6,0,3,0,0,0,0,0,0,0,0,0,0,0RED DINER WALL CLOCK,48,0,2,0,0,0,4,0,0,0,0,0,2,0,0,0,0,0,0,0,0,0,0,0BLUE DINER WALL CLOCK,33,0,2,0,0,0,0,0,0,0,0,0,2,0,0,0,0,0,0,0,0,0,0,0IVORY DINER WALL CLOCK,43,2,2,0,0,0,0,0,0,0,0,0,2,0,0,0,0,0,0,0,0,0,0,0LARGE HEART MEASURING SPOONS,240,0,36,0,0,0,0,0,0,0,0,0,36,0,0,12,0,0,0,0,0,0,0,0SMALL HEART MEASURING SPOONS,281,0,48,0,0,0,0,0,0,0,0,0,48,0,0,0,0,0,0,0,0,0,0,0JAM JAR WITH PINK LID,402,12,0,0,108,24,24,0,0,0,0,0,0,0,0,0,0,0,0,0,12,0,0,0JAM JAR WITH GREEN LID,346,0,0,0,108,24,24,0,0,0,0,0,0,0,0,0,0,0,0,0,0,0,0,0ROSE COTTAGE KEEPSAKE BOX ,108,8,0,0,20,0,4,0,0,0,0,0,0,0,0,0,0,0,0,0,0,0,0,0HANGING HEART ZINC T-LIGHT HOLDER,687,0,0,0,0,0,0,0,0,0,0,0,0,0,0,0,0,0,0,0,0,0,0,0PAPER CHAIN KIT VINTAGE CHRISTMAS,1532,7,0,0,0,0,6,0,0,0,0,0,0,0,0,0,0,0,0,0,0,0,0,0DISCO BALL CHRISTMAS DECORATION,1835,0,0,0,24,0,48,0,0,0,0,0,0,0,0,0,0,0,0,0,0,0,0,0SMALL POPCORN HOLDER,3180,36,0,0,24,144,60,0,0,0,0,0,0,0,0,0,0,0,0,0,0,0,0,0LARGE POPCORN HOLDER ,811,12,0,0,0,98,24,0,0,0,0,0,0,0,0,0,0,0,0,0,0,0,0,0SET/20 RED RETROSPOT PAPER NAPKINS ,850,24,0,0,0,72,0,0,0,0,0,0,0,0,12,0,0,0,0,0,0,0,0,0SET/6 RED SPOTTY PAPER CUPS,468,36,0,0,0,0,0,0,0,0,0,0,0,0,0,0,0,0,0,0,0,0,0,0POLKADOT RAIN HAT ,318,72,0,0,0,48,0,0,0,0,0,0,0,0,0,0,0,0,0,0,0,0,0,0DELUXE SEWING KIT ,290,9,0,0,6,0,3,0,0,0,0,0,0,0,21,0,0,0,0,0,0,0,0,0RETROSPOT HEART HOT WATER BOTTLE,656,6,0,0,15,0,0,0,0,0,3,0,0,0,0,0,3,0,0,0,0,0,0,0ENGLISH ROSE HOT WATER BOTTLE,346,0,0,0,8,0,4,0,0,0,0,0,0,0,0,0,0,0,0,0,0,0,0,0PHOTO CUBE,1301,6,0,0,0,0,0,0,0,0,0,0,0,0,0,0,0,0,0,0,0,0,0,0PLASTERS IN TIN CIRCUS PARADE ,227,60,0,0,60,48,0,12,24,0,12,0,0,0,0,0,0,0,0,0,0,0,0,0PACK OF 12 PINK PAISLEY TISSUES ,122,0,0,0,24,96,0,0,0,0,0,0,0,0,0,0,0,0,0,0,0,0,0,0PACK OF 12 BLUE PAISLEY TISSUES ,124,0,0,0,0,96,0,0,0,0,0,0,0,0,0,0,0,0,0,0,0,0,0,0PACK OF 12 RED RETROSPOT TISSUES ,221,49,0,0,0,96,0,0,0,0,0,0,0,0,0,0,0,0,0,0,0,0,0,0CHICK GREY HOT WATER BOTTLE,595,0,0,0,4,0,4,0,0,0,0,0,0,0,0,0,0,0,0,0,0,0,0,0PLASTERS IN TIN VINTAGE PAISLEY ,247,12,12,0,12,72,0,0,0,0,12,0,12,0,0,0,0,0,0,0,0,0,0,0PLASTERS IN TIN SKULLS,282,0,0,0,0,48,0,0,24,0,0,0,0,12,0,0,0,0,0,0,0,0,0,03 STRIPEY MICE FELTCRAFT,229,0,0,0,0,0,30,0,0,0,6,0,0,0,0,0,0,0,3,0,0,0,0,0SET OF 6 SOLDIER SKITTLES,213,4,80,0,0,0,4,0,0,0,0,0,80,0,32,0,0,0,0,0,0,0,0,0TRADITIONAL WOODEN SKIPPING ROPE,146,0,144,0,0,0,12,0,0,0,24,0,144,0,0,0,0,0,0,0,0,0,0,0WOODEN BOX OF DOMINOES,545,24,0,0,0,0,36,0,0,0,12,0,0,0,0,0,0,0,0,0,0,0,0,0RUSTIC  SEVENTEEN DRAWER SIDEBOARD,3,0,0,0,0,0,0,0,0,0,0,0,0,0,0,0,0,0,0,0,0,0,0,0PARTY CONES CARNIVAL ASSORTED,103,0,0,0,0,0,0,0,0,0,0,0,0,0,0,0,0,0,0,0,0,0,0,0PARTY CONES CANDY ASSORTED,156,0,0,0,0,0,0,0,0,0,0,0,0,0,0,0,0,0,0,0,0,0,0,0PICNIC BASKET WICKER SMALL,208,0,0,0,0,0,0,0,0,0,0,0,0,0,0,0,0,0,0,0,0,0,0,0STAR DECORATION PAINTED ZINC ,88,0,0,0,0,0,24,0,2,0,0,0,0,0,0,0,0,0,0,0,0,0,0,0RETROSPOT LAMP,37,4,0,0,0,0,4,0,0,0,0,0,0,0,0,0,0,0,0,0,0,0,0,0FANCY FONT BIRTHDAY CARD,24,0,0,0,0,0,0,0,0,0,0,0,0,0,0,0,0,0,0,0,0,0,0,0HAND WARMER SCOTTY DOG DESIGN,930,0,0,0,0,12,12,0,0,0,0,0,0,0,0,0,0,0,0,0,0,0,0,0HAND WARMER OWL DESIGN,959,0,0,0,36,12,12,0,0,0,0,0,0,0,0,0,0,0,0,0,0,0,0,0HAND WARMER RED RETROSPOT,723,12,0,0,0,12,12,0,0,0,0,0,0,0,0,0,0,0,0,0,0,0,0,0DOG BOWL CHASING BALL DESIGN,19,0,0,0,0,0,0,0,0,0,0,0,0,0,0,0,0,0,0,0,0,0,0,0CLOTHES PEGS RETROSPOT PACK 24 ,819,72,0,144,12,48,0,0,0,0,0,0,0,0,96,0,0,0,0,0,0,0,0,0HAND OVER THE CHOCOLATE   SIGN ,716,0,0,0,12,24,0,0,0,0,0,0,0,0,0,0,0,0,0,0,0,0,0,0TRAVEL SEWING KIT,444,30,0,0,30,0,10,0,0,0,0,0,0,0,0,0,0,0,0,0,0,0,0,0BLACK HEART CARD HOLDER,2161,0,0,0,0,0,0,0,0,0,0,0,0,0,0,0,0,0,0,0,0,0,0,0SMALL GLASS HEART TRINKET POT,585,0,0,0,0,0,0,0,0,0,0,0,0,0,0,0,0,0,0,0,0,0,0,0ALARM CLOCK BAKELIKE IVORY,210,0,0,0,12,0,0,4,0,0,0,0,0,0,0,0,0,20,0,0,0,0,0,0ALARM CLOCK BAKELIKE ORANGE,191,4,0,0,0,0,0,4,0,0,0,0,0,0,0,4,0,12,0,0,0,0,0,0HAND WARMER BIRD DESIGN,1483,0,0,96,12,0,12,0,0,0,12,0,0,0,0,0,0,0,0,0,0,0,0,0IVORY EMBROIDERED QUILT ,26,0,0,0,0,0,0,0,0,0,0,0,0,0,0,0,0,0,0,0,0,0,0,0SET OF 3 BLACK FLYING DUCKS,28,0,0,0,0,0,0,0,0,0,0,0,0,0,0,0,0,0,0,0,0,0,0,0RED RETROSPOT MUG,225,0,0,0,0,0,0,0,0,0,6,0,0,0,0,0,0,0,0,0,0,0,0,0BABUSHKA LIGHTS STRING OF 10,63,0,0,0,2,0,0,0,0,0,0,0,0,0,0,0,0,0,0,0,0,0,0,0DOORMAT FAIRY CAKE,102,0,0,0,2,0,0,0,0,0,0,0,0,0,0,0,0,0,0,0,0,0,0,0STRAWBERRY CERAMIC TRINKET BOX,1533,0,0,0,72,0,0,0,0,24,0,0,0,0,0,0,0,0,18,0,0,0,0,0PINK DOUGHNUT TRINKET POT ,178,12,0,0,12,0,0,0,0,0,0,0,0,0,0,0,0,0,0,0,0,0,0,0SILK PURSE BABUSHKA PINK,62,0,0,0,0,0,0,0,0,0,0,0,0,0,0,0,0,0,0,0,0,0,0,0HOT WATER BOTTLE I AM SO POORLY,597,0,0,0,0,0,12,0,0,0,0,0,0,0,0,0,0,0,0,0,0,0,0,0CHOCOLATE HOT WATER BOTTLE,1192,0,0,0,0,0,24,16,0,0,0,0,0,0,0,0,3,0,0,0,0,0,0,0WHITE SKULL HOT WATER BOTTLE ,1414,0,0,0,0,0,0,0,4,0,0,0,0,0,0,0,0,0,0,0,0,0,0,0SCOTTIE DOG HOT WATER BOTTLE,962,3,0,0,3,0,0,0,0,0,0,0,0,0,0,0,0,0,0,0,0,0,0,0BIRD HOUSE HOT WATER BOTTLE,308,12,0,0,0,0,0,0,0,0,0,0,0,0,0,0,0,0,0,0,0,0,0,0BOUDOIR SQUARE TISSUE BOX,37,0,0,0,0,0,0,0,0,0,0,0,0,0,0,0,0,0,0,0,0,0,0,0SKULLS SQUARE TISSUE BOX,17,0,0,0,0,0,0,0,0,0,0,0,0,0,0,0,0,0,0,0,0,0,0,0PHOTO FRAME CORNICE,172,0,0,0,0,0,0,0,0,0,0,0,0,0,0,0,0,0,0,0,0,0,0,0SILK PURSE BABUSHKA RED,104,6,0,0,0,0,0,0,0,0,0,0,0,0,0,0,0,0,0,0,0,0,0,0PICTURE DOMINOES,232,36,0,0,24,0,12,0,0,0,0,0,0,0,72,0,0,0,0,0,0,0,0,0S/6 SEW ON CROCHET FLOWERS,20,1,0,0,0,0,0,0,0,0,0,0,0,0,0,0,0,0,0,0,0,0,0,0SCANDINAVIAN REDS RIBBONS,346,1,0,0,36,0,12,0,0,0,0,0,0,0,0,0,0,0,0,0,0,0,0,0BALLOONS  WRITING SET ,154,1,0,0,12,0,0,0,0,0,0,0,0,0,0,0,0,0,0,0,0,0,0,0LAVENDER INCENSE IN TIN,54,0,0,0,0,0,0,0,0,0,0,0,0,0,0,0,0,0,0,0,0,0,0,0TV DINNER TRAY VINTAGE PAISLEY,199,0,0,0,0,0,0,0,0,0,0,0,0,0,0,0,0,0,0,0,0,0,0,0SET OF 4 ENGLISH ROSE PLACEMATS,66,0,0,0,0,0,0,0,0,0,0,0,0,0,0,0,0,0,0,0,0,0,0,0SET OF 4 ENGLISH ROSE COASTERS,65,0,0,0,0,0,0,0,0,0,0,0,0,0,0,0,0,0,0,0,0,0,0,0TRIPLE PHOTO FRAME CORNICE ,48,0,0,0,0,0,0,0,0,0,0,0,0,0,0,0,0,0,0,0,0,0,0,0FAMILY PHOTO FRAME CORNICE,100,0,0,0,0,0,2,0,0,0,0,0,0,0,0,0,0,0,0,0,0,0,0,0MIRRORED DISCO BALL ,147,0,0,0,0,0,0,0,0,0,0,0,0,0,0,0,0,0,0,0,0,0,0,0DISCO BALL ROTATOR BATTERY OPERATED,47,0,0,0,0,0,0,0,0,0,0,0,0,0,0,0,0,0,0,0,0,0,0,0SILVER LOOKING MIRROR,3,0,0,0,0,0,0,0,0,0,0,0,0,0,0,0,0,0,0,0,0,0,0,0LADIES & GENTLEMEN METAL SIGN,619,0,0,0,0,24,0,0,0,0,0,0,0,0,0,0,0,0,0,0,0,0,0,0METAL SIGN HER DINNER IS SERVED ,37,0,0,0,12,0,0,0,0,0,0,0,0,0,0,0,0,0,0,0,0,0,0,0DOORMAT TOPIARY,32,0,0,0,0,0,0,0,0,0,0,0,0,0,0,0,0,0,0,0,0,0,0,0BATHROOM METAL SIGN,248,0,0,0,0,0,0,0,0,0,0,0,0,0,0,0,0,0,0,0,0,0,0,0KITCHEN METAL SIGN,95,0,0,0,0,0,0,0,0,0,0,0,0,0,0,0,0,0,0,0,0,0,0,0TOILET METAL SIGN,139,0,0,0,0,0,0,0,0,0,0,0,0,0,0,0,0,0,0,0,0,0,0,0METAL SIGN TAKE IT OR LEAVE IT ,93,13,0,0,0,12,6,0,0,0,6,0,0,0,0,0,0,0,0,0,0,0,0,0I'M ON HOLIDAY METAL SIGN,104,0,0,0,0,0,0,0,0,0,0,0,0,0,0,0,0,0,0,0,0,0,0,0GROW YOUR OWN BASIL IN ENAMEL MUG,96,0,0,0,0,0,0,0,0,0,8,0,0,0,0,0,0,0,0,0,0,0,0,0SET/10 PINK POLKADOT PARTY CANDLES,421,24,0,0,24,0,0,0,0,0,0,0,0,0,0,0,0,0,0,0,0,0,0,0SET 20 NAPKINS FAIRY CAKES DESIGN ,108,0,0,0,12,0,0,0,0,0,0,0,0,0,0,0,0,0,0,0,0,0,0,0SET OF 6 T-LIGHTS SNOWMEN,189,0,0,0,0,0,0,0,0,0,0,6,0,0,0,0,0,0,0,0,0,0,0,0SET OF 6 T-LIGHTS SANTA,74,0,0,0,6,0,0,0,2,0,0,6,0,0,0,0,0,0,0,0,0,0,0,0SET OF 9 HEART SHAPED BALLOONS,180,26,0,0,0,0,0,0,0,0,0,0,0,0,0,0,0,0,0,0,0,0,0,0SANDWICH BATH SPONGE,381,1,0,0,0,0,10,0,0,0,0,0,0,0,0,0,0,0,10,0,0,0,0,0APPLE BATH SPONGE,339,0,0,0,0,0,0,0,0,0,0,0,0,0,0,0,0,0,10,0,0,0,0,0STRAWBERRY BATH SPONGE ,286,1,0,0,0,0,10,0,0,0,0,0,0,0,0,0,0,0,10,0,0,0,0,0BLACK PIRATE TREASURE CHEST,25,0,0,0,0,0,0,0,0,0,0,0,0,0,0,0,0,0,0,0,0,0,0,0STAR PORTABLE TABLE LIGHT ,182,0,0,0,0,0,0,0,0,0,0,0,0,0,0,0,0,0,0,0,0,0,0,0SNOWFLAKE PORTABLE TABLE LIGHT ,44,0,0,0,0,0,0,0,0,0,0,0,0,0,0,0,0,0,0,0,0,0,0,0PINK OVAL JEWELLED MIRROR,3,0,0,0,0,0,0,0,0,0,0,0,0,0,0,0,0,0,0,0,0,0,0,0RETROSPOT CIGAR BOX MATCHES ,130,0,0,0,0,0,0,0,0,0,0,0,0,0,0,0,0,0,0,0,0,0,0,0COSY HOUR GIANT TUBE MATCHES,138,0,0,0,0,0,0,0,0,0,0,0,0,0,0,0,12,0,0,0,0,0,0,0JAZZ HEARTS PURSE NOTEBOOK,58,0,0,0,0,0,0,0,0,0,0,0,0,0,0,0,0,0,0,0,0,0,0,0CANDLEHOLDER PINK HANGING HEART,208,0,0,0,0,0,18,0,0,0,0,0,0,0,0,0,0,0,9,0,0,0,0,0ASSORTED COLOUR MINI CASES,132,12,0,0,0,0,4,0,0,0,0,0,0,0,0,0,0,0,0,0,0,0,0,0LUNCH BAG SPACEBOY DESIGN ,349,20,0,200,0,0,0,0,0,0,0,0,0,0,0,0,0,0,0,0,0,0,0,0LUNCH BAG WOODLAND,414,50,0,200,0,0,0,0,0,0,20,0,0,0,0,0,0,0,0,0,0,0,0,0LUNCH BAG PINK POLKADOT,244,0,0,0,0,0,0,0,100,0,0,0,0,0,0,0,0,0,0,0,0,0,0,0GUMBALL COAT RACK,530,48,0,0,54,0,0,0,0,0,0,0,0,0,0,0,0,0,0,36,0,0,0,0BLUE NEW BAROQUE CANDLESTICK CANDLE,97,0,0,0,0,0,0,0,0,0,0,0,0,0,0,0,0,0,0,0,0,0,0,0PINK NEW BAROQUECANDLESTICK CANDLE,91,0,0,0,0,0,0,0,0,0,0,0,0,0,0,0,0,0,0,0,0,0,0,0FAIRY CAKE FLANNEL ASSORTED COLOUR,188,0,0,0,0,0,0,0,0,0,9,9,0,0,0,0,0,0,9,0,0,0,0,0BREAD BIN DINER STYLE PINK,26,0,0,0,10,0,2,0,0,0,0,0,0,0,0,0,0,0,0,0,0,0,0,0TEA TIME TABLE CLOTH,7,0,0,0,2,0,6,0,0,0,0,0,0,0,0,0,0,0,0,0,0,0,0,0HOT WATER BOTTLE BABUSHKA ,966,12,0,0,52,0,32,0,16,0,0,0,0,0,0,0,0,0,0,0,0,0,0,0HEART IVORY TRELLIS SMALL,426,0,0,0,0,0,0,0,0,0,0,0,0,0,0,0,0,0,48,0,0,0,0,0PINK DRAWER KNOB ACRYLIC EDWARDIAN,334,0,0,0,12,0,0,0,0,0,0,0,0,0,0,12,0,0,0,0,0,0,0,0GREEN DRAWER KNOB ACRYLIC EDWARDIAN,309,0,0,0,12,0,0,0,0,0,0,0,0,0,0,12,0,0,0,0,0,0,0,0BLUE DRAWER KNOB ACRYLIC EDWARDIAN,137,0,0,0,12,0,0,0,0,0,0,0,0,0,0,12,0,0,0,0,0,0,0,0SET 6 FOOTBALL CELEBRATION CANDLES,39,0,0,0,0,0,0,0,0,0,0,0,0,0,0,0,0,0,0,0,0,0,0,0SET OF 6 GIRLS CELEBRATION CANDLES,16,0,0,0,0,0,0,0,0,0,0,0,0,0,0,0,0,0,0,0,0,0,0,0ROMANTIC PINKS RIBBONS ,70,0,0,0,0,0,12,0,0,0,0,0,0,0,0,0,0,0,0,0,0,0,0,0BRIGHT BLUES RIBBONS ,49,0,0,0,12,0,0,0,0,0,0,0,0,0,0,0,0,0,0,0,0,0,0,0CHOCOLATE BOX RIBBONS ,59,0,0,0,12,0,0,0,0,0,0,0,0,0,0,0,0,0,0,0,0,0,0,0PARTY INVITES FOOTBALL,46,0,0,0,0,0,0,0,0,0,0,0,0,0,0,0,0,0,0,0,0,0,0,0PARTY INVITES JAZZ HEARTS,46,0,0,0,0,0,0,0,0,0,0,0,0,0,0,0,0,0,0,0,0,0,0,0PARTY INVITES SPACEMAN,66,0,0,0,0,0,0,0,0,0,0,0,0,0,0,0,0,0,0,0,0,0,0,0SET OF 3 BUTTERFLY COOKIE CUTTERS,407,0,0,0,0,0,12,0,0,0,12,0,0,0,0,0,0,0,0,0,0,0,0,0SET OF 3 HEART COOKIE CUTTERS,338,1,0,0,0,0,0,0,0,0,12,0,0,0,0,0,0,0,0,0,0,0,0,03 PIECE SPACEBOY COOKIE CUTTER SET,111,0,0,0,42,0,0,0,0,0,0,0,0,0,0,0,0,0,0,0,0,0,0,0PACK OF 72 SKULL CAKE CASES,995,24,0,120,24,48,0,0,0,0,0,0,0,0,0,0,0,0,0,0,0,0,144,0PACK OF 60 SPACEBOY CAKE CASES,235,0,0,120,0,0,0,0,0,0,0,0,0,0,0,0,0,0,0,240,0,0,0,072 SWEETHEART FAIRY CAKE CASES,1140,24,0,0,0,48,24,0,0,0,0,0,0,0,0,0,0,0,0,240,0,0,72,0LUNCH BAG SUKI  DESIGN ,433,20,0,100,0,0,0,0,70,0,20,0,0,0,0,0,0,0,0,0,0,0,0,0LUNCH BAG CARS BLUE,439,10,0,0,0,0,0,0,100,0,34,0,0,0,0,0,0,0,0,0,0,0,0,0LUNCH BAG  BLACK SKULL.,530,0,0,0,0,0,0,0,60,0,0,0,0,0,0,0,0,0,0,0,0,0,0,0HEART IVORY TRELLIS LARGE,211,0,0,0,0,0,0,0,0,0,0,0,0,0,0,0,0,0,24,0,0,0,0,0SET/5 RED RETROSPOT LID GLASS BOWLS,601,0,0,0,12,0,12,0,0,0,0,0,0,0,0,0,0,0,0,0,0,0,0,0MAGIC DRAWING SLATE DINOSAUR,125,0,0,0,0,0,0,0,0,0,0,0,0,0,0,0,0,0,0,0,0,0,0,0MAGIC DRAWING SLATE BAKE A CAKE ,163,0,0,0,24,0,0,0,0,0,0,0,0,0,0,0,0,0,0,0,0,0,0,012 PENCILS TALL TUBE SKULLS,131,0,0,0,0,0,12,0,0,0,0,0,0,0,0,0,0,0,0,0,0,0,0,0RED  HARMONICA IN BOX ,2093,48,240,0,24,0,12,0,0,0,24,0,240,48,0,0,0,0,0,0,0,0,0,0BLUE HARMONICA IN BOX ,505,36,240,0,24,0,12,0,0,0,12,0,240,36,0,0,0,0,0,0,0,0,0,0SKULLS  WATER TRANSFER TATTOOS ,67,24,0,0,0,0,0,0,0,0,0,0,0,0,0,0,0,0,0,0,0,0,0,0PACK 3 BOXES BIRD PANNETONE ,213,0,0,0,0,0,0,24,0,0,0,0,0,0,0,0,0,0,0,0,0,0,0,0SET OF 20 KIDS COOKIE CUTTERS,346,0,0,0,12,48,12,0,0,0,12,0,0,0,0,0,0,0,0,0,0,0,0,010 COLOUR SPACEBOY PEN,585,24,0,0,0,0,24,0,0,0,0,0,0,0,0,0,0,0,0,0,0,0,0,0VICTORIAN GLASS HANGING T-LIGHT,1563,0,0,0,0,0,0,0,0,0,0,0,0,0,0,0,0,0,0,0,0,0,0,0SINGLE HEART ZINC T-LIGHT HOLDER,431,0,0,0,0,0,0,0,0,0,0,0,0,0,0,0,0,0,0,0,0,0,0,0HANGING METAL STAR LANTERN,164,0,0,0,0,0,0,0,0,0,0,0,0,0,0,0,0,0,12,0,0,0,0,0SILVER HANGING T-LIGHT HOLDER,1016,0,0,0,0,0,0,0,0,0,0,0,0,0,0,0,0,0,0,0,0,0,0,0DOORMAT RED RETROSPOT,342,22,24,0,40,4,0,0,0,0,2,0,24,0,0,0,2,0,0,0,0,0,0,0DOORMAT HEARTS,167,0,0,0,0,0,0,0,0,0,0,0,0,0,0,0,0,0,0,0,0,0,0,0NATURAL SLATE RECTANGLE CHALKBOARD,121,0,0,0,0,0,0,0,0,0,0,0,0,0,0,0,0,0,0,0,0,0,0,0LOVEBIRD HANGING DECORATION WHITE ,378,0,12,0,0,0,0,0,0,0,0,0,12,0,0,0,0,0,0,0,0,0,0,0PENS ASSORTED FUNNY FACE,872,0,0,0,0,0,0,0,0,0,0,0,0,0,0,0,0,0,0,0,0,0,0,0CARD CIRCUS PARADE,164,0,0,0,0,24,0,0,0,0,0,0,0,0,12,0,0,0,0,0,0,0,0,0WRAP COWBOYS  ,100,0,0,0,25,0,0,0,0,0,0,0,0,0,0,0,0,0,0,0,0,0,0,0AIRLINE BAG VINTAGE TOKYO 78,129,0,0,0,0,0,4,0,0,0,0,0,0,0,0,0,0,0,0,0,0,0,0,0SET OF 72 RETROSPOT PAPER  DOILIES,197,0,0,0,24,0,0,0,0,0,0,0,0,0,84,0,0,0,0,288,0,0,0,0SLEEPING CAT ERASERS,676,0,0,0,0,0,0,0,0,0,0,0,0,0,0,0,0,0,0,0,0,0,0,0CARD BIRTHDAY COWBOY,58,0,0,0,0,0,0,12,0,0,0,0,0,0,0,0,0,0,0,0,0,0,0,0PACK 3 BOXES CHRISTMAS PANNETONE,238,0,0,0,0,0,0,0,0,0,0,0,0,0,0,0,0,0,0,0,0,0,0,0ROTATING SILVER ANGELS T-LIGHT HLDR,2304,0,0,0,6,0,0,0,36,0,0,0,0,0,0,0,0,0,0,0,0,0,0,0RIBBON REEL MAKING SNOWMEN ,125,10,0,0,0,0,0,0,0,0,0,0,0,0,0,0,0,0,0,0,0,0,0,04 TRADITIONAL SPINNING TOPS,222,24,160,0,12,0,12,0,12,0,0,0,160,0,0,0,0,0,0,0,0,0,0,0BAG 500g SWIRLY MARBLES,48,0,0,0,0,0,0,0,0,0,0,0,0,0,0,0,0,0,0,0,0,0,0,0