Product,United Kingdom,France,Australia,Netherlands,Germany,Norway,EIRE,Switzerland,Spain,Poland,Portugal,Italy,Belgium,Lithuania,Japan,Iceland,Channel Islands,Denmark,Cyprus,Sweden,Austria,Israel,Finland,BahrainPOPPY'S PLAYHOUSE LIVINGROOM ,126.93,0,0,0,2.1,0,2.1,0,0,0,0,0,0,0,0,0,0,0,2.1,0,0,0,0,0POPPY'S PLAYHOUSE BATHROOM,58.82,2.1,0,0,0,0,2.1,0,0,0,0,0,0,0,0,0,0,0,2.1,0,0,0,0,0LARGE YELLOW BABUSHKA NOTEBOOK ,21.28,0,0,0,0,0,0,0,0,0,0,0,0,0,0,0,0,0,0,1.25,0,0,0,0BROCANTE COAT RACK,160.15,0,0,0,9.95,0,9.95,0,0,0,0,0,0,0,0,0,0,0,0,0,0,0,0,0WHITE BROCANTE SOAP DISH,29.53,0,0,0,0,0,0,0,0,0,0,0,0,0,0,0,0,0,0,0,0,0,0,0ROUND CAKE TIN VINTAGE GREEN,135.84,0,0,0,0,0,0,0,0,0,0,0,0,0,0,0,0,0,0,0,0,0,0,0SOAP DISH BROCANTE,50.17,0,0,0,2.95,0,2.95,0,0,0,0,0,0,0,0,0,0,0,0,0,0,0,0,0NUMBER TILE COTTAGE GARDEN 2,8.11,0,0,0,0,0,0,0,0,0,0,0,0,0,0,0,0,0,0,0,0,0,0,0NOVELTY BISCUITS CAKE STAND 3 TIER,349.19,0,0,0,0,0,0,0,0,0,0,0,0,0,0,0,0,0,0,0,0,0,0,0OVEN MITT APPLES DESIGN,28.03,1.45,0,0,1.45,0,1.45,0,0,0,0,0,0,0,0,0,0,0,0,0,0,0,0,0CHILDRENS APRON APPLES DESIGN,90.14,1.95,0,0,1.95,0,0,0,0,0,0,0,0,0,0,0,0,0,0,0,0,0,0,0CHRISTMAS METAL POSTCARD WITH BELLS,57.14,0,0,0,0,0,1.25,0,0,0,0,0,0,0,0,0,0,0,0,0,0,0,0,0DOLLY GIRL CHILDRENS EGG CUP,33.82,1.25,0,0,0,0,0,0,0,0,0,0,0,0,0,0,0,0,0,0,0,0,0,0IVORY STRING CURTAIN WITH POLE ,19.53,0,0,0,0,0,0,0,0,0,0,0,0,0,0,0,0,0,0,0,0,0,0,0BLUE FELT HANGING HEART W FLOWER,1.66,0,0,0,0,0,0,0,0,0,0,0,0,0,0,0,0,0,0,0,0,0,0,0PINK FELT HANGING HEART W FLOWER,3.32,0,0,0,0,0,0,0,0,0,0,0,0,0,0,0,0,0,0,0,0,0,0,0FOLKART CLIP ON STARS,11.62,0,0,0,0,0,0,0,0,0,0,0,0,0,0,0,0,0,0,0,0,0,0,0FOLKART HEART NAPKIN RINGS,52.53,0,0,0,0,0,0,0,0,0,0,0,0,0,0,0,0,0,0,0,0,0,0,0FOLK ART METAL STAR T-LIGHT HOLDER,8.68,0,0,0,0,0,0.38,0,0,0,0,0,0,0,0,0,0,0,0,0,0,0,0,0CERAMIC CAKE BOWL + HANGING CAKES,67.12,0,0,0,0,0,0,0,0,0,0,0,0,0,0,0,0,0,0,0,0,0,0,0YELLOW/PINK CERAMIC CANDLE HOLDER,3.36,0,0,0,0,0,0,0,0,0,0,0,0,0,0,0,0,0,0,0,0,0,0,0SUNSET COLOUR CHUNKY KNITTED THROW,11.02,0,0,0,0,0,0,0,0,0,0,0,0,0,0,0,0,0,0,0,0,0,0,0WOVEN BERRIES CUSHION COVER ,33.68,0,0,0,0,0,0,0,0,0,0,0,0,0,0,0,0,0,0,0,0,0,0,0TEA TIME PARTY BUNTING,164.94,4.65,0,0,0,0,0,0,0,0,0,0,0,0,0,0,0,0,0,0,0,0,0,0TEA TIME KITCHEN APRON,144.78,0,0,0,5.95,0,5.95,0,0,0,5.95,0,0,0,0,0,0,0,0,0,0,0,0,0BLUE HAPPY BIRTHDAY BUNTING,92.09,0,0,0,0,0,0,0,0,0,0,0,0,0,0,0,0,0,5.45,0,0,0,0,0PINK HAPPY BIRTHDAY BUNTING,70.97,0,0,0,0,0,0,0,0,0,0,0,0,0,0,0,0,0,5.45,0,0,0,0,0CAROUSEL DESIGN WASHBAG,17.59,1.95,0,0,0,0,0,0,0,0,0,0,0,0,0,0,0,0,0,0,0,0,0,0LOVE HEART POCKET WARMER,86.92,0,0,0,0.42,0,1.65,0,0,0,0,0,0,0,0,0,0,0,0,0,0,0,0,0A4 WALL TIDY BLUE OFFICE,2.98,0,0,0,0,0,0,0,0,0,0.65,0,0,0,0,0,0,0,0,0,0,0,0,0COLUMBIAN  CUBE CANDLE ,1.66,0,0,0,0,0,0,0,0,0,0,0,0,0,0,0,0,0,0,0,0,0,0,0CORONA MEXICAN TRAY,219.93,0,2.95,0,0,0,0,0,0,0,0,0,2.95,0,0,0,0,0,0,0,0,0,0,0AREA PATROLLED METAL SIGN,81.98,0,0,0,0,0,0,0,0,0,0,0,0,0,0,0,0,2.1,0,0,0,0,0,0FANNY'S REST STOPMETAL SIGN,166.17,0,0,0,0,0,0,0,0,0,0,0,0,0,0,0,0,0,0,0,0,0,0,0MIDNIGHT GLAMOUR SCARF KNITTING KIT,21.4,0,0,0,0,0,0,0,0,0,0,0,0,0,0,0,0,0,0,0,0,0,0,0YELLOW METAL CHICKEN HEART ,23.14,0,0,1.25,0,0,0,0,0,0,0,0,0,0,0,0,0,0,0,0,0,0,0,0PACK 20 ENGLISH ROSE PAPER NAPKINS,22.71,0,0,0,0,0,0,0,0,0,0,0,0,0,1.7,0,0,0,0,0,0,0,0,03D SHEET OF DOG STICKERS,23.68,0,0,0,0,0,0.85,0,0,0,0,0,0,0,0,0,0,0,0,0,0,0,0,03D SHEET OF CAT STICKERS,27.08,0,0,0,0,0,0.85,0,0,0,0,0,0,0,0,0,0,0,0,0,0,0,0,0MIXED NUTS LIGHT GREEN BOWL,12.18,0,0,0,0,0,0,0,0,0,0,0,0,0,0,0,0,0,0,0,0,0,0,0TALL ROCOCO CANDLE HOLDER,33.96,0,0,0,0,0,8.5,0,0,0,0,0,0,0,0,0,0,0,0,0,0,0,0,0WHITE TRAVEL ALARM CLOCK,50.2,0,0,0,0,0,0,0,0,0,0,0,0,0,0,0,0,0,0,0,0,0,0,0GRASS HOPPER WOODEN WALL CLOCK ,23.64,0,0,0,0,0,0,0,0,0,0,0,0,0,0,0,0,0,0,0,0,0,0,0JUNGLE POPSICLES ICE LOLLY HOLDERS,20.07,0,0,0,0,0,0,0,0,0,0,0,0,0,0,0,0,0,0,0,0,0,0,0LARGE TAHITI BEACH BAG,11.87,0,0,0,0,0,0,0,0,0,0,0,0,0,0,0,0,0,0,0,0,0,0,0HAND TOWEL PINK FLOWER AND DAISY,29.99,0,0,1.25,0,0,0,0,0,0,0,0,0,0,0,0,0,0,0,0,0,0,0,0ASSORTED COLOUR T-LIGHT HOLDER,12.06,0,0,0,0,0,0,0,0,0,0,0,0,0,0,0,0,0,0,0,0,0,0,0RECTANGULAR SHAPED MIRROR,3.36,0,0,0,0,0,0,0,0,0,0,0,0,0,0,0,0,0,0,0,0,0,0,0SET OF 3 CONEY ISLAND OVAL BOXES,15.12,0,0,0,0,0,4.95,0,0,0,0,0,0,0,0,0,0,0,0,0,0,0,0,0SET/4 BLUE FLOWER CANDLES IN BOWL,8.31,0,0,0,0,0,0,0,0,0,0,0,0,0,0,0,0,0,0,0,0,0,0,0FRENCH ENAMEL CANDLEHOLDER,37.86,0,0,0,0,0,0,0,0,0,0,0,0,0,0,0,0,0,0,0,0,0,0,0BLACK ENCHANTED FOREST PLACEMAT,26.5,0,0,0,0,0,0,0,0,0,0,0,0,0,0,0,0,0,0,0,0,0,0,0BEADED CRYSTAL HEART PINK ON STICK,17,0,0,0,0,0,0,0,0,0,0,0,0,0,0,0,0,0,0,0,0,0,0,0SET/6 PINK BIRD T-LIGHT CANDLES,39.99,0,0,0,0,0,0,0,0,0,0,0,0,0,0,0,0,0,0,0,0,0,0,0MINI PAINTED GARDEN DECORATION ,2.5,0,0,0,0,0,0,0,0,0,0,0,0,0,0,0,0,0,0,0,0,0,0,0SET OF 6 3D KIT CARDS FOR KIDS,38.5,0.85,0,0,0,0,0.85,0,0,0,0,0,0,0,0,0,0,0,0,0,0,0,0,0SET/3 DECOUPAGE STACKING TINS,40.41,4.95,0,0,0,0,0,0,0,0,0,0,0,0,0,4.95,0,0,0,0,0,0,0,0BLACK VINTAGE EARRINGS,25.44,0,0,0,0,0,0,0,0,0,0,0,0,0,0,0,0,0,0,0,0,0,0,0GOLD M.O.P ORBIT DROP EARRINGS,8.48,0,0,0,0,0,0,0,0,0,0,0,0,0,0,0,0,0,0,0,0,0,0,0GOLD M.O.P ORBIT BRACELET,5.51,0,0,0,0,0,0,0,0,0,0,0,0,0,0,0,0,0,0,0,0,0,0,0NEW BAROQUE B'FLY NECKLACE GREEN,8.49,0,0,0,0,0,0,0,0,0,0,0,0,0,0,0,0,0,0,0,0,0,0,0"FLOWER GLASS GARLD NECKL36""TURQUOIS",24.21,0,0,0,0,0,0,0,0,0,0,0,0,0,0,0,0,0,0,0,0,0,0,0MURANO STYLE GLASS BRACELET BLACK,11.12,0,0,0,0,0,0,0,0,0,0,0,0,0,0,0,0,0,0,0,0,0,0,0CRACKED GLAZE NECKLACE RED,21.39,0,0,0,0,0,0,0,0,0,0,0,0,0,0,0,0,0,0,0,0,0,0,0CRACKED GLAZE EARRINGS RED,5.09,0,0,0,0,0,0,0,0,0,0,0,0,0,0,0,0,0,0,0,0,0,0,0BLACK DIAMOND CLUSTER EARRINGS,5.92,0,0,0,0,0,0,0,0,0,0,0,0,0,0,0,0,0,0,0,0,0,0,0BLUE MURANO TWIST NECKLACE,10.17,0,0,0,0,0,0,0,0,0,0,0,0,0,0,0,0,0,0,0,0,0,0,0OLD ROSE COMBO BEAD NECKLACE,17.76,0,0,0,0,0,0,0,0,0,0,0,0,0,0,0,0,0,0,0,0,0,0,0WHITE/PINK MINI CRYSTALS NECKLACE,5.51,0,0,0,0,0,0,0,0,0,0,0,0,0,0,0,0,0,0,0,0,0,0,0ANT COPPER TURQ BOUDICCA BRACELET,25.17,0,0,0,0,0,0,0,0,0,0,0,0,0,0,0,0,0,0,0,0,0,0,0PINK & WHITE ROSEBUD RING,4.24,0,0,0,0,0,0,0,0,0,0,0,0,0,0,0,0,0,0,0,0,0,0,0PAIR BUTTERFLY HAIR CLIPS,30.36,0,0,0,0,0,0,0,0,0,0,0,0,0,0,0,0,0,0,0,0,0,0,0DROP DIAMANTE EARRINGS CRYSTAL,8.87,0,0,0,0,0,0,0,0,0,0,0,0,0,0,0,0,0,0,0,0,0,0,0DROP DIAMANTE EARRINGS GREEN,5.92,0,0,0,0,0,0,0,0,0,0,0,0,0,0,0,0,0,0,0,0,0,0,0AMETHYST GLASS/SHELL/PEARL NECKLACE,18.68,0,0,0,0,0,0,0,0,0,0,0,0,0,0,0,0,0,0,0,0,0,0,0JADE DROP EARRINGS W FILIGREE,35.49,0,0,0,0,0,0,0,0,0,0,0,0,0,0,0,0,0,0,0,0,0,0,0CRYSTAL DIAMANTE STAR BROOCH,20.36,0,0,0,0,0,0,0,0,0,0,0,0,0,0,0,0,0,0,0,0,0,0,0PINK ENAMEL+GLASS HAIR COMB,16.87,0,0,0,0,0,0,0,0,0,0,0,0,0,0,0,0,0,0,0,0,0,0,0DIAMOND LAS VEGAS NECKLACE 45CM,17.82,0,0,0,0,0,0,0,0,0,0,0,0,0,0,0,0,0,0,0,0,0,0,0"LETTER ""A"" BLING KEY RING",4.25,0,0,0,0,0,0,0,0,0,0,0,0,0,0,0,0,0,0,0,0,0,0,0"LETTER ""E"" BLING KEY RING",5.95,0,0,0,0,0,0,0,0,0,0,0,0,0,0,0,0,0,0,0,0,0,0,0PINK FLORAL FELTCRAFT SHOULDER BAG,196.44,0,0,0,0,0,0,0,0,0,0,0,0,0,0,0,0,0,3.75,0,0,0,0,0WHITE STITCHED CUSHION COVER,27.8,0,0,0,0,0,0,0,0,0,0,0,0,0,0,0,0,0,0,0,0,0,0,0PIN CUSHION BABUSHKA RED,20.24,0,0,0,0,0,0,0,0,0,0,0,0,0,0,0,0,0,0,0,0,0,0,0PIN CUSHION BABUSHKA BLUE,17.65,0,0,0,0,0,0,0,0,0,0,0,0,0,0,0,0,0,0,0,0,0,0,0PIN CUSHION BABUSHKA PINK,23.51,0,0,0,0,0,0,0,0,0,0,0,0,0,0,0,0,0,0,0,0,0,0,0RED RETROSPOT PURSE ,118.15,2.95,0,0,0,0,0,0,0,0,0,0,0,0,0,0,0,0,0,0,0,0,0,0LADYBIRD + BEE RAFFIA FOOD COVER,52.74,0,0,0,0,0,0,0,0,0,0,0,0,0,0,0,0,0,0,0,0,0,0,0HOME SWEET HOME MUG,63.52,0,0,0,0,0,0,1.25,0,0,0,0,0,0,0,0,0,0,0,0,0,0,0,0CHILDRENS GARDEN GLOVES BLUE,14.62,0,1.06,0,0,0,0,0,0,0,0,0,1.06,0,0,0,0,0,0,0,0,0,0,0CHRYSANTHEMUM SKETCHBOOK ,41.37,0,0,0,0,0,0,0,0,0,0,0,0,0,0,0,0,0,0,0,0,0,0,0VINTAGE UNION JACK DOORSTOP,106.98,0,0,0,0,0,0,0,0,0,0,0,0,0,0,0,0,0,0,0,0,0,0,0WAKE UP COCKEREL TILE COASTER,5.01,0,0,0,0,0,0,0,0,0,0,0,0,0,0,0,0,0,0,0,0,0,0,0ROSE 3 WICK MORRIS BOX CANDLE,77.38,0,0,0,0,0,0,0,0,0,0,4.25,0,0,0,0,0,0,0,0,0,0,0,0ROSE SCENT CANDLE JEWELLED DRAWER,16.97,0,0,0,0,0,0,0,0,0,0,4.25,0,0,0,0,0,0,0,0,0,0,0,0WHITE BAMBOO RIBS LAMPSHADE,7.52,0,0,0,0,0,0,0,0.85,0,0,0,0,0,0,0,0,0,0,0,0,0,0,0FOLDING UMBRELLA CHOCOLATE POLKADOT,24.93,0,0,0,0,0,0,0,0,0,0,0,0,0,0,0,0,0,0,0,0,0,0,0CAKE STAND LOVEBIRD 2 TIER WHITE,40.28,0,0,0,0,0,0,0,0,0,0,0,0,0,0,0,0,0,0,0,0,0,0,03 GARDENIA MORRIS BOXED CANDLES,33.94,0,0,0,0,0,0,0,0,0,0,4.25,0,0,0,0,0,0,0,0,0,0,0,0SET/4 GARDEN ROSE DINNER CANDLE,1.65,0,0,0,0,0,0,0,0,0,0,0,0,0,0,0,0,0,0,0,0,0,0,0GOLD PRINT PAPER BAG,0.38,0,0,0,0,0,0,0,0,0,0,0,0,0,0,0,0,0,0,0,0,0,0,0WOODEN HAPPY BIRTHDAY GARLAND,47.21,0,0,0,0,0,0,0,0,0,0,0,0,0,2.95,0,0,0,2.95,0,0,0,0,0SET/4 BADGES CUTE CREATURES,12.97,0,0,0,0,0,0,0,0,0,0,0,0,0,0,0,0,0,0,0,0,0,0,0BLUE PAISLEY POCKET BOOK,10.04,0,0,0,0,0,0,0,0,0,0,0,0,0,0,0,0,0,0,0,0,0,0,0PORCELAIN ROSE LARGE ,5,0,1.25,0,0,0,0,0,0,0,0,0,1.25,0,0,0,0,0,0,0,0,0,0,0PORCELAIN ROSE SMALL,6.76,0,0.85,0,0,0,0,0,0,0,0,0,0.85,0,0,0,0,0,0,0,0,0,0,0BAKING SET SPACEBOY DESIGN,160.55,0,0,0,0,0,4.95,0,0,0,0,0,0,0,0,0,0,0,0,0,0,0,0,0PEACE SMALL WOOD LETTERS,47.39,0,0,0,0,0,0,0,0,0,0,0,0,0,0,0,0,0,0,0,0,0,0,0RED RETROSPOT APRON ,203.73,0,0,0,0,0,5.95,0,0,0,5.95,0,0,0,0,0,0,0,0,0,0,0,0,0FELTCRAFT DOLL MARIA,50.17,2.95,0,0,2.95,0,0,0,0,0,0,0,0,0,0,0,0,0,2.95,0,0,0,0,0PARTY METAL SIGN ,20.02,0,0,0,0,0,0,0,0,0,0,0,0,0,0,0,0,0,0,0,0,0,0,0VINTAGE CREAM 3 BASKET CAKE STAND,151.91,0,0,0,0,0,9.95,0,0,0,0,0,0,0,0,0,0,0,0,0,0,0,0,0DOORMAT RESPECTABLE HOUSE,246.72,23.85,0,0,0,0,0,0,0,0,0,0,0,0,0,0,0,7.95,0,0,0,0,0,0MEMO BOARD RETROSPOT  DESIGN,241.17,0,0,0,4.95,0,0,0,0,0,0,0,0,0,0,0,0,0,0,0,0,0,0,0PINK/YELLOW FLOWERS HANDBAG,3.75,0,0,0,0,0,0,0,0,0,0,0,0,0,0,0,0,0,0,0,0,0,0,0CHARLIE+LOLA MY ROOM DOOR SIGN,8.5,0,0,0,0,0,0,0,0,0,0,0,0,0,0,0,0,0,0,0,0,0,0,0CHRISTMAS CARD STACK OF PRESENTS,1.68,0,0,0,0,0,0,0,0,0,0,0,0,0,0,0,0,0,0,0,0,0,0,0SET 12 KIDS COLOUR  CHALK STICKS,23.15,0,0,0,0.42,0,0,0,0,0,0,0,0,0,0,0,0,0,0,0,0,0,0,0SPACEBOY BIRTHDAY CARD,19.03,0.42,0,0,0,0,0,0.42,0,0,0,0,0,0,0,0,0,0,0,0,0,0,0,0JOY LARGE WOOD LETTERS,61.03,0,0,0,0,0,0,0,0,0,0,0,0,0,0,0,0,0,0,0,0,0,0,0WORLD WAR 2 GLIDERS ASSTD DESIGNS,13.45,0,0,0,0,0,0,0,0.29,0,0,0,0,0,0,0,0,0,0,0.29,0,0,0,0ENCHANTED BIRD COATHANGER 5 HOOK,116.35,0,0,0,0,0,0,0,0,0,0,0,0,0,0,0,0,0,0,0,0,0,0,0CACTI T-LIGHT CANDLES,44.85,0,0,0,0,0,0,0,0,0,0,0,0,0,0,0,0,0,0,0,0,0,0,0HANGING BAUBLE T-LIGHT HOLDER SMALL,9.26,0,0,0,0,0,0,0,0,0,0,0,0,0,0,0,0,0,0,0,0,0,0,0BALLOON WATER BOMB PACK OF 35,4.21,0,0,0,0,0,0,0,0,0,0,0,0,0,0,0,0,0,0,0,0,0,0,0BALLOON PUMP WITH 10 BALLOONS,19.81,0,0,0,0,0,0,0,0,0,0,0,0,0,0,0,0,0,0,0,0,0,0,0ALPHABET STENCIL CRAFT,27.51,0,0,0,0,0,0,0,0,0,0,0,0,0,0,0,0,0,0,0,0,0,0,03 TRADITIONAl BISCUIT CUTTERS  SET,39.92,0,0,0,0,0,2.1,0,0,0,0,0,0,0,0,0,0,0,0,0,0,0,0,0IVORY PAPER CUP CAKE CASES ,14.98,0,0,0,0,0,0,0,0,0,0,0,0,0,0,0,0,0,0,0,0,0,0,0PARTY INVITES WOODLAND,9.23,0,0,0,0,0,0,0,0,0,0,0,0,0,0,0,0,0,0,0,0,0,0,0PARTY INVITES BALLOON GIRL,1.7,0,0,0,0,0,0,0,0,0,0,0,0,0,0,0,0,0,0,0,0,0,0,0LOVELY BONBON STICKER SHEET,11.78,0.85,0,0,0,0,0,0,0,0,0,0,0,0,0,0,0,0,0,0,0,0,0,0ASSTD DESIGN 3D PAPER STICKERS,4.66,0.85,0,0,0,0,0,0,0,0,0,0,0,0,0,0,0,0,0,0,0,0,0,0CUTE CATS TAPE,4.7,0.19,0,0,0.38,0,0,0,0,0,0,0,0,0,0,0,0,0,0,0,0,0,0,0PACK OF 12 COLOURED PENCILS,19.43,0,0,0,0.85,0,0.85,0,0,0,0,0,0,0,0,0,0,0,0,0,0,0,0,0TOAST ITS - I LOVE YOU ,31.09,1.25,0,0,0,0,0,0,0,0,1.25,0,0,0,0,0,0,0,1.25,0,0,0,0,0BANK ACCOUNT  GREETING  CARD ,4.67,0,0,0,0,0,0,0,0,0,0,0,0,0,0,0,0,0,0,0,0,0,0,0EMPIRE BIRTHDAY CARD,8.9,0,0,0,0,0,0,0,0.42,0,0,0,0,0,0,0,0,0,0,0,0,0,0,0TEA PARTY BIRTHDAY CARD,12.71,1.68,0,0,0,0,0,0,0,0,0,0,0,0,0,0,0,0,0,0,0,0,0,0CARD CAT AND TREE ,7.62,0,0,0,0,0,0,0,0,0,0,0,0,0,0.36,0,0,0,0,0,0,0,0,0CARD DOG AND BALL ,7.63,0,0,0,0,0,0,0,0,0,0,0,0,0,0,0,0,0,0,0,0,0,0,0PENNY FARTHING BIRTHDAY CARD,8.46,0,0,0,0,0,0,0,0,0,0,0,0,0,0.36,0,0,0,0,0,0,0,0,0BLUE STRIPE CERAMIC DRAWER KNOB,43.87,0,0,0,1.25,0,0,0,0,0,0,0,0,0,0,0,0,0,0,0,0,0,0,0WHITE SPOT BLUE CERAMIC DRAWER KNOB,57.7,0,0,0,1.25,0,1.25,0,0,0,0,0,0,0,0,0,0,0,0,0,0,0,0,0EMBOSSED GLASS TEALIGHT HOLDER,26.3,0,0,0,0,0,0,0,0,0,0,0,0,0,0,0,0,0,0,0,0,0,0,0WATERING CAN GREEN DINOSAUR,26.59,0,0,0,0,0,0,0,0,0,0,0,0,0,0,0,0,0,0,0,0,0,0,0WATERING CAN BLUE ELEPHANT,49.59,0,0,0,0,0,0,0,0,0,0,0,0,0,0,0,0,0,0,0,0,0,0,0FLYING PIG WATERING CAN,14.76,0,0,0,1.25,0,0,0,0,0,0,0,0,0,0,0,0,0,0,0,0,0,0,0FRENCH BLUE METAL DOOR SIGN 1,15.04,0,0,0,0,0,0,0,0,0,0,0,0,0,0,0,0,0,0,0,0,0,0,0FRENCH BATHROOM SIGN BLUE METAL,23.34,0,0,0,0,0,0,0,0,0,0,0,0,0,0,0,0,0,0,0,0,0,0,0CAKESTAND- 3 TIER- LOVEHEART,9.95,0,0,0,0,0,0,0,0,0,0,0,0,0,0,0,0,0,0,0,0,0,0,0GLASS BELL JAR SMALL,3.95,0,0,0,0,0,0,0,0,0,0,0,0,0,0,0,0,0,0,0,0,0,0,0GLASS BELL JAR LARGE,8.5,0,0,0,0,0,0,0,0,0,0,0,0,0,0,0,0,0,0,0,0,0,0,0FRIDGE MAGNETS LA VIE EN ROSE,39.01,0,0,0,0,0,0,0,0,0,0,0,0,0,0,0,0,0,0,0,0,0,0,0BROCANTE SHELF WITH HOOKS,64.23,0,0,0,0,0,0,0,0,0,0,0,0,0,0,0,0,0,0,0,0,0,0,0GREEN POLKADOT BOWL,22.34,0,0,0,0,0,0,0,0,0,0,0,0,0,0,0,0,0,0,0,0,0,0,0PICTURE FRAME WOOD TRIPLE PORTRAIT,167.5,0,0,0,0,0,6.75,0,0,0,0,0,0,0,0,0,0,0,0,0,0,0,0,0SET3 BOOK BOX GREEN GINGHAM FLOWER ,96.16,0,0,0,0,0,0,0,0,0,0,0,0,0,0,0,0,0,0,0,4.25,0,0,0ROUND CAKE TIN VINTAGE RED,255.01,0,0,0,0,0,7.95,0,0,0,0,0,0,0,0,0,0,0,0,0,0,0,0,0RETRO PLASTIC ELEPHANT TRAY,1.7,0,0,0,0,0,0,0,0,0,0,0,0,0,0,0,0,0,0,0,0,0,0,0RAINBOW PEGS PHOTO CLIP STRING,6.23,0,0,0,0,0,0,0,0,0,0,0,0,0,0,0,0,0,0,0,0,0,0,0TEATIME PEN CASE & PENS,1.7,0,0,0,0,0,0,0,0,0,0,0,0,0,0,0,0,0,0,0,0,0,0,0PHOTO FRAME 3 CLASSIC HANGING,202.99,0,0,0,0,0,9.95,0,9.95,0,0,0,0,0,0,0,0,0,0,0,0,0,0,03D TRADITIONAL CHRISTMAS STICKERS,51.79,0,0,0,0,0,0,0,0,0,0,0,0,0,0,0,0,0,0,0,0,0,0,0SEASIDE FLYING DISC,7.52,0,0,0,0,0,0,0,0,0,0,0,0,0,0,0,0,0,0,0,0,0,0,0PEG BAG APPLES DESIGN,68.49,0,0,0,0,0,2.55,0,0,0,0,0,0,0,2.1,0,0,0,0,0,0,0,0,0GREY FLORAL FELTCRAFT SHOULDER BAG,154.23,3.75,0,0,0,0,0,0,0,0,0,0,0,7.5,0,0,0,0,3.75,0,0,0,0,0SET/3 RED GINGHAM ROSE STORAGE BOX,153.65,0,0,0,3.75,0,3.75,0,3.75,0,3.75,0,0,0,0,0,0,0,0,0,0,0,0,0SMALL RED RETROSPOT MUG IN BOX ,32.97,0,0,0,0,0,0,0,0,0,0,0,0,0,0,0,0,0,3.75,0,0,0,0,012 PENCILS TALL TUBE RED RETROSPOT,18.7,0.85,0,0,0,0,0,0,0,0,0.85,0,0,0,0,0,0,0,0,0,0,0,0,0RED RETROSPOT TRADITIONAL TEAPOT ,394.5,6.95,0,0,7.95,0,7.95,0,0,0,7.95,0,0,0,0,0,0,0,0,0,0,0,0,0DAIRY MAID  PUDDING BOWL,7.5,0,0,0,0,0,0,0,0,0,0,0,0,0,0,0,0,0,0,0,0,0,0,0ASSORTED CAKES FRIDGE MAGNETS,0.65,0,0,0,0,0,0,0,0,0,0,0,0,0,0,0,0,0,0,0,0,0,0,0FOOD CONTAINER SET 3 LOVE HEART ,85.62,0,0,0,0,0,0,0,0,0,0,0,0,0,0,0,0,0,0,0,0,0,0,0DO NOT TOUCH MY STUFF DOOR HANGER ,25.04,0,0,0,0,0,0,0,0,0,0,0,0,0,0,0,0,0,0,0,0,0,0,0KEEP OUT BOYS DOOR HANGER ,20.23,1.45,0,0,0,0,0,0,0,0,0,0,0,0,0,0,0,0,0,0,0,0,0,0MOODY BOY  DOOR HANGER ,13.97,0,0,0,0,0,0,0,0,0,0,0,0,0,0,0,0,0,0,0,0,0,0,0FILIGRIS HEART WITH BUTTERFLY,12.51,0,0,0,0,0,0,0,0,0,0,0,0,0,0,0,0,0,1.25,0,0,0,0,0DECORATION HEN ON NEST- HANGING,15.03,0,0,0,0,0,0,0,0,0,0,0,0,0,0,0,0,0,0,0,0,0,0,0HEN HOUSE DECORATION,10.02,0,0,0,0,0,0,0,0,0,0,0,0,0,0,0,0,0,0,0,0,0,0,0PACK OF 12 STICKY BUNNIES,8.88,0,0,0,0,0,0,0,0,0,0,0,0,0,0,0,0,0,0,0,0,0,0,0MINI WOODEN HAPPY BIRTHDAY GARLAND,24.43,0,0,0,0,0,0,0,0,0,0,0,0,0,3.38,0,0,0,1.69,0,0,0,0,0WOOD STAMP SET BEST WISHES,19.94,0,0,0,0,0,1.65,0,0,0,0,0,0,0,0,0,0,0,0,0,0,0,0,0WOOD STAMP SET HAPPY BIRTHDAY,26.73,1.65,0,0,0,0,0,0,0,0,0,0,0,0,0,0,0,0,0,0,0,0,0,0GLAMOROUS  MUG,26.33,0,0,0,0,0,0,0,0,0,0,0,0,0,0,0,0,0,0,0,0,0,0,0GARDENIA 3 WICK MORRIS BOXED CANDLE,118.82,0,0,0,0,0,0,0,0,0,0,4.25,0,0,0,0,0,0,0,0,0,0,0,0CHEST 7 DRAWER MA CAMPAGNE,96.8,0,0,0,0,0,0,0,0,0,0,0,0,0,0,0,0,0,0,0,0,0,0,0JUMBO BAG SPACEBOY DESIGN,97.3,1.95,0,0,0,0,0,0,0,0,0,0,0,0,0,0,0,0,0,0,0,0,0,0AIRLINE BAG VINTAGE JET SET RED,139.66,4.25,0,0,0,0,4.25,0,0,0,0,0,0,0,0,0,0,0,0,0,0,0,0,0COSY SLIPPER SHOES LARGE GREEN,67.92,0,0,0,0,0,0,0,0,0,0,0,0,0,0,0,0,0,0,0,0,0,0,0WHITE JEWELLED HEART DECORATION,12.59,0,0,0,0,0,0,0,0,0,0,0,0,0,0,0,0,0,0,0,0,0,0,0CHINESE DRAGON PAPER LANTERNS,20.3,0,0,0,0,0,0,0,0,0,0,0,0,0,0,0,0,0,0,0,0,0,0,0MILK PAN PINK POLKADOT,72.09,0,0,0,3.75,0,0,0,0,0,0,0,0,0,0,0,0,0,0,0,0,0,0,0BOOM BOX SPEAKER BOYS,47.54,11.9,0,0,0,0,5.95,0,0,0,0,0,0,0,0,5.95,0,0,0,0,0,0,0,0SMALL PINK MAGIC CHRISTMAS TREE,14.29,0,0,0,0.85,0,0,0,0,0,0,0,0,0,0,0,0,0,0,0,0,0,0,0SET OF 4 FAIRY CAKE PLACEMATS ,25.08,0,0,0,1.25,0,0,0,0,0,0,0,0,0,0,0,0,0,0,0,0,0,0,0RECYCLED PENCIL WITH RABBIT ERASER,6.22,0,0,0,0.21,0,0,0,0,0,0,0,0,0,0,0,0,0,0,0,0,0,0,0BLUE CALCULATOR RULER,18.79,0,0,0,0,0,0,0,0,0,0,0,0,0,0,0,0,0,0,0,0,0,0,0RED FLOCK LOVE HEART PHOTO FRAME,14.94,0,0,0,0,0,0,0,0,0,0,0,0,0,0,0,0,0,0,0,0,0,0,0SCENTED CANDLE IN DIGITALIS TIN,18.93,0,0,0,0,0,0,0,0,0,0,0,0,0,0,0,0,0,0,0,0,0,0,0GROW YOUR OWN FLOWERS SET OF 3,63.83,0,0,0,0,0,0,0,0,0,7.95,0,0,0,0,0,0,0,0,0,0,0,0,0VINTAGE POST OFFICE CABINET,132.72,0,0,0,0,0,0,0,0,0,0,0,0,0,0,0,0,0,0,0,0,0,0,0CLEAR MILKSHAKE GLASS,6.3,0,0,0,0,0,0,0,0,0,0,0,0,0,0,0,0,0,0,0,0,0,0,0BIRDS MOBILE VINTAGE DESIGN,11.9,0,0,0,0,0,0,0,0,0,0,0,0,0,0,0,0,0,0,0,0,0,0,0DINOSAUR LUNCH BOX WITH CUTLERY,20.36,0,0,0,0,0,0,0,0,0,0,0,0,0,0,0,0,0,0,0,0,0,0,0CHARLIE AND LOLA TABLE TINS,28.37,0,0,0,0,0,0,0,0,0,0,0,0,0,0,0,0,0,0,0,0,0,0,0CHARLIE AND LOLA FIGURES TINS,104.6,0,0,0,0,0,0,0,0,0,0,0,0,0,0,0,0,0,0,0,0,0,0,0CAKE STAND WHITE TWO TIER LACE,67.96,0,0,0,8.5,0,0,0,0,0,0,8.5,0,0,0,0,0,0,0,0,0,0,0,0BLUE POLKADOT BOWL,26.09,0,1.06,0,1.25,0,0,0,0,0,0,0,1.06,0,0,0,0,0,0,0,0,0,0,0PINK  POLKADOT CUP,28.62,0,0.72,0,0.85,0,0,0,0,0,0,0,0.72,0,0,0,0,0,0,0,0,0,0,0PACK OF 6 SKULL PAPER CUPS,2.6,0.65,0,0,0,0,0,0,0,0,0,0,0,0,0,0,0,0,0,0,0,0,0,0PACK OF 6 SKULL PAPER PLATES,5.06,0,0,0,0,0,0,0,0,0,0,0,0,0,0,0,0,0,0,0,0,0,0,0PACK OF 20 SKULL PAPER NAPKINS,19.1,0.85,0,0,0,0,0,0,0,0,0,0,0,0,0,0,0,0,0,0,0,0,0,0200 BENDY SKULL STRAWS,10.01,0,0,0,1.25,0,0,0,0,0,0,0,0,0,0,0,0,0,0,0,0,0,0,0SKULLS PARTY BAG + STICKER SET,11.55,0,0,0,0,0,0,0,0,0,0,0,0,0,0,0,0,0,0,0,0,0,0,0STRAWBERRY HONEYCOMB  GARLAND ,10.2,0,0,0.65,0,0,0,0,0,0,0,0,0,0,0,0,0,0,0,0,0,0,0,0PINK POLKADOT BOWL,45.62,0,1.06,0,1.25,0,0,1.25,0,0,0,0,1.06,0,0,0,0,0,0,0,0,0,0,0SET OF 6 T-LIGHTS WEDDING CAKE ,5.9,0,0,0,0,0,0,0,0,0,0,0,0,0,0,0,0,0,0,0,0,0,0,0MINI CAKE STAND T-LIGHT HOLDER,6.78,0,0,0,0,0,0,0,0,0,0,0,0,0,0,0,0,0,0,0,0,0,0,0BLACK TEA-COFFEE-SUGAR JARS,11.35,0,0,0,0,0,0,0,0,0,0,0,0,0,0,0,0,0,0,0,0,0,0,0SHOE SHINE BOX ,119.4,0,0,0,0,0,0,0,0,0,0,0,0,0,0,0,0,0,0,0,0,0,0,0BREAD BIN DINER STYLE MINT,150.75,0,0,0,14.95,0,16.95,0,0,0,0,0,0,0,0,0,0,0,0,0,0,0,0,0VANILLA INCENSE 40 CONES IN TIN,3.75,0,0,0,0,0,0,0,0,0,0,0,0,0,0,0,0,0,0,0,0,0,0,0LAVENDER INCENSE 40 CONES IN TIN,2.5,0,0,0,0,0,0.85,0,0,0,0,0,0,0,0,0,0,0,0,0,0,0,0,0COLUMBIAN CANDLE ROUND ,12.51,0,0,0,0,0,0,0,0,0,0,0,0,0,0,0,0,0,0,0,0,0,0,0COLUMBIAN CANDLE RECTANGLE,9.05,0,0,0,0,0,0,0,0,0,0,0,0,0,0,0,0,0,0,0,0,0,0,0ZINC FINISH 15CM PLANTER POTS,12.33,0,0,0,0,0,0,0,0,0,0,0,0,0,0,0,0,0,0,0,0,0,0,0SILK PURSE BABUSHKA BLUE,83.96,0,0,0,0,0,0,0,0,0,0,0,0,0,0,0,0,0,0,0,0,0,0,0ARMY CAMO BOOKCOVER TAPE,0.42,0,0,0,0,0,0,0,0,0,0,0,0,0,0,0,0,0,0,0,0,0,0,0CARROT CHARLIE+LOLA COASTER SET,37.92,0,0,0,0,0,0,0,0,0,0,0,0,0,0,0,0,0,0,0,0,0,0,0MEMO BOARD COTTAGE DESIGN,206.96,0,4.25,0,9.9,0,0,0,0,0,0,0,4.25,0,0,0,0,0,0,0,0,0,0,0CHILDS GARDEN SPADE BLUE,16.81,0,1.85,0,0,0,0,0,0,0,0,0,1.85,0,0,0,0,0,0,0,0,0,0,0SKULLS GREETING CARD,3.79,0,0,0,0,0,0,0,0,0,0,0,0,0,0,0,0,0,0,0,0,0,0,0HANGING CHICK  YELLOW DECORATION,10.23,0,0,0,0,0,0,0,0,0,0,0,0,0,0,0,0,0,0,0,0,0,0,0SET OF 72 SKULL PAPER  DOILIES,12.01,0,0,0,1.45,0,0,0,0,0,0,0,0,0,0,0,0,0,0,0,0,0,1.45,0SPACEBOY GIFT WRAP,3.36,0,0,0,0,0,0,0,0,0,0,0,0,0,0,0,0,0,0,0,0,0,0,0BLUE GLASS CHUNKY CHARM BRACELET,17.9,0,0,0,0,0,0,0,0,0,0,0,0,0,0,0,0,0,0,0,0,0,0,0BLACK+WHITE NECKLACE W TASSEL,9.95,0,0,0,0,0,0,0,0,0,0,0,0,0,0,0,0,0,0,0,0,0,0,0AMBER CHUNKY GLASS+BEAD NECKLACE,59.7,0,0,0,0,0,0,0,0,0,0,0,0,0,0,0,0,0,0,0,0,0,0,0GINGHAM ROSE WRAP,2.52,0,0,0,0,0,0,0,0,0,0,0,0,0,0,0,0,0,0,0,0,0,0,012 PENCILS TALL TUBE POSY,4.25,0,0,0,0,0,0,0,0,0,0,0,0,0,0,0,0,0,0,0,0,0,0,012 COLOURED PARTY BALLOONS,5.83,0,0,0,0,0,0,0,0,0,0,0,0,0,0,0,0,0,0,0,0,0,0,0PINK FLOWER CROCHET FOOD COVER,15.12,0,0,0,0,0,0,0,0,0,0,0,0,0,0,0,0,0,0,0,0,0,0,0FLOWER VINE RAFFIA FOOD COVER,67.98,0,0,0,0,0,0,0,0,0,0,0,0,0,0,0,0,0,0,0,0,0,0,0FOOD/DRINK SPONGE STICKERS,0.84,0,0,0,0,0,0,0,0,0,0,0,0,0,0,0,0,0,0,0,0,0,0,0PINK HEART SHAPE PHOTO FRAME,14.97,0,0,0,0,0,0,0,0,0,0,0,0,0,0,0,0,0,0,0,0,0,0,0SILVER DIAMANTE PEN IN GIFT BOX,52.44,0,0,0,0,0,0,0,0,0,0,0,0,0,0,0,0,0,0,0,0,0,0,0BLUE JUICY FRUIT PHOTO FRAME,27.93,0,0,0,0,0,0,0,0,0,0,0,0,0,0,0,0,0,0,0,0,0,0,0GREEN JUICY FRUIT PHOTO FRAME,40.64,0,0,0,0,0,0,0,0,0,0,0,0,0,0,0,0,0,0,0,0,0,0,0GLITTER BUTTERFLY CLIPS,73.79,0,0,0,2.55,0,0,0,2.55,0,0,0,0,0,0,0,0,0,0,0,0,0,0,0VINTAGE UNION JACK MEMOBOARD,362.45,0,0,0,0,0,0,0,0,0,0,0,0,0,0,0,0,0,0,0,0,0,0,0WRAP PINK FAIRY CAKES ,5.04,0,0,0,0.42,0,0,0,0,0,0,0,0,0,0,0,0,0,0,0,0,0,0,0BABY BOOM RIBBONS ,5,0,0,0,1.25,0,0,0,0,0,0,0,0,0,0,0,0,0,0,0,0,0,0,0ENAMEL WASH BOWL CREAM,57.51,0,0,0,0,0,0,0,0,0,0,0,0,0,0,0,0,0,0,0,0,0,0,0DIAMANTE BOW BROOCH BLACK COLOUR,32.19,0,0,0,0,0,0,0,0,0,0,0,0,0,0,0,0,0,0,0,0,0,0,0DIAMANTE BOW BROOCH GREEN COLOUR,12.7,0,0,0,0,0,0,0,0,0,0,0,0,0,0,0,0,0,0,0,0,0,0,0DIAMANTE BOW BROOCH RED COLOUR,38.1,0,0,0,0,0,0,0,0,0,0,0,0,0,0,0,0,0,0,0,0,0,0,0LILY BROOCH AMETHYST COLOUR,9.9,0,0,0,0,0,0,0,0,0,0,0,0,0,0,0,0,0,0,0,0,0,0,0PAIR OF ENAMEL BUTTERFLY HAIRCLIP,10.05,0,0,0,0,0,0,0,0,0,0,0,0,0,0,0,0,0,0,0,0,0,0,0AMETHYST DIAMANTE EXPANDABLE RING,12.73,0,0,0,0,0,0,0,0,0,0,0,0,0,0,0,0,0,0,0,0,0,0,0PURPLE GEMSTONE BRACELET,26.85,0,0,0,0,0,0,0,0,0,0,0,0,0,0,0,0,0,0,0,0,0,0,0BLACK GEMSTONE BRACELET,17.9,0,0,0,0,0,0,0,0,0,0,0,0,0,0,0,0,0,0,0,0,0,0,0PURPLE GEMSTONE NECKLACE 45CM,25.5,0,0,0,0,0,0,0,0,0,0,0,0,0,0,0,0,0,0,0,0,0,0,05 STRAND GLASS NECKLACE BLACK,12.72,0,0,0,0,0,0,0,0,0,0,0,0,0,0,0,0,0,0,0,0,0,0,0AMETHYST HOOP EARRING FLORAL LEAF,8.86,0,0,0,0,0,0,0,0,0,0,0,0,0,0,0,0,0,0,0,0,0,0,0HANGING BAUBLE T-LIGHT HOLDER LARGE,5.9,0,0,0,0,0,0,0,0,0,0,0,0,0,0,0,0,0,0,0,0,0,0,0CUT GLASS HEXAGON T-LIGHT HOLDER,9.31,0,0,0,0,0,0,0,0,0,0,0,0,0,0,0,0,0,0,0,0,0,0,0CLAM SHELL SMALL ,12.61,0,0,0,0,0,0,0,0,0,0,0,0,0,0,0,0,0,0,0,0,0,0,0CLAM SHELL LARGE,7.5,0,0,0,0,0,0,0,0,0,0,0,0,0,0,0,0,0,0,0,0,0,0,0COCKLE SHELL DISH,16.83,0,0,0,0,0,0,0,0,0,0,0,0,0,0,0,0,0,0,0,0,0,0,0PARTY PIZZA DISH RED RETROSPOT,5.7,0,0,0.21,0.42,0,0,0,0,0,0,0,0,0,0,0,0,0,0,0,0,0,0,0SPACEBOY TV DINNER TRAY,188.28,0,0,4.25,0,0,0,0,0,0,0,0,0,0,0,0,0,0,0,0,0,0,0,0PINK TALL PORCELAIN T-LIGHT HOLDER ,2.55,0,0,0,0,0,0,0,0,0,0,0,0,0,0,0,0,0,0,0,0,0,0,0WHITE TALL PORCELAIN T-LIGHT HOLDER,40.68,0,0,0,0,0,0,0,0,0,0,0,0,0,0,0,0,0,2.55,0,0,0,0,0KEY FOB - FRONT  DOOR ,12.85,0,0,0,0,0,0,0,0,0,0,0,0,0,0,0,0,0,0,0,0,0,0,0KEY FOB - BACK DOOR ,26.71,0.65,0,0,0,0,0,0,0,0,0,0,0,0,0,0,0,0,0,0,0,0,0,0SET OF 6 CAKE CHOPSTICKS,42.72,0,0,0,0,0,0,0,0,0,0,0,0,0,0,0,0,0,0,0,0,0,0,0CHRYSANTHEMUM POCKET BOOK ,1.7,0,0,0,0,0,0,0,0,0,0,0,0,0,0,0,0,0,0,0,0,0,0,0GARDEN PATH POCKET BOOK,1.7,0,0,0,0,0,0,0,0,0,0,0,0,0,0,0,0,0,0,0,0,0,0,0RED DAISY POCKET BOOK ,5.95,0,0,0,0,0,0,0,0,0,0,0,0,0,0,0,0,0,0,0,0,0,0,0FROG SOCK PUPPET,14.75,0,0,0,0,0,0,0,0,0,0,0,0,0,0,0,0,0,0,0,0,0,0,0PINK HORSE SOCK PUPPET,64.97,0,0,0,0,0,0,0,0,0,0,0,0,0,0,0,0,0,0,0,0,0,0,06 ROCKET BALLOONS ,14.22,0,0,0,0,0,0,0,0,0,0,0,0,0,0,0,0,0,0,0,0,0,0,0BLACK WINE GLASS,3.3,0,0,0,0,0,0,0,0,0,0,0,0,0,0,0,0,0,0,0,0,0,0,0CLASSICAL ROSE CANDLESTAND,5.01,0,0,0,0,0,0.65,0,0,0,0,0,0,0,0,0,0,0,0,0,0,0,0,0BLACK CHAMPAGNE GLASS,3.3,0,0,0,0,0,0,0,0,0,0,0,0,0,0,0,0,0,0,0,0,0,0,0PINK OWL SOFT TOY,70.86,0,0,0,0,0,0,0,0,0,0,0,0,0,0,0,0,0,0,0,0,0,0,0RED RETROSPOT PEG BAG,65.15,0,0,0,0,0,4.2,0,0,0,0,0,0,0,2.1,0,0,0,0,0,0,0,0,0FAIRY CAKE DESIGN UMBRELLA,133.45,0,0,0,0,0,0,0,0,0,0,0,0,0,0,0,0,0,0,0,0,0,0,0WRAP- BILLBOARD FONTS DESIGN,2.52,0,0,0,0,0,0,0,0,0,0,0,0,0,0,0,0,0,0,0,0,0,0,0GIFT BAG PSYCHEDELIC APPLES,7.09,0,0,0,0,0,0,0,0,0,0,0,0,0,0,0,0,0,0,0,0,0,0,0WRAP GREEN PEARS ,1.26,0.42,0,0,0,0,0.42,0,0,0,0,0,0,0,0,0,0,0,0,0,0,0,0,04 ROSE PINK DINNER CANDLES,2.5,0,0,0,0,0,0,0,0,0,0,0,0,0,0,0,0,0,0,0,0,0,0,04 SKY BLUE DINNER CANDLES,8.78,0,0,0,0,0,0,0,0,0,0,0,0,0,0,0,0,0,0,0,0,0,0,0TWO DOOR CURIO CABINET,111.15,0,0,0,0,0,0,0,0,0,0,0,0,0,0,0,0,0,0,0,0,0,0,0PINK POLKADOT WRAP ,4.96,0,0,0,0,0,0,0,0,0,0,0,0,0,0,0,0,0,0,0,0,0,0,0ASSORTED COLOURS SILK FAN,24.14,0,0,0,0,0,0,0,0,0,0,0.75,0,0,0,0,0,0,0,0,0,0,0,0Bank Charges,15,0,0,0,0,0,0,0,0,0,0,0,0,0,0,0,0,0,0,0,0,0,0,0RED RETROSPOT BUTTER DISH,123.05,4.95,0,0,0,0,4.95,0,0,0,4.95,0,0,0,0,0,0,0,0,0,0,0,0,0LOVE GARLAND PAINTED ZINC ,11.66,0,0,0,0,0,0,0,0,0,0,0,0,0,0,0,0,0,0,0,0,0,0,0MEASURING TAPE BABUSHKA PINK,31.99,0,0,0,2.95,0,0,0,0,0,0,0,0,0,0,0,0,0,0,0,0,0,0,0VINTAGE KID DOLLY CARD ,11.79,0,0,0,0,0,0,0,0,0,0,0,0,0,0,0,0,0,0,0,0,0,0,0BLUE POLKADOT WRAP,6.14,0,0,0,0,0,0,0,0,0,0,0,0,0,0,0,0,0,0,0,0,0,0,0MIRROR LOVE BIRD T-LIGHT HOLDER,21.37,0,0,0,0,0,0,0,0,0,0,0,0,0,0,0,0,0,0,0,0,0,0,0BLACK LOVE BIRD T-LIGHT HOLDER,16.23,0,0,0,0,0,0,0,0,0,0,0,0,0,0,0,0,0,0,0,0,0,0,0HAND OPEN SHAPE GOLD,13.89,0,0,0,0,0,0,0,0,0,0,0,0,0,0,0,0,0,0,0,0,0,0,0FELT FARM ANIMAL WHITE BUNNY ,4.89,0.19,0,0,0,0,0,0,0,0,0,0,0,0,0,0,0,0,0,0.19,0,0,0,0SNOWSTORM PHOTO FRAME FRIDGE MAGNET,10.08,1.7,0,0,0,0,0,0,0,0,0,0,0,0,0,0,0,0,0,0,0,0,0,0RED POLKADOT PUDDING BOWL,6.3,0,0,0,2.1,0,0,0,0,0,0,0,0,0,0,0,0,0,0,0,0,0,0,0BLUE POLKADOT PUDDING BOWL,10.5,0,0,0,0,0,0,0,0,0,0,0,0,0,0,0,0,0,0,0,0,0,0,0VINTAGE BLUE TINSEL REEL,0.42,0,0,0,0,0,0,0,0,0,0,0,0,0,0,0,0,0,0,0,0,0,0,0JARDIN ETCHED GLASS BUTTER DISH,7.25,0,0,0,0,0,0,0,0,0,0,0,0,0,0,0,0,0,0,0,0,0,0,0SPACE FROG,15.94,0,0,0,0,0,0,0,0,0,0,0,0,0,0,0,0,0,1.25,0,0,0,0,0SPACE CADET BLACK,6.71,0,0,0,0,0,0,0,0,0,0,0,0,0,0,0,0,0,1.25,0,0,0,0,0SPACE CADET RED,5.45,1.25,0,0,0,0,0,0,0,0,0,0,0,0,0,0,0,0,1.25,0,0,0,0,0SPACE OWL,16.34,1.25,0,0,0,0,0,0,0,0,0,0,0,0,0,0,0,0,1.25,0,0,0,0,0SPACE CADET WHITE,3.35,0,0,0,0,0,0,0,0,0,0,0,0,0,0,0,0,0,1.25,0,0,0,0,0WOODLAND DESIGN  COTTON TOTE BAG,40.49,2.25,0,0,4.5,0,0,0,0,0,0,0,0,0,0,0,0,0,0,0,0,0,0,0