Product,United Kingdom,France,Australia,Netherlands,Germany,Norway,EIRE,Switzerland,Spain,Poland,Portugal,Italy,Belgium,Lithuania,Japan,Iceland,Channel Islands,Denmark,Cyprus,Sweden,Austria,Israel,Finland,BahrainWHITE HANGING HEART T-LIGHT HOLDER,817.18,0,0,0,0,0,5.9,0,2.95,0,2.95,0,0,0,0,0,0,0,2.55,0,0,0,0,0WHITE METAL LANTERN,210.08,0,0,0,0,0,0,0,0,0,0,0,0,0,0,0,0,0,0,0,0,0,0,0CREAM CUPID HEARTS COAT HANGER,148.31,0,0,0,0,0,0,0,0,0,0,0,0,0,0,0,0,0,0,0,0,0,0,0KNITTED UNION FLAG HOT WATER BOTTLE,650.3,0,0,0,0,0,0,0,0,0,0,0,0,0,0,0,0,0,0,0,0,0,0,0RED WOOLLY HOTTIE WHITE HEART.,580.7,3.75,0,0,0,0,0,0,3.75,0,0,0,0,0,0,0,0,0,0,0,0,0,0,0SET 7 BABUSHKA NESTING BOXES,746.83,8.5,0,0,24.65,0,8.5,0,0,0,0,0,0,0,0,0,0,7.65,0,0,0,0,0,0GLASS STAR FROSTED T-LIGHT HOLDER,210.26,0,0,0,0,0,0,0,0,0,0,0,0,0,0,0,0,0,0,0,0,0,0,0HAND WARMER UNION JACK,209.24,0,0,0,0,0,0,0,0,0,0,0,0,0,0,0,0,0,0,0,0,0,0,0HAND WARMER RED POLKA DOT,33.55,0,0,0,0,0,0,0,0,0,0,0,0,0,0,0,0,0,0,0,0,0,0,0ASSORTED COLOUR BIRD ORNAMENT,205.01,1.69,0,0,1.69,0,0,0,0,0,0,0,0,0,0,0,0,0,1.69,0,0,0,0,0POPPY'S PLAYHOUSE BEDROOM ,171.49,2.1,0,0,2.1,0,2.1,0,0,0,0,0,0,0,0,0,0,0,2.1,0,0,0,0,0POPPY'S PLAYHOUSE KITCHEN,165.64,4.2,0,0,2.1,0,2.1,0,0,0,0,0,0,0,0,0,0,0,2.1,0,0,0,0,0FELTCRAFT PRINCESS CHARLOTTE DOLL,207.21,7.5,0,3.39,0,0,3.75,0,0,0,0,0,0,0,3.75,0,0,0,7.5,3.75,0,0,0,0IVORY KNITTED MUG COSY ,71.65,0,0,0,0,0,0,0,0,0,0,0,0,0,0,0,0,0,0,0,0,0,0,0BOX OF 6 ASSORTED COLOUR TEASPOONS,149.08,0,0,0,0,0,0,0,0,0,0,0,0,0,0,4.25,0,0,0,0,0,0,0,0BOX OF VINTAGE JIGSAW BLOCKS ,170.07,0,0,0,0,0,9.9,0,0,0,4.95,0,0,0,4.25,0,0,0,0,0,0,0,0,0BOX OF VINTAGE ALPHABET BLOCKS,602.53,0,0,0,0,0,9.95,0,0,0,9.95,0,0,0,0,0,0,0,0,0,0,0,0,0HOME BUILDING BLOCK WORD,651.4,0,0,0,0,0,11.9,0,5.95,0,5.95,0,0,0,0,0,0,0,0,0,0,0,0,0LOVE BUILDING BLOCK WORD,403.3,0,0,0,0,0,0,0,5.95,0,0,0,0,0,0,0,0,0,0,0,0,0,0,0RECIPE BOX WITH METAL HEART,47.7,0,0,0,0,0,0,0,0,0,0,0,0,0,0,0,0,0,0,0,0,0,0,0DOORMAT NEW ENGLAND,432.06,0,0,0,0,0,7.95,0,0,0,0,0,0,0,0,0,0,0,0,0,0,0,0,0JAM MAKING SET WITH JARS,552.63,0,0,4.25,12.25,0,16.5,0,0,0,3.75,0,0,0,0,0,0,4.25,0,0,0,0,0,0RED COAT RACK PARIS FASHION,71.54,0,0,0,4.95,0,0,0,4.95,0,0,0,0,0,0,0,0,0,0,0,0,0,0,0YELLOW COAT RACK PARIS FASHION,76.49,0,0,0,0,0,0,0,4.95,0,0,0,0,0,0,0,0,0,0,0,0,0,0,0BLUE COAT RACK PARIS FASHION,122.16,0,0,0,4.95,0,4.95,0,4.95,0,0,0,0,0,0,0,0,4.95,0,0,0,0,0,0BATH BUILDING BLOCK WORD,208.78,0,0,0,0,0,0,0,0,0,5.95,0,0,0,0,0,0,0,0,0,0,0,0,0ALARM CLOCK BAKELIKE PINK,361.31,7.5,3.75,0,7.5,0,0,3.75,0,0,0,0,3.75,0,0,3.75,0,3.75,0,0,0,0,0,0ALARM CLOCK BAKELIKE RED ,441.41,7.5,3.75,0,3.75,0,0,3.75,0,0,0,0,3.75,0,0,3.75,0,3.75,0,0,0,0,0,0ALARM CLOCK BAKELIKE GREEN,509.99,7.5,3.75,0,0,0,0,3.75,3.75,0,0,0,3.75,0,0,3.75,0,3.75,0,0,0,0,0,0PANDA AND BUNNIES STICKER SHEET,14.25,0.85,0,0,0,0,0,0,0,0,0,0,0,0,0,0,0,0,0,0,0,0,0,0STARS GIFT TAPE ,10.44,0.84,0,0,0.84,0,0,0,0.65,0,0,0,0,0,0,0,0,0,0,0,0,0,0,0INFLATABLE POLITICAL GLOBE ,33.48,3.4,0,0,0,0,0.85,0,0,0,0,0,0,0,0,0,0,0,0,0,0,0,0,0VINTAGE HEADS AND TAILS CARD GAME ,95.67,5,1.25,0,1.25,0,0,0,0,0,1.25,0,1.25,0,0,0,0,0,0,0,0,0,0,0SET/2 RED RETROSPOT TEA TOWELS ,200.86,2.95,0,0,5.9,0,0,0,0,0,0,0,0,0,0,0,0,0,0,0,0,0,0,0ROUND SNACK BOXES SET OF4 WOODLAND ,163.75,14.75,0,2.55,26.55,0,0,2.95,0,0,0,0,0,0,0,0,0,2.95,0,2.95,0,0,0,0SPACEBOY LUNCH BOX ,176.7,1.95,0,1.65,1.95,0,0,1.95,0,0,0,0,0,0,0,0,0,0,0,0,0,0,0,0LUNCH BOX I LOVE LONDON,213.73,3.9,1.65,0,1.95,0,0,1.95,0,0,0,0,1.65,0,0,0,0,0,0,0,0,0,0,0CIRCUS PARADE LUNCH BOX ,71.93,3.9,0,0,1.95,0,0,1.95,1.95,0,0,0,0,0,0,0,0,0,0,0,0,0,0,0CHARLOTTE BAG DOLLY GIRL DESIGN,20.03,2.55,0,0,0,0,0,0,0,0,0,0,0,0,0.72,0,0,0,0,0,0,0,0,0RED TOADSTOOL LED NIGHT LIGHT,110.83,11.55,0,1.45,8.25,0,0,1.65,0,0,0,0,0,0,0,1.65,0,0,0,1.65,0,0,0,0 SET 2 TEA TOWELS I LOVE LONDON ,298.92,2.95,0,0,0,0,0,0,0,0,0,0,0,0,0,0,0,0,0,0,0,0,0,0VINTAGE SEASIDE JIGSAW PUZZLES,86.31,3.75,0,0,0,0,0,0,0,0,0,0,0,0,0,0,0,0,0,0,0,0,0,0MINI JIGSAW CIRCUS PARADE ,5.93,0.42,0,0,0,0.84,0,0.42,0,0,0.42,0,0,0,0,0,0,0,0,0,0,0,0,0MINI JIGSAW SPACEBOY,13.5,0.84,0,0,0,0.84,0,0.42,0,0,0,0,0,0,0,0,0,0,0,0,0,0,0,0MINI PAINT SET VINTAGE ,23.31,1.3,0.55,0,0,0,0.65,0,0,0,0,0,0.55,0,0,0.65,0,0,0,0,0,0,0,0POSTAGE,15,342,0,30,468,0,0,40,28,0,168,63,0,0,0,0,0,18,0,40,40,0,40,0PAPER CHAIN KIT 50'S CHRISTMAS ,590.33,2.95,0,0,0,0,2.95,0,0,0,0,0,0,0,0,0,0,0,0,0,0,0,0,0EDWARDIAN PARASOL RED,174.78,17.85,0,0,5.95,0,11.9,0,0,0,0,0,0,5.95,0,0,0,0,0,0,0,0,0,0RETRO COFFEE MUGS ASSORTED,494.47,0,0,0,0,0,0,0,0,0,0,0,0,0,0,0,0,0,0,0,0,0,0,0SAVE THE PLANET MUG,80.55,0,0,0,1.25,0,0,1.25,0,0,0,0,0,0,0,0,0,0,0,0,0,0,0,0VINTAGE BILLBOARD DRINK ME MUG,76.08,0,0,0,0,0,0,0,0,0,0,0,0,0,0,0,0,0,0,0,0,0,0,0VINTAGE BILLBOARD LOVE/HATE MUG,42.04,0,0,0,0,0,0,0,0,0,0,0,0,0,0,0,0,0,0,0,0,0,0,0WOOD 2 DRAWER CABINET WHITE FINISH,424.71,0,0,0,0,0,0,0,0,0,0,0,0,0,0,0,0,0,0,0,0,0,0,0WOOD S/3 CABINET ANT WHITE FINISH,584.12,0,0,0,0,0,0,0,0,0,0,0,0,0,0,0,0,0,0,0,0,0,0,0WOODEN PICTURE FRAME WHITE FINISH,230.71,0,0,0,0,0,5.1,0,0,0,0,0,0,0,0,0,0,0,0,0,0,0,0,0WOODEN FRAME ANTIQUE WHITE ,376.99,0,0,0,2.95,0,2.95,0,0,0,2.95,0,0,0,0,0,0,0,0,0,0,0,0,0VICTORIAN SEWING BOX LARGE,1203.91,0,0,0,10.95,0,12.75,0,0,0,0,0,0,0,0,0,0,0,0,0,0,0,0,0HOT WATER BOTTLE TEA AND SYMPATHY,455.88,3.95,0,0,0,7.9,7.9,0,0,0,3.95,0,0,0,0,0,0,0,0,0,0,0,0,0RED HANGING HEART T-LIGHT HOLDER,295.23,0,0,0,0,5.9,5.9,0,0,2.55,0,0,0,0,0,0,0,0,2.95,0,0,0,0,0JUMBO BAG PINK POLKADOT,176.25,1.95,0,0,1.95,0,0,0,1.95,0,0,0,0,0,0,0,0,0,0,0,0,0,0,0JUMBO  BAG BAROQUE BLACK WHITE,148.17,0,0,0,0,0,0,0,1.95,0,0,0,0,0,0,0,0,0,0,0,0,0,0,0JUMBO BAG CHARLIE AND LOLA TOYS,93.16,0,0,0,0,0,0,0,0,0,0,0,0,0,0,0,0,0,0,0,0,0,0,0STRAWBERRY CHARLOTTE BAG,67.72,0,0,0,0,0,0,0,0,0,0,0,0,0,0,0,0,0,0,0,0,0,0,0RED 3 PIECE RETROSPOT CUTLERY SET,203,3.75,0,3.39,0,0,0,0,0,0,0,0,0,0,0,3.75,0,0,0,0,0,0,0,0BLUE 3 PIECE POLKADOT CUTLERY SET,136.33,3.75,0,3.39,0,0,0,0,0,0,0,0,0,0,0,3.75,0,0,0,0,0,0,0,0SET/6 RED SPOTTY PAPER PLATES,23.05,0.85,0,0,0,0,0,0,0,0,0,0,0,0,0,0,0,0,0,0,0,0,0,0LUNCH BAG RED RETROSPOT,231.46,9.9,1.65,0,0,0,1.65,0,1.65,0,1.65,0,1.65,0,0,0,0,0,0,0,0,0,0,0STRAWBERRY LUNCH BOX WITH CUTLERY,133.98,15.3,0,0,2.55,0,0,0,0,0,0,0,0,0,0,0,0,0,0,0,0,0,0,0LUNCH BOX WITH CUTLERY RETROSPOT ,134.43,17.85,0,2.1,2.55,0,0,0,0,0,2.55,0,0,0,0,0,0,0,0,0,0,0,0,0PACK OF 72 RETROSPOT CAKE CASES,74.89,1.65,0,0.42,1.65,1.1,1.1,0,0,0,0,0,0,0,0,0,0,0,0,0.55,0,0,0,0PACK OF 60 DINOSAUR CAKE CASES,18.71,0.55,0,0,0.55,0,0,0,0,0,0,0,0,0,0,0,0,0,0,0,0,0,0,0PACK OF 60 PINK PAISLEY CAKE CASES,49.93,0.55,0,0,0.55,1.1,0.55,0,0,0,0,0.55,0,0,0,0,0,0,0,0.55,0,0,0.97,060 TEATIME FAIRY CAKE CASES,58.04,0,0,0,1.1,1.1,1.1,0,0,0,0,0,0,0,0,0,0,0,0,0,0,0,0.97,0TOMATO CHARLIE+LOLA COASTER SET,21.44,0,0,0,0,0,0,0,0,0,0,0,0,0,0,0,0,0,0,0,0,0,0,0CHARLIE & LOLA WASTEPAPER BIN FLORA,27.74,0,0,0,0,0,0,0,0,0,0,0,0,0,0,0,0,0,0,0,0,0,0,0RED CHARLIE+LOLA PERSONAL DOORSIGN,7.98,0,0,0,0,0,0,0,0,0,0,0,0,0,0,0,0,0,0,0,0,0,0,0JUMBO STORAGE BAG SUKI,194.31,0,0,1.95,0,0,0,0,0,0,3.9,0,0,0,0,0,0,0,0,0,0,0,0,0JUMBO BAG PINK VINTAGE PAISLEY,125.25,0,0,0,0,0,0,0,0,0,1.95,0,0,0,0,0,0,0,0,0,0,0,0,0JAM MAKING SET PRINTED,248.76,7.25,0,0,11.6,2.9,4.35,0,0,1.45,0,0,0,0,1.45,0,0,0,0,0,0,0,0,0RETROSPOT TEA SET CERAMIC 11 PC ,102.78,0,0,0,0,0,0,0,0,0,0,0,0,0,0,0,0,0,0,0,0,0,0,0GIRLY PINK TOOL SET,4.95,0,0,0,0,0,0,0,0,0,0,0,0,0,0,0,0,0,0,0,0,0,0,0JUMBO SHOPPER VINTAGE RED PAISLEY,183.02,0,0,0,0,0,1.95,0,0,0,3.9,0,0,0,0,0,0,0,0,0,0,0,0,0AIRLINE LOUNGE-METAL SIGN,75.73,0,0,0,0,0,0,0,0,0,0,0,0,0,0,0,0,0,0,0,0,0,0,0WHITE SPOT RED CERAMIC DRAWER KNOB,38.87,0,0,0,1.25,0,2.5,0,0,0,0,0,0,0,0,0,0,0,0,0,0,0,0,0RED DRAWER KNOB ACRYLIC EDWARDIAN,27.15,0,0,0,0,0,0,0,0,0,0,0,0,0,0,1.25,0,0,0,0,0,0,0,0CLEAR DRAWER KNOB ACRYLIC EDWARDIAN,39.67,0,0,0,0,0,0,0,0,0,0,0,0,0,0,1.25,0,0,0,0,0,0,0,0PHOTO CLIP LINE,6.26,0,0,0,0,0,0,0,0,0,0,0,0,0,0,0,0,0,0,0,0,0,0,0FELT EGG COSY CHICKEN,24.25,0,0,0,0,0,0,0,0,0,0,0,0,0,0,0,0,0,0,0,0,0,0,0PIGGY BANK RETROSPOT ,138.88,0,0,0,0,0,0,0,0,0,2.55,0,0,0,0,0,0,0,0,0,0,0,0,0SKULL SHOULDER BAG,105.53,0,0,0,0,0,0,0,1.65,0,0,0,0,0,0,0,0,0,0,0,0,0,0,0YOU'RE CONFUSING ME METAL SIGN ,105.43,0,0,0,0,0,0,0,0,0,0,0,0,0,0,0,1.69,0,0,0,0,0,0,0COOK WITH WINE METAL SIGN ,196.72,0,0,0,0,3.9,1.95,0,0,0,0,0,0,0,0,0,0,0,0,0,0,0,0,0GIN + TONIC DIET METAL SIGN,203.67,0,0,0,2.1,0,0,0,0,0,0,0,0,0,0,0,0,0,0,0,0,0,0,0YELLOW BREAKFAST CUP AND SAUCER,23.63,0,0,0,0,0,0,0,0,0,0,0,0,0,0,0,0,0,0,0,0,0,0,0PINK BREAKFAST CUP AND SAUCER ,14.77,0,0,0,0,0,0,0,0,0,0,0,0,0,0,0,0,0,0,0,0,0,0,0PAPER CHAIN KIT RETROSPOT,262.95,0,0,0,0,0,0,0,0,0,0,0,0,0,0,0,0,0,2.95,0,0,0,0,0SMALL HEART FLOWERS HOOK ,14.29,0,0,0,0,0,0,0,0,0,0,0,0,0,0,0,0,0,0,0,0,0,0,0TEA TIME DES TEA COSY,71.93,0,0,0,0,0,0,0,0,0,0,0,0,0,0,0,0,0,0,0,0,0,0,0FELT EGG COSY WHITE RABBIT ,14.21,0,0,0,0,0,0,0,0,0,0,0,0,0,0,0,0,0,0,0,0,0,0,0ZINC WILLIE WINKIE  CANDLE STICK,39.27,0,0,0,0,0,0.85,0,0,0,0,0,0,0,0,0,0,0,0,0,0,0,0,0CERAMIC CHERRY CAKE MONEY BANK,89.64,2.9,0,0,2.9,0,0,0,0,0,0,0,0,0,0,0,0,0,0,0,0,0,0,0RETROSPOT LARGE MILK JUG,133.22,9.2,0,0,0,0,4.95,0,0,0,0,0,0,0,0,0,0,0,0,0,0,0,0,0SET OF 6 FUNKY BEAKERS,88.6,0,0,0,0,0,0,0,0,0,0,0,0,0,0,0,0,0,0,0,0,0,0,0EDWARDIAN PARASOL BLACK,314.24,17.85,0,0,0,0,11.9,0,0,0,0,0,0,5.95,0,0,0,0,0,0,0,0,0,0EDWARDIAN PARASOL NATURAL,312.41,11.9,0,0,0,0,5.95,0,0,0,0,5.95,0,5.95,0,0,0,0,0,0,0,0,0,0CERAMIC STRAWBERRY CAKE MONEY BANK,118.3,0,0,0,1.45,0,0,0,1.45,0,0,0,0,0,0,0,0,0,0,0,0,0,0,0BLUE OWL SOFT TOY,50.17,0,0,0,0,0,0,0,0,0,0,0,0,0,0,0,0,0,0,0,0,0,0,0BALLOON ART MAKE YOUR OWN FLOWERS,24.19,0,0,0,0,0,0,0,0,0,0,0,0,0,0,0,0,0,0,0,0,0,0,0GLASS CLOCHE SMALL,102.19,0,0,0,3.95,0,0,0,0,0,0,0,0,0,0,0,0,0,0,0,0,0,0,0GUMBALL MONOCHROME COAT RACK,37.24,0,0,0,0,0,0,0,0,0,0,0,0,0,0,0,0,0,0,0,0,0,0,0DOORMAT FANCY FONT HOME SWEET HOME,448.95,0,0,0,0,0,22.65,0,0,0,0,0,0,0,0,0,7.95,0,0,0,0,0,0,0Discount,0,0,0,0,0,0,0,0,0,0,0,0,0,0,0,0,0,0,0,0,0,0,0,0VINTAGE SNAKES & LADDERS,185.19,0,0,0,0,0,7.5,0,0,0,0,0,0,0,0,0,0,0,0,0,0,0,0,0CHOCOLATE CALCULATOR,85.35,0,0,0,0,0,1.65,1.65,0,0,1.65,0,0,0,0,0,0,0,0,0,0,0,0,0RECYCLING BAG RETROSPOT ,201.45,0,1.85,0,2.1,0,0,0,0,0,0,0,1.85,0,0,0,0,0,0,0,0,0,0,0TOY TIDY PINK POLKADOT,73.09,0,0,0,0,0,0,0,0,0,0,0,0,0,0,0,0,0,0,0,0,0,0,0ANTIQUE GLASS DRESSING TABLE POT,141.7,0,0,0,0,0,2.95,0,0,0,0,0,0,0,0,0,0,0,0,0,0,0,0,0IVORY GIANT GARDEN THERMOMETER,273.46,0,5.95,0,5.95,0,0,0,0,0,0,0,5.95,0,0,0,0,0,0,0,0,0,0,03 TIER CAKE TIN GREEN AND CREAM,626.47,0,0,0,0,0,0,0,0,0,0,0,0,0,0,0,0,0,0,0,0,0,0,03 TIER CAKE TIN RED AND CREAM,403.04,0,0,0,0,0,0,0,0,0,0,0,0,0,0,0,0,0,0,0,0,0,0,0SET 3 WICKER OVAL BASKETS W LIDS,177.3,0,0,0,0,0,0,0,0,0,0,0,0,0,0,0,0,0,0,0,0,0,0,0SET OF 3 COLOURED  FLYING DUCKS,108.85,0,5.45,0,0,0,0,0,0,0,0,0,5.45,0,0,0,0,0,0,0,0,0,0,0WOOD BLACK BOARD ANT WHITE FINISH,471.94,0,0,0,0,0,0,0,0,0,0,0,0,0,0,0,0,0,0,0,0,0,0,0COLOUR GLASS T-LIGHT HOLDER HANGING,17.43,0,0,0,0,0,0,0,0,0,0,0,0,0,0,0,0,0,0,0,0,0,0,0HANGING METAL HEART LANTERN,54.99,0,0,0,0,0,0,0,0,0,0,0,0,0,0,0,0,0,0,0,0,0,0,0HANGING MEDINA LANTERN SMALL,32.49,0,0,0,0,0,0,0,0,0,0,0,0,0,0,0,0,0,0,0,0,0,0,0NATURAL SLATE HEART CHALKBOARD ,426.53,0,0,0,0,0,0,0,0,0,2.95,0,0,0,0,0,0,0,0,0,0,0,0,0HEART OF WICKER SMALL,329.2,1.65,0,0,0,0,0,0,1.65,0,0,0,0,0,0,0,0,0,0,0,0,0,0,0HEART OF WICKER LARGE,438,0,0,0,0,0,0,0,0,0,0,0,0,0,0,0,0,0,0,0,0,0,0,0WHITE LOVEBIRD LANTERN,85.65,0,0,0,0,0,0,0,0,0,0,0,0,0,0,0,0,0,0,0,0,0,0,0CLASSIC METAL BIRDCAGE PLANT HOLDER,300.36,0,0,0,0,0,0,0,9.95,0,0,0,0,0,0,0,0,0,0,0,0,0,0,0CREAM HEART CARD HOLDER,234.99,0,0,0,0,0,7.9,0,0,0,0,0,0,0,0,0,0,0,0,0,0,0,0,0ENAMEL FLOWER JUG CREAM,213.99,0,0,0,0,0,0,0,0,0,0,0,0,0,0,0,0,0,0,0,0,0,0,0ENAMEL FIRE BUCKET CREAM,134.17,0,0,0,0,0,0,0,0,0,0,0,0,0,0,0,0,0,0,0,0,0,0,0ENAMEL BREAD BIN CREAM,506.2,0,0,0,0,0,0,0,0,0,0,0,0,0,0,0,0,0,0,0,0,0,0,0JUMBO BAG DOLLY GIRL DESIGN,42.42,0,0,0,0,0,0,0,0,0,0,0,0,0,0,0,0,0,0,0,0,0,0,0TRADITIONAL CHRISTMAS RIBBONS,87.29,1.25,0,0,0,0,0,0,0,0,0,0,0,0,0,0,0,0,0,0,0,0,0,0ORGANISER WOOD ANTIQUE WHITE ,102,0,0,0,0,0,0,0,0,0,0,0,0,0,0,0,0,0,0,0,0,0,0,0LUNCH BAG DOLLY GIRL DESIGN,74.19,1.65,0,0,0,0,0,0,0,0,0,0,0,0,1.65,0,0,0,0,0,0,0,0,0WHITE WIRE EGG HOLDER,102.98,0,0,0,0,0,0,0,0,0,0,0,0,0,4.95,0,0,0,0,0,0,0,0,0JUMBO BAG RED RETROSPOT,325.86,0,1.95,0,3.9,0,1.95,0,1.95,0,1.95,0,1.95,0,0,0,0,0,0,0,0,0,0,0CHILLI LIGHTS,549.63,0,0,0,0,0,4.95,0,0,0,0,0,0,0,0,0,0,0,0,0,0,0,0,0LIGHT GARLAND BUTTERFILES PINK,36.49,0,0,0,0,0,0,0,0,0,0,0,0,0,0,0,0,0,0,0,0,0,0,0WOODEN OWLS LIGHT GARLAND ,70.49,0,0,0,0,0,0,0,0,0,0,0,0,0,0,0,0,3.75,0,0,0,0,0,0FAIRY TALE COTTAGE NIGHTLIGHT,74.56,1.95,0,0,0,0,0,0,0,0,0,0,0,0,0,0,0,0,0,1.95,0,0,0,0HOME SMALL WOOD LETTERS,195.47,0,0,0,0,0,4.95,0,0,0,0,0,0,0,0,0,0,0,0,0,0,0,0,0GINGHAM HEART  DOORSTOP RED,139.95,0,0,0,0,0,8.5,0,0,0,0,0,0,0,0,0,0,0,0,0,0,0,0,0FIVE HEART HANGING DECORATION,82.69,2.95,0,0,0,0,0,0,0,0,0,0,0,0,0,0,0,0,0,0,0,0,0,0ASSORTED BOTTLE TOP  MAGNETS ,53.48,0.42,0.36,0,0,0,0,0,0,0,0,0,0.36,0,0,0,0,0,0,0.42,0,0,0,0FRIDGE MAGNETS US DINER ASSORTED,40.58,0,0,0,0,0,0,0,0,0,0,0,0,0,0,0,0,0,0,0,0,0,0,0HOMEMADE JAM SCENTED CANDLES,142.53,0,0,0,2.9,0,2.9,0,0,1.45,0,1.45,0,0,0,0,0,0,0,0,0,0,0,0FRIDGE MAGNETS LES ENFANTS ASSORTED,18.67,0,0,0,0.85,0,0,0,0,0,0.85,0,0,0,0,0,0,0,0,0,0,0,0,0ROSE CARAVAN DOORSTOP,140.58,0,0,0,0,0,0,0,0,0,0,0,0,0,0,0,0,0,0,0,0,0,0,05 HOOK HANGER MAGIC TOADSTOOL,24.79,0,0,0,3.3,0,0,0,0,0,0,0,0,0,1.65,0,0,0,0,1.65,0,0,0,0CHRISTMAS LIGHTS 10 REINDEER,568.39,0,8.5,0,0,0,8.5,0,0,0,0,0,8.5,0,0,0,0,0,0,0,0,0,0,0VINTAGE UNION JACK CUSHION COVER,80.31,0,4.95,0,4.95,0,0,0,0,0,0,0,4.95,0,0,0,0,0,0,0,0,0,0,0SET OF 3 GOLD FLYING DUCKS,0,0,6.35,0,0,0,0,0,0,0,0,0,6.35,0,0,0,0,0,0,0,0,0,0,0RED RETROSPOT UMBRELLA,329.29,0,5.95,0,5.95,0,0,0,0,0,5.95,0,5.95,0,0,0,0,0,0,0,0,0,0,0BLACK/BLUE POLKADOT UMBRELLA,225.89,0,5.95,0,0,0,0,0,0,0,5.95,0,5.95,0,0,0,0,0,0,0,0,0,0,0RED DINER WALL CLOCK,211.63,0,8.5,0,0,0,8.5,0,0,0,0,0,8.5,0,0,0,0,0,0,0,0,0,0,0BLUE DINER WALL CLOCK,178.46,0,8.5,0,0,0,0,0,0,0,0,0,8.5,0,0,0,0,0,0,0,0,0,0,0IVORY DINER WALL CLOCK,203.98,8.5,8.5,0,0,0,0,0,0,0,0,0,8.5,0,0,0,0,0,0,0,0,0,0,0LARGE HEART MEASURING SPOONS,115.17,0,3.3,0,0,0,0,0,0,0,0,0,3.3,0,0,1.65,0,0,0,0,0,0,0,0SMALL HEART MEASURING SPOONS,71.82,0,1.7,0,0,0,0,0,0,0,0,0,1.7,0,0,0,0,0,0,0,0,0,0,0JAM JAR WITH PINK LID,44.95,0.85,0,0,5.1,1.7,1.7,0,0,0,0,0,0,0,0,0,0,0,0,0,0.85,0,0,0JAM JAR WITH GREEN LID,45.08,0,0,0,4.12,1.7,1.7,0,0,0,0,0,0,0,0,0,0,0,0,0,0,0,0,0ROSE COTTAGE KEEPSAKE BOX ,548.17,8.5,0,0,38.35,0,9.95,0,0,0,0,0,0,0,0,0,0,0,0,0,0,0,0,0HANGING HEART ZINC T-LIGHT HOLDER,87.06,0,0,0,0,0,0,0,0,0,0,0,0,0,0,0,0,0,0,0,0,0,0,0PAPER CHAIN KIT VINTAGE CHRISTMAS,467.5,5.9,0,0,0,0,2.95,0,0,0,0,0,0,0,0,0,0,0,0,0,0,0,0,0DISCO BALL CHRISTMAS DECORATION,4.92,0,0,0,0.12,0,0.12,0,0,0,0,0,0,0,0,0,0,0,0,0,0,0,0,0SMALL POPCORN HOLDER,136.37,1.7,0,0,0.85,1.7,1.7,0,0,0,0,0,0,0,0,0,0,0,0,0,0,0,0,0LARGE POPCORN HOLDER ,150.71,1.65,0,0,0,3.1,3.3,0,0,0,0,0,0,0,0,0,0,0,0,0,0,0,0,0SET/20 RED RETROSPOT PAPER NAPKINS ,64.13,0.85,0,0,0,1.7,0,0,0,0,0,0,0,0,0.85,0,0,0,0,0,0,0,0,0SET/6 RED SPOTTY PAPER CUPS,18.87,1.95,0,0,0,0,0,0,0,0,0,0,0,0,0,0,0,0,0,0,0,0,0,0POLKADOT RAIN HAT ,16.73,1.26,0,0,0,0.84,0,0,0,0,0,0,0,0,0,0,0,0,0,0,0,0,0,0DELUXE SEWING KIT ,473.43,5.95,0,0,5.95,0,5.95,0,0,0,0,0,0,0,5.95,0,0,0,0,0,0,0,0,0RETROSPOT HEART HOT WATER BOTTLE,749.78,4.95,0,0,4.95,0,0,0,0,0,4.95,0,0,0,0,0,4.95,0,0,0,0,0,0,0ENGLISH ROSE HOT WATER BOTTLE,408.28,0,0,0,8.5,0,4.25,0,0,0,0,0,0,0,0,0,0,0,0,0,0,0,0,0PHOTO CUBE,143.67,1.65,0,0,0,0,0,0,0,0,0,0,0,0,0,0,0,0,0,0,0,0,0,0PLASTERS IN TIN CIRCUS PARADE ,87.07,6.6,0,0,6.6,3.3,0,1.65,1.65,0,1.65,0,0,0,0,0,0,0,0,0,0,0,0,0PACK OF 12 PINK PAISLEY TISSUES ,12.81,0,0,0,0.29,0.58,0,0,0,0,0,0,0,0,0,0,0,0,0,0,0,0,0,0PACK OF 12 BLUE PAISLEY TISSUES ,7.42,0,0,0,0,0.58,0,0,0,0,0,0,0,0,0,0,0,0,0,0,0,0,0,0PACK OF 12 RED RETROSPOT TISSUES ,10.28,0.87,0,0,0,0.58,0,0,0,0,0,0,0,0,0,0,0,0,0,0,0,0,0,0CHICK GREY HOT WATER BOTTLE,452.33,0,0,0,3.45,0,3.45,0,0,0,0,0,0,0,0,0,0,0,0,0,0,0,0,0PLASTERS IN TIN VINTAGE PAISLEY ,128.87,1.65,1.65,0,1.65,3.3,0,0,0,0,1.65,0,1.65,0,0,0,0,0,0,0,0,0,0,0PLASTERS IN TIN SKULLS,143.2,0,0,0,0,3.3,0,0,1.65,0,0,0,0,1.65,0,0,0,0,0,0,0,0,0,03 STRIPEY MICE FELTCRAFT,121.08,0,0,0,0,0,7.8,0,0,0,1.95,0,0,0,0,0,0,0,1.95,0,0,0,0,0SET OF 6 SOLDIER SKITTLES,242.04,3.75,3.39,0,0,0,3.75,0,0,0,0,0,3.39,0,3.75,0,0,0,0,0,0,0,0,0TRADITIONAL WOODEN SKIPPING ROPE,65.15,0,1.06,0,0,0,1.25,0,0,0,2.5,0,1.06,0,0,0,0,0,0,0,0,0,0,0WOODEN BOX OF DOMINOES,116.42,1.25,0,0,0,0,2.5,0,0,0,1.25,0,0,0,0,0,0,0,0,0,0,0,0,0RUSTIC  SEVENTEEN DRAWER SIDEBOARD,310,0,0,0,0,0,0,0,0,0,0,0,0,0,0,0,0,0,0,0,0,0,0,0PARTY CONES CARNIVAL ASSORTED,22.72,0,0,0,0,0,0,0,0,0,0,0,0,0,0,0,0,0,0,0,0,0,0,0PARTY CONES CANDY ASSORTED,11.25,0,0,0,0,0,0,0,0,0,0,0,0,0,0,0,0,0,0,0,0,0,0,0PICNIC BASKET WICKER SMALL,405.19,0,0,0,0,0,0,0,0,0,0,0,0,0,0,0,0,0,0,0,0,0,0,0STAR DECORATION PAINTED ZINC ,10.95,0,0,0,0,0,0.65,0,0.65,0,0,0,0,0,0,0,0,0,0,0,0,0,0,0RETROSPOT LAMP,140.51,9.95,0,0,0,0,9.95,0,0,0,0,0,0,0,0,0,0,0,0,0,0,0,0,0FANCY FONT BIRTHDAY CARD,0.42,0,0,0,0,0,0,0,0,0,0,0,0,0,0,0,0,0,0,0,0,0,0,0HAND WARMER SCOTTY DOG DESIGN,199.07,0,0,0,0,2.1,2.1,0,0,0,0,0,0,0,0,0,0,0,0,0,0,0,0,0HAND WARMER OWL DESIGN,187.08,0,0,0,4.2,2.1,2.1,0,0,0,0,0,0,0,0,0,0,0,0,0,0,0,0,0HAND WARMER RED RETROSPOT,163.38,2.1,0,0,0,2.1,2.1,0,0,0,0,0,0,0,0,0,0,0,0,0,0,0,0,0DOG BOWL CHASING BALL DESIGN,37.86,0,0,0,0,0,0,0,0,0,0,0,0,0,0,0,0,0,0,0,0,0,0,0CLOTHES PEGS RETROSPOT PACK 24 ,111.48,7.45,0,1.25,1.49,2.98,0,0,0,0,0,0,0,0,1.25,0,0,0,0,0,0,0,0,0HAND OVER THE CHOCOLATE   SIGN ,183.04,0,0,0,2.1,2.1,0,0,0,0,0,0,0,0,0,0,0,0,0,0,0,0,0,0TRAVEL SEWING KIT,121.32,1.65,0,0,3.3,0,1.65,0,0,0,0,0,0,0,0,0,0,0,0,0,0,0,0,0BLACK HEART CARD HOLDER,127.16,0,0,0,0,0,0,0,0,0,0,0,0,0,0,0,0,0,0,0,0,0,0,0SMALL GLASS HEART TRINKET POT,167.75,0,0,0,0,0,0,0,0,0,0,0,0,0,0,0,0,0,0,0,0,0,0,0ALARM CLOCK BAKELIKE IVORY,275.08,0,0,0,3.75,0,0,3.75,0,0,0,0,0,0,0,0,0,3.75,0,0,0,0,0,0ALARM CLOCK BAKELIKE ORANGE,292.36,3.75,0,0,0,0,0,3.75,0,0,0,0,0,0,0,3.75,0,3.75,0,0,0,0,0,0HAND WARMER BIRD DESIGN,292.59,0,0,1.85,2.1,0,2.1,0,0,0,2.1,0,0,0,0,0,0,0,0,0,0,0,0,0IVORY EMBROIDERED QUILT ,441.6,0,0,0,0,0,0,0,0,0,0,0,0,0,0,0,0,0,0,0,0,0,0,0SET OF 3 BLACK FLYING DUCKS,38.83,0,0,0,0,0,0,0,0,0,0,0,0,0,0,0,0,0,0,0,0,0,0,0RED RETROSPOT MUG,73.41,0,0,0,0,0,0,0,0,0,2.95,0,0,0,0,0,0,0,0,0,0,0,0,0BABUSHKA LIGHTS STRING OF 10,196.03,0,0,0,6.75,0,0,0,0,0,0,0,0,0,0,0,0,0,0,0,0,0,0,0DOORMAT FAIRY CAKE,337.98,0,0,0,7.95,0,0,0,0,0,0,0,0,0,0,0,0,0,0,0,0,0,0,0STRAWBERRY CERAMIC TRINKET BOX,139.54,0,0,0,3.75,0,0,0,0,1.25,0,0,0,0,0,0,0,0,1.25,0,0,0,0,0PINK DOUGHNUT TRINKET POT ,71.65,1.65,0,0,1.65,0,0,0,0,0,0,0,0,0,0,0,0,0,0,0,0,0,0,0SILK PURSE BABUSHKA PINK,84.1,0,0,0,0,0,0,0,0,0,0,0,0,0,0,0,0,0,0,0,0,0,0,0HOT WATER BOTTLE I AM SO POORLY,654.3,0,0,0,0,0,9.3,0,0,0,0,0,0,0,0,0,0,0,0,0,0,0,0,0CHOCOLATE HOT WATER BOTTLE,921.36,0,0,0,0,0,14.85,4.95,0,0,0,0,0,0,0,0,4.95,0,0,0,0,0,0,0WHITE SKULL HOT WATER BOTTLE ,613.83,0,0,0,0,0,0,0,3.75,0,0,0,0,0,0,0,0,0,0,0,0,0,0,0SCOTTIE DOG HOT WATER BOTTLE,937.57,4.95,0,0,4.95,0,0,0,0,0,0,0,0,0,0,0,0,0,0,0,0,0,0,0BIRD HOUSE HOT WATER BOTTLE,178.77,2.55,0,0,0,0,0,0,0,0,0,0,0,0,0,0,0,0,0,0,0,0,0,0BOUDOIR SQUARE TISSUE BOX,30.06,0,0,0,0,0,0,0,0,0,0,0,0,0,0,0,0,0,0,0,0,0,0,0SKULLS SQUARE TISSUE BOX,30.08,0,0,0,0,0,0,0,0,0,0,0,0,0,0,0,0,0,0,0,0,0,0,0PHOTO FRAME CORNICE,141.68,0,0,0,0,0,0,0,0,0,0,0,0,0,0,0,0,0,0,0,0,0,0,0SILK PURSE BABUSHKA RED,161.64,3.35,0,0,0,0,0,0,0,0,0,0,0,0,0,0,0,0,0,0,0,0,0,0PICTURE DOMINOES,90.47,2.9,0,0,2.9,0,1.45,0,0,0,0,0,0,0,1.25,0,0,0,0,0,0,0,0,0S/6 SEW ON CROCHET FLOWERS,11.27,1.25,0,0,0,0,0,0,0,0,0,0,0,0,0,0,0,0,0,0,0,0,0,0SCANDINAVIAN REDS RIBBONS,95.63,1.25,0,0,2.5,0,1.25,0,0,0,0,0,0,0,0,0,0,0,0,0,0,0,0,0BALLOONS  WRITING SET ,100.26,1.65,0,0,1.65,0,0,0,0,0,0,0,0,0,0,0,0,0,0,0,0,0,0,0LAVENDER INCENSE IN TIN,7.88,0,0,0,0,0,0,0,0,0,0,0,0,0,0,0,0,0,0,0,0,0,0,0TV DINNER TRAY VINTAGE PAISLEY,158.17,0,0,0,0,0,0,0,0,0,0,0,0,0,0,0,0,0,0,0,0,0,0,0SET OF 4 ENGLISH ROSE PLACEMATS,119.01,0,0,0,0,0,0,0,0,0,0,0,0,0,0,0,0,0,0,0,0,0,0,0SET OF 4 ENGLISH ROSE COASTERS,40.12,0,0,0,0,0,0,0,0,0,0,0,0,0,0,0,0,0,0,0,0,0,0,0TRIPLE PHOTO FRAME CORNICE ,158.23,0,0,0,0,0,0,0,0,0,0,0,0,0,0,0,0,0,0,0,0,0,0,0FAMILY PHOTO FRAME CORNICE,328.33,0,0,0,0,0,9.95,0,0,0,0,0,0,0,0,0,0,0,0,0,0,0,0,0MIRRORED DISCO BALL ,105.6,0,0,0,0,0,0,0,0,0,0,0,0,0,0,0,0,0,0,0,0,0,0,0DISCO BALL ROTATOR BATTERY OPERATED,63.75,0,0,0,0,0,0,0,0,0,0,0,0,0,0,0,0,0,0,0,0,0,0,0SILVER LOOKING MIRROR,4.95,0,0,0,0,0,0,0,0,0,0,0,0,0,0,0,0,0,0,0,0,0,0,0LADIES & GENTLEMEN METAL SIGN,206.17,0,0,0,0,5.1,0,0,0,0,0,0,0,0,0,0,0,0,0,0,0,0,0,0METAL SIGN HER DINNER IS SERVED ,43.41,0,0,0,0.85,0,0,0,0,0,0,0,0,0,0,0,0,0,0,0,0,0,0,0DOORMAT TOPIARY,104.49,0,0,0,0,0,0,0,0,0,0,0,0,0,0,0,0,0,0,0,0,0,0,0BATHROOM METAL SIGN,44.1,0,0,0,0,0,0,0,0,0,0,0,0,0,0,0,0,0,0,0,0,0,0,0KITCHEN METAL SIGN,16.84,0,0,0,0,0,0,0,0,0,0,0,0,0,0,0,0,0,0,0,0,0,0,0TOILET METAL SIGN,19.77,0,0,0,0,0,0,0,0,0,0,0,0,0,0,0,0,0,0,0,0,0,0,0METAL SIGN TAKE IT OR LEAVE IT ,132.87,8.85,0,0,0,2.95,2.95,0,0,0,2.95,0,0,0,0,0,0,0,0,0,0,0,0,0I'M ON HOLIDAY METAL SIGN,54.39,0,0,0,0,0,0,0,0,0,0,0,0,0,0,0,0,0,0,0,0,0,0,0GROW YOUR OWN BASIL IN ENAMEL MUG,73.57,0,0,0,0,0,0,0,0,0,2.1,0,0,0,0,0,0,0,0,0,0,0,0,0SET/10 PINK POLKADOT PARTY CANDLES,24.84,1.25,0,0,1.25,0,0,0,0,0,0,0,0,0,0,0,0,0,0,0,0,0,0,0SET 20 NAPKINS FAIRY CAKES DESIGN ,31.94,0,0,0,0.85,0,0,0,0,0,0,0,0,0,0,0,0,0,0,0,0,0,0,0SET OF 6 T-LIGHTS SNOWMEN,138.34,0,0,0,0,0,0,0,0,0,0,2.95,0,0,0,0,0,0,0,0,0,0,0,0SET OF 6 T-LIGHTS SANTA,79.69,0,0,0,2.95,0,0,0,2.95,0,0,2.95,0,0,0,0,0,0,0,0,0,0,0,0SET OF 9 HEART SHAPED BALLOONS,28.78,3.75,0,0,0,0,0,0,0,0,0,0,0,0,0,0,0,0,0,0,0,0,0,0SANDWICH BATH SPONGE,97.76,1.25,0,0,0,0,1.25,0,0,0,0,0,0,0,0,0,0,0,1.25,0,0,0,0,0APPLE BATH SPONGE,81.44,0,0,0,0,0,0,0,0,0,0,0,0,0,0,0,0,0,1.25,0,0,0,0,0STRAWBERRY BATH SPONGE ,80.22,1.25,0,0,0,0,1.25,0,0,0,0,0,0,0,0,0,0,0,1.25,0,0,0,0,0BLACK PIRATE TREASURE CHEST,43.55,0,0,0,0,0,0,0,0,0,0,0,0,0,0,0,0,0,0,0,0,0,0,0STAR PORTABLE TABLE LIGHT ,85.21,0,0,0,0,0,0,0,0,0,0,0,0,0,0,0,0,0,0,0,0,0,0,0SNOWFLAKE PORTABLE TABLE LIGHT ,44.27,0,0,0,0,0,0,0,0,0,0,0,0,0,0,0,0,0,0,0,0,0,0,0PINK OVAL JEWELLED MIRROR,17.85,0,0,0,0,0,0,0,0,0,0,0,0,0,0,0,0,0,0,0,0,0,0,0RETROSPOT CIGAR BOX MATCHES ,25,0,0,0,0,0,0,0,0,0,0,0,0,0,0,0,0,0,0,0,0,0,0,0COSY HOUR GIANT TUBE MATCHES,42.9,0,0,0,0,0,0,0,0,0,0,0,0,0,0,0,2.55,0,0,0,0,0,0,0JAZZ HEARTS PURSE NOTEBOOK,10.93,0,0,0,0,0,0,0,0,0,0,0,0,0,0,0,0,0,0,0,0,0,0,0CANDLEHOLDER PINK HANGING HEART,156.02,0,0,0,0,0,2.95,0,0,0,0,0,0,0,0,0,0,0,2.95,0,0,0,0,0ASSORTED COLOUR MINI CASES,242.73,31.8,0,0,0,0,7.95,0,0,0,0,0,0,0,0,0,0,0,0,0,0,0,0,0LUNCH BAG SPACEBOY DESIGN ,119.45,3.3,0,1.45,0,0,0,0,0,0,0,0,0,0,0,0,0,0,0,0,0,0,0,0LUNCH BAG WOODLAND,134.25,6.6,0,1.45,0,0,0,0,0,0,3.3,0,0,0,0,0,0,0,0,0,0,0,0,0LUNCH BAG PINK POLKADOT,107.46,0,0,0,0,0,0,0,1.45,0,0,0,0,0,0,0,0,0,0,0,0,0,0,0GUMBALL COAT RACK,134.64,7.2,0,0,7.2,0,0,0,0,0,0,0,0,0,0,0,0,0,0,2.1,0,0,0,0BLUE NEW BAROQUE CANDLESTICK CANDLE,34.17,0,0,0,0,0,0,0,0,0,0,0,0,0,0,0,0,0,0,0,0,0,0,0PINK NEW BAROQUECANDLESTICK CANDLE,48.95,0,0,0,0,0,0,0,0,0,0,0,0,0,0,0,0,0,0,0,0,0,0,0FAIRY CAKE FLANNEL ASSORTED COLOUR,136.86,0,0,0,0,0,0,0,0,0,2.55,2.55,0,0,0,0,0,0,2.55,0,0,0,0,0BREAD BIN DINER STYLE PINK,180.45,0,0,0,29.9,0,16.95,0,0,0,0,0,0,0,0,0,0,0,0,0,0,0,0,0TEA TIME TABLE CLOTH,85.06,0,0,0,10.65,0,10.65,0,0,0,0,0,0,0,0,0,0,0,0,0,0,0,0,0HOT WATER BOTTLE BABUSHKA ,730.78,9.3,0,0,18.2,0,9.3,0,4.65,0,0,0,0,0,0,0,0,0,0,0,0,0,0,0HEART IVORY TRELLIS SMALL,78.93,0,0,0,0,0,0,0,0,0,0,0,0,0,0,0,0,0,1.25,0,0,0,0,0PINK DRAWER KNOB ACRYLIC EDWARDIAN,28.4,0,0,0,1.25,0,0,0,0,0,0,0,0,0,0,1.25,0,0,0,0,0,0,0,0GREEN DRAWER KNOB ACRYLIC EDWARDIAN,24.64,0,0,0,1.25,0,0,0,0,0,0,0,0,0,0,1.25,0,0,0,0,0,0,0,0BLUE DRAWER KNOB ACRYLIC EDWARDIAN,23.79,0,0,0,1.25,0,0,0,0,0,0,0,0,0,0,1.25,0,0,0,0,0,0,0,0SET 6 FOOTBALL CELEBRATION CANDLES,8.76,0,0,0,0,0,0,0,0,0,0,0,0,0,0,0,0,0,0,0,0,0,0,0SET OF 6 GIRLS CELEBRATION CANDLES,7.52,0,0,0,0,0,0,0,0,0,0,0,0,0,0,0,0,0,0,0,0,0,0,0ROMANTIC PINKS RIBBONS ,23.77,0,0,0,0,0,1.25,0,0,0,0,0,0,0,0,0,0,0,0,0,0,0,0,0BRIGHT BLUES RIBBONS ,12.51,0,0,0,1.25,0,0,0,0,0,0,0,0,0,0,0,0,0,0,0,0,0,0,0CHOCOLATE BOX RIBBONS ,31.31,0,0,0,1.25,0,0,0,0,0,0,0,0,0,0,0,0,0,0,0,0,0,0,0PARTY INVITES FOOTBALL,4.25,0,0,0,0,0,0,0,0,0,0,0,0,0,0,0,0,0,0,0,0,0,0,0PARTY INVITES JAZZ HEARTS,5.1,0,0,0,0,0,0,0,0,0,0,0,0,0,0,0,0,0,0,0,0,0,0,0PARTY INVITES SPACEMAN,4.25,0,0,0,0,0,0,0,0,0,0,0,0,0,0,0,0,0,0,0,0,0,0,0SET OF 3 BUTTERFLY COOKIE CUTTERS,97.65,0,0,0,0,0,1.25,0,0,0,1.25,0,0,0,0,0,0,0,0,0,0,0,0,0SET OF 3 HEART COOKIE CUTTERS,92.68,1.25,0,0,0,0,0,0,0,0,1.25,0,0,0,0,0,0,0,0,0,0,0,0,03 PIECE SPACEBOY COOKIE CUTTER SET,88.28,0,0,0,6.3,0,0,0,0,0,0,0,0,0,0,0,0,0,0,0,0,0,0,0PACK OF 72 SKULL CAKE CASES,35.34,0.55,0,0.42,0.55,1.1,0,0,0,0,0,0,0,0,0,0,0,0,0,0,0,0,0.97,0PACK OF 60 SPACEBOY CAKE CASES,29.58,0,0,0.42,0,0,0,0,0,0,0,0,0,0,0,0,0,0,0,0.55,0,0,0,072 SWEETHEART FAIRY CAKE CASES,40.68,0.55,0,0,0,1.1,0.55,0,0,0,0,0,0,0,0,0,0,0,0,0.55,0,0,0.55,0LUNCH BAG SUKI  DESIGN ,168.45,3.3,0,1.45,0,0,0,0,1.65,0,3.3,0,0,0,0,0,0,0,0,0,0,0,0,0LUNCH BAG CARS BLUE,125.69,1.65,0,0,0,0,0,0,1.45,0,4.95,0,0,0,0,0,0,0,0,0,0,0,0,0LUNCH BAG  BLACK SKULL.,162.87,0,0,0,0,0,0,0,1.65,0,0,0,0,0,0,0,0,0,0,0,0,0,0,0HEART IVORY TRELLIS LARGE,56.46,0,0,0,0,0,0,0,0,0,0,0,0,0,0,0,0,0,1.65,0,0,0,0,0SET/5 RED RETROSPOT LID GLASS BOWLS,260.71,0,0,0,5.9,0,5.9,0,0,0,0,0,0,0,0,0,0,0,0,0,0,0,0,0MAGIC DRAWING SLATE DINOSAUR,9.71,0,0,0,0,0,0,0,0,0,0,0,0,0,0,0,0,0,0,0,0,0,0,0MAGIC DRAWING SLATE BAKE A CAKE ,10.01,0,0,0,0.42,0,0,0,0,0,0,0,0,0,0,0,0,0,0,0,0,0,0,012 PENCILS TALL TUBE SKULLS,18.7,0,0,0,0,0,0.85,0,0,0,0,0,0,0,0,0,0,0,0,0,0,0,0,0RED  HARMONICA IN BOX ,103.59,3.75,1.06,0,1.25,0,1.25,0,0,0,2.5,0,1.06,2.5,0,0,0,0,0,0,0,0,0,0BLUE HARMONICA IN BOX ,87.68,2.5,1.06,0,1.25,0,1.25,0,0,0,1.25,0,1.06,1.25,0,0,0,0,0,0,0,0,0,0