Product,United Kingdom,France,Australia,Netherlands,Germany,Norway,EIRE,Switzerland,Spain,Poland,Portugal,Italy,Belgium,Lithuania,Japan,Iceland,Channel Islands,Denmark,Cyprus,Sweden,Austria,Israel,Finland,BahrainSET OF 16 VINTAGE PISTACHIO CUTLERY,250.58,0,0,0,12.75,0,0,0,0,0,0,0,0,0,0,0,0,0,0,0,0,0,0,0CHRISTMAS TOILET ROLL,132.24,0,0,0,0,0,0,0,0,0,0,0,0,0,0,0,0,0,0,0,0,0,0,0WHITE BELL HONEYCOMB PAPER ,95.31,0,0,0,0,0,0,0,0,0,0,0,0,0,0,0,0,0,0,0,0,0,0,0 4 PURPLE FLOCK DINNER CANDLES,12.71,0,0,0,0,0,0,0,0,0,0,0,0,0,0,0,0,0,0,0,0,0,0,0PINK & WHITE BREAKFAST TRAY,30.48,0,0,0,0,0,0,0,0,0,0,0,0,0,0,0,0,0,0,0,0,0,0,0ENGLISH ROSE SPIRIT LEVEL ,16.22,0,0,0,0,0,0,0,0,0,0,0,0,0,0,0,0,0,0,0,0,0,0,0LARGE ROUND WICKER PLATTER ,36.52,0,0,0,0,0,0,0,0,0,0,0,0,0,0,0,0,0,0,0,0,0,0,0BLACK TEA TOWEL CLASSIC DESIGN,14.24,0,0,0,0,0,0,0,0,0,0,0,0,0,0,0,0,0,0,0,0,0,0,0CHRISTMAS LIGHTS 10 VINTAGE BAUBLES,368.44,0,0,0,4.95,0,0,0,0,0,0,0,0,0,0,0,0,0,0,0,0,0,0,0ROSES REGENCY TEACUP AND SAUCER ,284.04,0,0,0,0,0,2.95,0,0,0,0,0,0,0,0,0,0,0,0,0,0,0,0,0T-LIGHT HOLDER HANGING LACE,8.77,0,0,0,0,0,0,0,0,0,0,0,0,0,0,0,0,0,0,0,0,0,0,0HANGING HEART MIRROR DECORATION ,22.51,0,0,0,0,0,0,0,0,0,0,0,0,0,0,0,0,0,0,0,0,0,0,0CREAM SLICE FLANNEL CHOCOLATE SPOT ,38.37,0,0,0,0,0,0,0,0,0,0,0,0,0,0,0,0,0,2.95,0,0,0,0,0CREAM SLICE FLANNEL PINK SPOT ,93.7,0,0,0,0,0,0,0,0,0,2.95,0,0,0,0,0,0,0,2.55,0,0,0,0,0GREEN REGENCY TEACUP AND SAUCER,284.48,0,0,0,0,0,2.95,0,0,0,0,5.9,0,0,0,0,0,0,0,0,0,0,0,0EIGHT PIECE DINOSAUR SET,38.87,0,0,0,0,0,0,0,0,0,0,0,0,0,0,0,0,0,0,0,0,0,0,0HEADS AND TAILS SPORTING FUN,38.79,0,0,0,0,0,0,0,0,0,0,0,0,0,0,0,0,0,0,0,0,0,0,0ASS COL SMALL SAND GECKO P'WEIGHT,2.1,0,0,0,0,0,0,0,0,0,0,0,0,0,0,0,0,0,0,0,0,0,0,0ENAMEL MEASURING JUG CREAM,123.13,0,0,0,0,0,0,0,0,0,0,0,0,0,0,0,0,0,0,0,0,0,0,012 PENCILS SMALL TUBE SKULL,41.3,0,0,0,0,0,0,0,0,0,0,0,0,0,0,0,0,0,0.65,0,0,0,0,012 PENCIL SMALL TUBE WOODLAND,36.08,0.65,0,0,1.95,0,0,0,0,0,0,0,0,0,0,0,0,0,0,0,0,0,0,0BLUE PAPER PARASOL ,11.81,0,0,0,0,0,0,0,0,0,0,0,0,0,0,0,0,0,0,0,0,0,0,0VICTORIAN  METAL POSTCARD SPRING,21.97,0,0,0,0,0,0,0,0,0,0,0,0,0,0,0,0,0,0,0,0,0,0,0METAL 4 HOOK HANGER FRENCH CHATEAU,168.29,0,0,0,2.95,0,0,0,0,0,0,0,0,0,0,0,0,0,0,0,0,0,0,0BLACK KITCHEN SCALES,203.94,0,0,0,8.5,8.5,0,0,0,0,0,0,0,0,0,0,0,0,0,0,0,0,0,0RED KITCHEN SCALES,839.2,0,0,0,40.8,8.5,8.5,0,0,0,0,0,0,0,0,0,0,0,0,0,0,0,0,0IVORY KITCHEN SCALES,669.5,0,0,0,34,8.5,8.5,0,0,0,0,0,0,0,0,0,0,0,0,0,0,0,0,0MULTI COLOUR SILVER T-LIGHT HOLDER,50.72,0,0,0,1.7,0,1.7,0,0,0,0,0,0,0,0,0,0,0,0,0,0,0,0,03 HOOK HANGER MAGIC GARDEN,41.79,0,0,0,5.85,0,0,0,0,0,0,0,0,0,1.95,0,0,0,0,0,0,0,0,0ASSORTED COLOUR LIZARD SUCTION HOOK,1.26,0,0,0,0.42,0,0,0,0,0,0,0,0,0,0,0,0,0,0,0,0,0,0,0JUMBO BAG WOODLAND ANIMALS,106.95,0,0,0,7.8,0,0,0,1.95,0,0,0,0,0,0,0,0,0,0,0,0,0,0,0CHILDREN'S CIRCUS PARADE MUG,50.04,3.3,0,0,4.95,0,0,0,0,0,0,0,0,0,0,0,0,0,0,0,0,0,0,0PACK 3 FIRE ENGINE/CAR PATCHES,6.26,0,0,0,1.25,0,0,0,0,0,0,0,0,0,0,0,0,0,0,0,0,0,0,0CARD PSYCHEDELIC APPLES,7.18,0,0,0,0,0,0,0,0,0,0,0,0,0,0,0,0,0,0,0,0,0,0,0IVORY ENCHANTED FOREST PLACEMAT,31.71,0,0,0,0,0,0,0,0,0,0,0,0,1.65,0,0,0,0,0,0,0,0,0,0PACK OF 6 PANNETONE GIFT BOXES,81.2,0,0,0,0,0,0,0,0,0,0,0,0,0,0,0,0,0,0,0,0,0,0,0MEASURING TAPE BABUSHKA RED,57.82,2.95,0,0,0,0,0,0,0,0,0,0,0,0,0,0,0,0,0,0,0,0,0,0RED ENCHANTED FOREST PLACEMAT,41.61,0,0,0,0,0,0,0,0,0,0,0,0,0,0,0,0,0,0,0,0,0,0,0CHILDRENS DOLLY GIRL MUG,64.89,3.3,0,1.45,0,0,0,0,0,0,0,0,0,0,0,0,0,0,0,0,0,0,0,0TOADSTOOL MONEY BOX,75.54,5.9,0,0,2.95,0,0,0,0,0,0,0,0,0,0,0,0,0,0,0,0,0,0,0MAKE YOUR OWN FLOWERPOWER CARD KIT,82.7,0,0,0,2.95,0,0,0,0,0,0,0,0,0,0,0,0,0,0,0,0,0,0,0PAPER CHAIN KIT LONDON,47.22,0,0,0,0,0,0,0,0,0,0,0,0,0,0,0,0,0,0,0,0,0,0,0MEASURING TAPE BABUSHKA BLUE,40.85,0,0,0,0,0,0,0,0,0,0,0,0,0,0,0,0,0,0,0,0,0,0,0PENCIL CASE LIFE IS BEAUTIFUL,53.14,0,0,2.95,11.4,0,2.95,0,0,0,0,0,0,0,0,0,0,0,0,0,0,0,0,0WOODEN ROUNDERS GARDEN SET ,208.69,0,0,0,0,0,0,0,0,0,0,0,0,0,0,0,0,0,0,0,0,0,0,0CHILDS BREAKFAST SET DOLLY GIRL ,257.73,9.95,0,0,0,0,0,0,0,0,0,0,0,0,0,0,0,0,0,0,0,0,0,0CHILDS BREAKFAST SET SPACEBOY ,274.78,9.95,0,0,18.45,0,0,0,0,0,0,0,0,0,0,0,0,0,0,0,0,0,0,0CAKE PLATE LOVEBIRD WHITE,121.04,1.95,0,0,4.95,0,0,0,0,0,0,0,0,0,0,0,0,0,0,0,0,0,0,0WOODEN ADVENT CALENDAR RED,373.9,0,0,0,0,0,16.95,0,0,0,0,0,0,0,0,0,0,0,0,0,0,0,0,0GREEN CHRISTMAS TREE CARD HOLDER,161.14,0,0,0,0,0,0,0,0,0,0,0,0,0,0,0,0,0,0,0,0,0,0,0STRING OF STARS CARD HOLDER,23.62,0,0,0,0,0,0,0,0,0,0,0,0,0,0,0,0,0,0,0,0,0,0,0SET/12 TAPER CANDLES,28.34,0,0,0,0,0,0,0,0,0,0,0,0,0,0,0,0,0,0,0,0,0,0,0MINT KITCHEN SCALES,365.24,0,0,0,17,0,8.5,0,0,0,0,0,0,0,0,0,0,0,0,0,0,0,0,0WHITE WOOD GARDEN PLANT LADDER,219.36,0,0,0,0,0,0,0,0,0,0,0,0,0,0,0,0,0,0,0,0,0,0,0GLASS JAR ENGLISH CONFECTIONERY,76.39,0,0,0,0,0,0,0,0,0,0,0,0,0,0,0,0,0,0,0,0,0,0,0GLASS JAR DIGESTIVE BISCUITS,62.03,0,0,0,0,0,0,0,0,0,0,0,0,0,0,0,0,0,0,0,0,0,0,0MILK BOTTLE WITH GLASS STOPPER ,76.98,0,0,0,0,0,0,0,0,0,0,0,0,0,0,0,0,0,0,0,0,0,0,0WELCOME  WOODEN BLOCK LETTERS,110.41,0,0,0,0,0,0,0,9.95,0,0,0,0,0,0,0,0,0,0,0,0,0,0,0SET/4 MODERN VINTAGE COTTON NAPKINS,8.85,0,0,0,0,0,0,0,0,0,0,0,0,0,0,0,0,0,0,0,0,0,0,0VINTAGE UNION JACK APRON,191.36,0,0,0,6.95,0,0,0,0,0,0,0,0,0,0,0,0,0,0,0,0,0,0,0SWALLOW SQUARE TISSUE BOX,12.52,0,0,0,0,0,0,0,0,0,0,0,0,0,0,0,0,0,0,0,0,0,0,0NO JUNK MAIL METAL SIGN,28.91,0,0,0,0,0,1.25,0,0,0,0,0,0,0,0,0,0,0,0,0,0,0,0,0SLATE TILE NATURAL HANGING,19.98,0,0,0,0,0,0,0,0,0,0,0,0,0,0,0,0,0,0,0,0,0,0,0VINTAGE GLASS COFFEE CADDY,70.75,0,0,0,0,0,0,0,0,0,0,0,0,0,0,0,0,0,0,0,0,0,0,0SILVER GLASS T-LIGHT SET,14.75,0,0,0,0,0,0,0,0,0,0,0,0,0,0,0,0,0,0,0,0,0,0,0RIDGED GLASS FINGER BOWL,4.35,0,0,0,0,0,0,0,0,0,0,0,0,0,0,0,0,0,0,0,0,0,0,0GLASS  BEURRE DISH,218.49,0,0,0,3.95,0,0,0,0,0,0,0,0,0,0,0,0,0,0,0,0,0,0,0GIN & TONIC DIET GREETING CARD ,8.87,0,0,0,0,0,0,0,0.42,0,0,0,0,0,0,0,0,0,0,0,0,0,0,0BIRTHDAY CARD- RETRO SPOT,5.95,0,0,0,0,0,0,0,0.42,0,0,0,0,0,0,0,0,0,0,0,0,0,0,0FANCY FONT BIRTHDAY CARD- ,10.05,0.84,0,0,0,0.84,0,0.42,0.42,0,0,0,0,0,0.42,0,0,0,0,0,0,0,0,0WRAP RED APPLES ,3.78,0.42,0,0,0,0,0.42,0,0,0,0,0,0,0,0,0,0,0,0,0,0,0,0,0RED RETROSPOT WRAP ,7.4,0,0,0,0,0,0,0,0,0,0,0,0,0,0,0,0,0,0,0,0,0,0,0WRAP CHRISTMAS SCREEN PRINT,3.78,0,0,0,0,0,0.42,0,0,0,0,0,0,0,0,0,0,0,0,0,0,0,0,0FANCY FONTS BIRTHDAY WRAP,1.68,0,0,0,0,0,0,0,0,0,0,0,0,0,0,0,0,0,0,0,0,0,0,0CLASSIC WHITE FRAME,23.61,0,0,0,0,0,0,0,0,0,0,0,0,0,0,0,0,0,0,0,0,0,0,0BLACK DINER WALL CLOCK,67.96,0,0,0,0,0,0,0,0,0,0,0,0,0,0,0,0,0,0,0,0,0,0,0DOORMAT PEACE ON EARTH BLUE,55.53,0,0,0,0,6.75,0,0,0,0,0,0,0,0,0,0,7.95,0,0,0,0,0,0,0BOX OF 24 COCKTAIL PARASOLS,35.8,0.42,0,0,0,0.84,0,0,0.42,0,0,0,0,0,0,0,0,0,0,0,0,0,0,0GROW YOUR OWN PLANT IN A CAN ,50.12,0,0,0,0,1.06,0,0,0,0,1.25,0,0,0,0,0,0,0,0,0,0,0,0,0PLASTERS IN TIN STRONGMAN,94.81,1.65,1.65,1.45,4.95,3.3,0,1.65,0,0,0,0,1.65,0,0,0,0,0,0,0,0,0,0,0MINI JIGSAW DINOSAUR ,8.49,0,0,0,0,0.84,0,0,0,0,0,0,0,0,0,0,0,0,0,0,0,0,0,0MINI JIGSAW BAKE A CAKE ,3.82,0,0,0,0,0.84,0,0,0,0,0,0,0,0,0,0,0,0,0,0,0,0,0,0MINI JIGSAW DOLLY GIRL,12.31,0.42,0,0,0,0.84,0,0.42,0,0,0,0,0,0,0,0,0,0,0,0,0,0,0,0WOODEN SCHOOL COLOURING SET,49.42,0,0,0,0,3.3,0,0,0,0,1.65,0,0,0,0,0,0,0,0,0,0,0,0,0PACK OF 12 TRADITIONAL CRAYONS,16.48,0,0,0,0.42,0.84,0.42,0,0,0,0,0,0,0,0,0,0,0,0,0.42,0,0,0,0CARD PARTY GAMES ,7.21,0,0,0,0,0.84,0,0,0,0,0,0,0,0,0,0,0,0,0,0,0,0,0,0BOOZE & WOMEN GREETING CARD ,4.25,0,0,0,0,0.84,0,0,0,0,0,0,0,0,0,0,0,0,0,0,0,0,0,0PACK OF 12 SUKI TISSUES ,23.05,0.58,0,0,0.29,0.58,0,0,0,0,0,0,0,0,0,0,0,0,0,0,0,0,0.29,0PACK OF 12 WOODLAND TISSUES ,12.5,0.58,0,0.29,0.29,0.58,0,0,0,0,0,0,0,0,0,0,0,0,0,0,0,0,0.29,0PACK OF 12 SKULL TISSUES,16.21,0,0,0,0.29,0.58,0,0,0,0,0,0,0,0,0,0,0,0,0,0,0,0,0,0PACK OF 12 CIRCUS PARADE TISSUES ,3.98,0.29,0,0,0,0.58,0,0,0,0,0,0,0,0,0,0,0,0,0,0,0,0,0,0PACK OF 12 SPACEBOY TISSUES,9.91,0.29,0,0,0,0.58,0,0,0,0,0,0,0,0,0,0,0,0,0,0,0,0,0,0LADS ONLY TISSUE BOX,60.15,0,0,0,0,2.5,0,0,0,0,0,0,0,0,0,0,0,0,0,0,0,0,0,0RED RETROSPOT TISSUE BOX,18.8,1.25,0,0,0,2.5,0,0,0,0,0,0,0,0,0,0,0,0,0,0,0,0,0,0GINGERBREAD MAN COOKIE CUTTER,98.34,3.75,0,0,1.25,2.5,2.5,0,0,0,1.25,0,0,0,0,0,0,0,0,0,0,0,0,0GIN AND TONIC MUG,116.97,0,0,0,0,2.5,0,0,0,0,0,0,0,0,0,0,0,0,0,0,0,0,0,0IF YOU CAN'T STAND THE HEAT MUG,20.48,0,0,0,0,2.5,0,0,0,0,0,0,0,0,0,0,0,0,0,0,0,0,0,0I CAN ONLY PLEASE ONE PERSON MUG,91.66,0,0,0,0,2.5,0,0,0,0,0,0,0,0,0,0,0,0,0,0,0,0,0,0PINK HEART SHAPE EGG FRYING PAN,107.97,1.65,0,0,1.65,2.5,0,1.65,0,0,0,0,0,0,0,0,0,0,0,0,0,0,0,0200 RED + WHITE BENDY STRAWS,28.78,0,0,1.25,0,2.5,0,0,0,0,0,0,0,0,0,0,0,0,0,0,0,0,0,0RECIPE BOX RETROSPOT ,158.5,2.95,0,0,0,5.9,0,0,0,0,5.9,0,0,0,0,0,0,0,0,0,0,0,0,0RECIPE BOX PANTRY YELLOW DESIGN,346,0,0,0,0,5.9,5.9,0,0,0,2.95,0,0,0,0,0,0,0,0,0,0,0,0,0RECIPE BOX BLUE SKETCHBOOK DESIGN,182.69,0,0,0,0,5.9,2.95,0,0,0,2.95,0,0,0,0,0,0,0,0,0,0,0,0,020 DOLLY PEGS RETROSPOT,44.73,0,1.25,0,1.25,2.5,0,0,0,0,0,0,1.25,0,1.06,0,0,1.25,0,0,0,0,0,0NO SINGING METAL SIGN,183.81,2.1,0,0,0,4.2,0,0,0,0,0,0,0,0,0,0,0,0,0,0,0,0,0,0BISCUIT TIN VINTAGE RED,87.89,0,0,0,6.75,13.5,6.75,0,0,0,0,0,0,0,0,0,0,0,0,0,0,0,0,0EMERGENCY FIRST AID TIN ,32.57,0,0,0,0,2.5,0,0,1.25,0,0,0,0,0,0,1.25,0,0,0,0,0,0,0,0POLKADOT PEN,34.98,0,0,0,0,0,0,0,0,0,0,0,0,0,0,0,0,0,0,0,0,0,0,0DECORATIVE PLANT POT WITH FRIEZE,39.98,0,0,0,0,0,0,0,0,0,0,0,0,0,0,0,0,0,0,0,0,0,0,0FRENCH BLUE METAL DOOR SIGN 5,10.01,0,0,0,0,0,0,0,0,0,0,0,0,0,0,0,0,0,0,0,0,0,0,0CHEST OF DRAWERS GINGHAM HEART ,254.45,0,0,0,16.95,0,0,0,0,0,0,0,0,0,0,0,0,0,0,0,0,0,0,0RED RETROSPOT CAKE STAND,655,21.9,0,0,0,0,10.95,0,0,0,0,0,0,0,0,0,0,0,0,0,0,0,0,0JOY WOODEN BLOCK LETTERS,111.83,0,0,0,0,0,0,0,0,0,0,0,0,0,0,0,0,0,0,0,0,0,0,0NOEL WOODEN BLOCK LETTERS ,231.78,0,0,0,0,0,5.45,0,0,0,0,0,0,0,0,0,0,0,0,0,0,0,0,0PEACE WOODEN BLOCK LETTERS,90.35,0,0,0,0,0,13.9,0,0,0,0,0,0,0,0,0,0,0,0,0,0,0,0,0OFFICE MUG WARMER BLACK+SILVER ,179,0,0,0,0,0,0,0,0,0,0,0,0,0,0,0,0,0,0,0,0,0,0,0SET OF 2 CHRISTMAS DECOUPAGE CANDLE,32.04,0,0,0,0,0,1.25,0,0,0,0,0,0,0,0,0,0,0,0,0,0,0,0,0COSMETIC BAG VINTAGE ROSE PAISLEY,27.35,0,0,0,0,0,0,0,0,0,2.1,0,0,0,0,0,0,0,0,0,0,0,0,0PINK ROSE FABRIC MIRROR,33.5,0,0,0,0,0,0,0,0,0,0,0,0,0,0,0,0,0,0,0,0,0,0,0SILVER PLATE CANDLE BOWL SMALL,35.43,0,0,0,0,0,0,0,0,0,0,0,0,0,0,0,0,0,0,0,0,0,0,0SMALL REGAL  SILVER CANDLEPOT ,17.71,0,0,0,0,0,0,0,0,0,0,0,0,0,0,0,0,0,0,0,0,0,0,0ANTIQUE TALL SWIRLGLASS TRINKET POT,131.97,0,0,0,0,0,3.75,0,0,0,0,0,0,0,0,0,0,0,0,0,0,0,0,0ANTIQUE GLASS PEDESTAL BOWL,139.95,3.75,0,0,0,0,3.75,0,0,0,0,0,0,0,0,0,0,0,0,0,0,0,0,0GUMBALL MAGAZINE RACK,198.8,0,0,0,7.65,0,0,0,0,0,0,0,0,0,0,0,0,0,0,0,0,0,0,0RED FLOWER CROCHET FOOD COVER,37.62,0,0,0,0,0,0,0,0,0,0,0,0,0,0,0,0,0,0,0,0,0,0,0CHERRY CROCHET FOOD COVER,33.99,0,0,0,0,0,0,0,0,0,0,0,0,0,0,0,0,0,0,0,0,0,0,0STRAWBERRY RAFFIA FOOD COVER,41.49,0,0,0,0,0,0,0,0,0,0,0,0,0,0,0,0,0,0,0,0,0,0,0POLKA DOT RAFFIA FOOD COVER,11.25,0,0,0,0,0,3.75,0,0,0,0,0,0,0,0,0,0,0,0,0,0,0,0,0DOORMAT SPOTTY HOME SWEET HOME,507.15,0,0,0,0,0,7.95,0,0,0,0,0,0,0,0,0,0,0,0,0,0,0,0,0T-LIGHT GLASS FLUTED ANTIQUE,80.85,0,0,0,0,0,0,0,0,0,0,1.25,0,0,0,0,0,0,0,0,0,0,0,0SILVER  CANDLEPOT JARDIN ,22.5,0,0,0,0,0,0,0,0,0,0,0,0,0,0,0,0,0,0,0,0,0,0,0POLKADOT MUG PINK ,23.4,0,0,0,0,0,0,0,0,0,0,0,0,0,0,0,0,0,0,0,0,0,0,0PAPER BUNTING COLOURED LACE,33.73,0,0,0,0,0,0,0,0,0,0,0,0,0,2.55,0,0,0,2.95,0,0,0,0,0ANTIQUE GLASS HEART DECORATION ,59.74,0,0,0,0,0,0,0,0,0,0,0,0,0,0,0,0,0,0,0,0,0,0,0SET OF 6 KASHMIR FOLKART BAUBLES,42.5,0,0,0,0,0,0,0,0,0,0,0,0,0,0,0,0,0,0,0,0,0,0,0CHRISTMAS RETROSPOT ANGEL WOOD,40.2,0.85,0,0,0.85,0,0,0,0,0,0,0,0,0,0,0,0,0,0,0,0,0,0,0CHRISTMAS RETROSPOT STAR WOOD,36.63,0,0,0,0.85,0,0,0,0,0,0,0,0,0,0,0,0,0,0,0,0,0,0,0HEART WOODEN CHRISTMAS DECORATION,44.33,0,0,0,0.85,0,0.85,0,0,0,0,0,0,0,0,0,0,0,0,0,0,0,0,0LARGE HANGING IVORY & RED WOOD BIRD,7.11,0,0,0,0,0,0,0,0,0,0,0,0,0,0,0,0,0,0,0,0,0,0,0SMALL HANGING IVORY/RED WOOD BIRD,16.93,0,0,0,0,0,0,0,0,0,0,0,0,0,0,0,0,0,0,0,0,0,0,0GRAND CHOCOLATECANDLE,71.5,0,0,0,0,0,0,0,0,0,1.45,1.45,0,0,0,0,0,0,1.45,0,0,0,0,0FAIRY CAKE BIRTHDAY CANDLE SET,22.5,3.75,0,0,0,0,0,0,0,0,0,0,0,0,0,0,0,0,0,0,0,0,0,03 HOOK PHOTO SHELF ANTIQUE WHITE,304.12,0,0,0,17,0,8.5,0,0,0,0,0,0,0,0,0,0,0,0,0,0,0,0,0CREAM SWEETHEART WALL CABINET,73.8,0,0,0,0,0,0,0,0,0,0,0,0,0,0,0,0,0,0,0,0,0,0,0DOORMAT ENGLISH ROSE ,345,0,0,0,0,0,6.75,0,0,0,0,0,0,0,0,0,0,0,0,0,0,0,0,0DOORMAT UNION FLAG,526.5,14.7,13.5,0,0,0,0,0,0,0,0,0,13.5,0,0,0,7.95,0,0,0,0,0,0,0ROMANTIC IMAGES NOTEBOOK SET,13.97,0,0,0,0,0,0,0,0,0,0,0,0,0,0,0,0,0,0,0,0,0,0,0CURIOUS  IMAGES NOTEBOOK SET,12.72,0,0,0,0,0,0,0,0,0,0,0,0,0,0,0,0,0,0,0,0,0,0,0VINTAGE KEEPSAKE BOX PARIS DAYS,146.27,0,0,0,0,0,0,0,0,0,0,0,0,0,0,0,0,0,0,0,0,0,0,0RED GINGHAM ROSE JEWELLERY BOX,128.43,0,0,0,1.65,0,0,0,0,0,0,0,0,3.3,0,0,0,0,0,0,0,0,0,0BLUE CHARLIE+LOLA PERSONAL DOORSIGN,9.3,0,0,0,0,0,2.95,0,0,0,0,0,0,0,0,0,0,0,0,0,0,0,0,0"CHARLIE+LOLA""EXTREMELY BUSY"" SIGN",9.31,0,0,0,0,0,2.55,0,0,0,0,0,0,0,0,0,0,0,0,0,0,0,0,0CHARLOTTE BAG SUKI DESIGN,86.68,0,0,1.57,0.85,0,0.85,0,0,0,0,0,0,0,0,0,0,0,0,0,0,0,0,0LOLITA  DESIGN  COTTON TOTE BAG,16.31,0,0,0,0,0,2.25,0,0,0,0,0,0,0,0,0,0,0,0,0,0,0,0,0LETS GO SHOPPING COTTON TOTE BAG,21.93,2.25,0,0,0,0,2.25,0,0,0,0,0,0,0,0,0,0,0,0,0,0,0,0,0PAINT YOUR OWN CANVAS SET,39.7,0,0,0,0,0,3.3,0,0,0,0,0,0,0,0,0,0,0,0,0,0,0,0,0CAMOUFLAGE LED TORCH,67.12,0,0,0,0,0,1.69,0,0,0,0,0,0,0,0,0,0,0,0,0,0,0,0,0BLUE DRAGONFLY HELICOPTER,187.53,0,0,0,0,0,7.95,0,0,0,0,0,0,0,0,0,0,0,0,0,0,0,0,0YELLOW SHARK HELICOPTER,155.73,0,0,0,0,0,7.95,0,0,0,0,0,0,0,0,0,0,0,0,0,0,0,0,0RED SHARK HELICOPTER,99.04,0,0,0,0,0,7.95,0,0,0,0,0,0,0,0,0,0,0,0,0,0,0,0,0TOOL BOX SOFT TOY ,174.4,8.95,0,0,0,0,8.95,0,0,0,0,0,0,0,0,0,0,0,0,0,0,0,0,0DOCTOR'S BAG SOFT TOY,89.5,0,0,0,0,0,8.95,0,0,0,0,0,0,0,0,0,0,0,0,0,0,0,0,0CARRIAGE,50,150,0,0,0,0,350,0,0,0,0,0,0,0,0,0,50,0,0,0,0,0,0,0JUMBO BAG SCANDINAVIAN PAISLEY,121.52,0,0,0,0,0,0,0,1.95,0,1.95,0,0,0,0,0,0,0,0,0,0,0,0,0JUMBO BAG TOYS ,83.99,0,0,0,0,0,0,0,0,0,0,0,0,0,0,0,0,0,0,0,0,0,0,0DECORATIVE ROSE BATHROOM BOTTLE,37.35,0,0,0,0,0,0,0,0,0,0,0,0,0,0,0,0,0,0,0,0,0,0,0DECORATIVE CATS BATHROOM BOTTLE,47.81,1.25,0,0,0,0,0,0,0,0,0,0,0,0,0,0,0,0,0,0,0,0,0,0RAIN PONCHO RETROSPOT,24.05,0.85,0,0,0.85,0,0,0,0,0,0,0,0,0,0,0,0,0,0,0,0,0,0,0CHRISTMAS TREE DECORATION WITH BELL,15.4,0,0,0,0,0,0,0,0,0,0,0,0,0,0,0,0,0,0,0,0,0,0,0CHRISTMAS TREE HEART DECORATION,17.49,0,0,0,0,0,0,0,0,0,0,0,0,0,0,0,0,0,0,0,0,0,0,0CHRISTMAS TREE STAR DECORATION,18.36,0,0,0,0,0,0,0,0,0,0,0,0,0,0,0,0,0,0,0,0,0,0,0CHRISTMAS HANGING TREE WITH BELL,35.08,0,0,0,0,0,0,0,0,0,0,0,0,0,0,0,0,0,0,0,0,0,0,0GLITTER STAR GARLAND WITH BELLS ,114.06,0,0,0,0,0,0,0,0,0,0,0,0,0,0,0,0,0,0,0,0,0,0,0GLITTER CHRISTMAS TREE WITH BELLS,24.33,0,0,0,0,0,0,0,0,0,0,0,0,0,0,0,0,0,0,0,0,0,0,0LILAC DIAMANTE PEN IN GIFT BOX,65.37,0,0,0,0,0,0,0,0,0,0,0,0,0,0,0,0,0,0,0,0,0,0,0HEARTS GIFT TAPE,10.11,0,0,0,0,0,0,0,0.65,0,0,0,0,0,0,0,0,0,0,0,0,0,0,0CAKES AND BOWS GIFT  TAPE,11.53,0,0,0,0.38,0,0,0,0,0,0,0,0,0,0,0,0,0,0,0,0,0,0,0BINGO SET,242.16,0,0,0,0,0,11.25,0,0,0,7.5,0,0,0,0,0,0,0,0,0,0,0,0,0GARDEN METAL SIGN ,30,0,0,0,0,0,0,0,0,0,0,0,0,0,0,0,0,0,0,0,0,0,0,0UNION STRIPE WITH FRINGE  HAMMOCK,91.77,0,0,0,0,0,0,0,0,0,0,0,0,0,0,0,0,0,0,0,0,0,0,0SUKI  SHOULDER BAG,152.63,0,0,1.45,0,0,0,0,1.65,0,0,0,0,0,0,0,0,0,0,0,0,0,0,0SKULLS DESIGN FLANNEL,40.73,0,0,0,0,0,0,0,0,0,0,0,0,0,0,0,0,0,0,0,0,0,0,0KITTENS DESIGN FLANNEL,16.64,0,0,0,0,0,0,0,0,0,0,0,0,0,0,0,0,0,0,0,0,0,0,0SET OF 6 STRAWBERRY CHOPSTICKS,61.37,0,0,0,1.25,0,0,0,0,0,0,0,0,0,0,0,0,0,0,0,0,0,0,0MODERN FLORAL STATIONERY SET,59.49,0,0,0,0,0,0,0,0,0,0,0,0,0,0,0,0,0,0,0,0,0,0,0BOHEMIAN COLLAGE STATIONERY SET,48.57,0,0,0,0,0,0,0,0,0,0,0,0,0,0,0,0,0,0,0,0,0,0,0FLORAL FOLK STATIONERY SET,73.38,0,0,0,0,0,0,0,0,0,0,0,0,0,0,0,0,0,0,0,0,0,0,0ROBOT BIRTHDAY CARD,13.12,0.84,0,0,0,0,0,0.42,0,0,0,0,0,0,0,0,0,0,0,0,0,0,0,0CHRISTMAS CARD SCREEN PRINT ,2.57,0,0,0,0,0,0,0,0,0,0,0,0,0,0,0,0,0,0,0,0,0,0,0CHRISTMAS PUDDING TRINKET POT ,58.51,0,0,0,0,0,0,0,0,0,0,0,0,0,0,0,0,0,0,0,0,0,0,0CHOC TRUFFLE GOLD TRINKET POT ,25.11,0,0,0,0,0,0,0,0,0,0,0,0,0,0,0,0,0,0,0,0,0,0,0BROWN  PIRATE TREASURE CHEST ,54.59,0,0,0,0,0,0,0,0,0,0,0,0,0,0,0,0,0,0,0,0,0,0,0SMALL WHITE RETROSPOT MUG IN BOX ,44.85,0,0,0,0,0,0,0,0,0,0,0,0,0,0,0,0,0,3.75,0,0,0,0,06 RIBBONS EMPIRE  ,46.73,1.65,0,0,1.65,0,0,0,0,0,0,0,0,0,0,0,0,0,0,0,0,0,0,0RIBBON REEL POLKADOTS ,44.22,1.65,1.45,0,1.65,0,0,0,0,0,0,0,1.45,0,0,0,0,0,0,0,0,0,0,0RIBBON REEL FLORA + FAUNA ,61.2,0,0,0,0,0,0,0,0,0,0,0,0,0,0,0,0,0,0,0,0,0,0,0PAPER BUNTING RETROSPOT,94.59,2.95,0,0,0,0,0,0,0,0,0,0,0,0,0,0,0,0,0,0,0,0,0,0LADLE LOVE HEART RED ,7.22,0,0,0,0,0,0,0,0,0,0,0,0,0,0,0,0,0,0,0,0,0,0,0LADLE LOVE HEART PINK,9.76,0,0,0,0,0,0,0,0,0,0,0,0,0,0,0,0,0,0,0,0,0,0,0ANGEL DECORATION 3 BUTTONS ,17.67,0,0,0,0,0,0,0,0,0,0,0,0,0,0,0,0,0,0,0,0,0,0,0STAR DECORATION RUSTIC,15.24,0,0,0,0,0,0,0,0,0,0,0,0,0,0,0,0,0,0,0,0,0,0,0HEART DECORATION WITH PEARLS ,26.88,0,0,0,0,0,0,0,0,0,0,0,0,0,0,0,0,0,0,0,0,0,0,0HEART DECORATION RUSTIC HANGING ,19.77,0,0,0,0,0,0,0,0,0,0,0,0,0,0,0,0,0,0,0,0,0,0,0HEART GARLAND RUSTIC PADDED,92.04,0,0,0,0,0,0,0,0,0,0,0,0,0,0,0,0,0,0,0,0,0,0,0FAMILY ALBUM WHITE PICTURE FRAME,351.66,0,0,0,0,0,17,0,0,0,0,0,0,0,0,0,0,0,0,0,0,0,0,0CAKE STAND VICTORIAN FILIGREE SMALL,37.89,0,0,0,0,0,0,0,0,0,0,0,0,0,0,0,0,0,0,0,0,0,0,0LOCAL CAFE MUG,66.18,0,0,0,0.85,0,0,2.1,0,0,0,0,0,0,0,0,0,0,0,0,0,0,0,0MILK PAN RED RETROSPOT,91.08,0,0,0,3.75,0,0,0,0,0,0,0,0,0,0,0,0,0,0,0,0,0,0,0FRYING PAN UNION FLAG,261.75,0,0,0,0,0,0,0,0,0,0,0,0,0,0,0,0,0,0,0,0,0,0,0EASTER DECORATION NATURAL CHICK,5.81,0,0,0,0,0,0,0,0,0,0,0,0,0,0,0,0,0,0,0,0,0,0,0WASH BAG VINTAGE ROSE PAISLEY,71.04,0,0,0,0,0,0,0,0,0,0,0,0,0,0,0,0,0,0,0,0,0,0,0PIG KEYRING WITH LIGHT & SOUND ,30.09,0,0,0,0,0,1.25,0,0,0,0,0,0,0,0,0,0,0,0,0,0,0,0,0COFFEE MUG DOG + BALL DESIGN,81.32,2.55,0,0,2.55,0,0,2.55,0,0,0,0,0,2.55,0,0,0,0,0,0,0,0,0,0COFFEE MUG CAT + BIRD DESIGN,162.4,2.55,0,0,2.55,0,0,2.55,0,0,0,0,0,2.55,0,0,0,0,0,0,0,0,0,0TEA COSY RED  STRIPE,96.18,0,0,0,0,0,0,0,0,0,0,0,0,0,0,0,0,0,0,0,0,0,0,0OFFICE MUG WARMER CHOC+BLUE,181.55,5.9,0,0,0,0,0,4.95,0,0,0,0,0,0,0,0,0,0,0,0,0,0,0,0HEART DECORATION PAINTED ZINC ,14.16,0,0,0,0,0,0,0,0.65,0,0,0,0,0,0,0,0,0,0.65,0,0,0,0,0DOVE DECORATION PAINTED ZINC ,16.03,0,0,0,0,0,0.65,0,0,0,0,0,0,0,0,0,0,0,0,0,0,0,0,0PARTY PIZZA DISH BLUE POLKADOT,6.9,0,0,0.21,1.06,0,0,0,0,0,0,0,0,0,0,0,0,0,0,0,0,0,0,0TEA BAG PLATE RED RETROSPOT,49.39,1.7,0,0,0,0,0.85,0,0,0,0,0,0,0,0,0,0,0,0,0.85,0,0,0,0CHARLOTTE BAG PINK POLKADOT,63.42,0.85,0,0,0,0,0,0,0,0,0,0,0,0,0,0,0,0,0,0,0,0,0,0GLASS JAR KINGS CHOICE,29.53,0,0,0,0,0,0,0,0,0,0,0,0,0,0,0,0,0,0,0,0,0,0,0GLASS JAR DAISY FRESH COTTON WOOL,65,0,0,0,0,0,0,0,0,0,0,0,0,0,0,0,0,0,0,0,0,0,0,0AIRLINE BAG VINTAGE JET SET BROWN,135.33,4.25,0,0,0,0,0,0,0,0,0,0,0,0,0,4.25,0,0,0,0,0,0,0,0WALL TIDY RETROSPOT ,74.06,0,0.85,0.85,0.85,0,0,0,0,0,2.1,0,0.85,0,0,0,0,0,0,0.85,0,0,0,0TOY TIDY SPACEBOY  ,65.18,0,0,0,0,0,0,0,0,0,0,0,0,0,0,0,0,0,0,0,0,0,0,0PAPERWEIGHT KINGS CHOICE ,12.67,0,0,0,0,0,0,0,0,0,0,0,0,0,0,0,0,0,0,0,0,0,0,0MAGNETS PACK OF 4 RETRO PHOTO,13.39,0,0,0.42,0.42,0,0,0,0,0,0,0,0,0,0,0,0,0,0,0,0,0,0,0LIPSTICK PEN RED,22.47,0,0,0,0.36,0,0,0,0,0,0,0,0,0,0,0,0,0,0,0,0,0,0,0TOOTHPASTE TUBE PEN,31.43,0,0,0,0,0,0,0.65,0,0,0,0,0,0,0,0,0,0,0,0,0,0,0,0ENAMEL WATERING CAN CREAM,100.35,0,0,0,0,0,0,0,0,0,0,0,0,0,0,0,0,0,0,0,0,0,0,0WATERING CAN PINK BUNNY,36.65,0,0,0,0,0,0,0,0,0,0,0,0,0,0,0,0,0,0,0,0,0,0,0SET OF 9 BLACK SKULL BALLOONS,14.25,0.85,0,0,0,0,0,0,0,0,0,0,0,0,0,0,0,0,0,0,0,0,0,0TV DINNER TRAY AIR HOSTESS ,166.85,0,0,1.95,0,0,0,0,0,0,4.95,0,0,0,0,0,0,0,0,0,0,0,0,0EMPIRE UNION JACK TV DINNER TRAY,285.87,0,0,0,0,0,0,0,0,0,0,0,0,0,0,0,0,0,0,0,0,0,0,0WATERING CAN GARDEN MARKER,22.57,0,0,0,0,0,0,0,0,0,0,0,0,0,0,0,0,0,0,0,0,0,0,0BIRDHOUSE GARDEN MARKER ,21.32,0,0,0,0,0,0,0,0,0,0,0,0,0,0,0,0,0,0,0,0,0,0,0DAISY GARDEN MARKER,15.05,0,0,0,0,0,0,0,0,0,0,0,0,0,0,0,0,0,0,0,0,0,0,0SET OF 2 TINS VINTAGE BATHROOM ,131.36,0,0,0,0,0,0,0,4.25,0,0,0,0,0,0,4.25,0,0,0,0,0,0,0,0CHILDS GARDEN SPADE PINK,27.35,0,1.85,0,0,0,0,0,0,0,0,0,1.85,0,0,0,0,0,0,0,0,0,0,0CHILDS GARDEN RAKE PINK,10.52,0,1.85,0,0,0,0,0,0,0,0,0,1.85,0,0,0,0,0,0,0,0,0,0,0CHILDS GARDEN BRUSH PINK,31.55,0,1.85,0,0,0,0,0,0,0,0,0,1.85,0,0,0,0,0,0,0,0,0,0,0MINI JIGSAW BUNNIES,6.31,0,0,0,0,0,0,0.42,0,0,0,0,0,0,0,0,0,0,0,0,0,0,0,0HOLIDAY FUN LUDO,132.57,0,0,0,3.75,0,3.75,0,0,0,0,0,0,0,0,0,0,0,0,0,0,0,0,0TRADITIONAL MODELLING CLAY,59.3,1.25,0,0,0,0,1.25,0,0,0,0,0,0,0,0,0,0,0,0,0,0,0,0,0CARDHOLDER GINGHAM STAR,68.53,0,0,0,0,0,0,0,0,0,0,0,0,0,0,0,0,0,0,0,0,0,0,0WOODEN CROQUET GARDEN SET,285.29,0,0,0,14.95,0,0,0,0,0,0,0,0,0,0,0,0,0,0,0,0,0,0,0SET OF 4 NAPKIN CHARMS HEARTS,52.94,0,0,0,0,0,0,0,0,0,0,0,0,0,0,0,0,0,0,0,0,0,0,0RED BABY BUNTING ,150.64,0,0,0,0,0,0,0,0,0,0,0,0,0,0,0,0,0,0,0,0,0,0,0FRENCH KITCHEN SIGN BLUE METAL,13.79,0,0,0,0,0,0,0,0,0,0,0,0,0,0,0,0,0,0,0,0,0,0,0SET OF 6 RIBBONS VINTAGE CHRISTMAS,49.83,0,0,0,0,0,0,0,0,0,0,0,0,0,0,0,0,0,0,0,0,0,0,0FUNKY DIVA PEN,28.34,0,0,0,0.85,0,0,0,0,0,0,0,0,0,0,0,0,0,0,0,0,0,0,0SMALL PURPLE BABUSHKA NOTEBOOK ,43.6,0,0,0,0,0,0,0,0,0,0,0,0,0,0,0,0,0,0,0,0,0,0,0LARGE RED BABUSHKA NOTEBOOK ,56.43,0,0,0,0,0,0,0,0,0,0,0,0,0,0,0,0,0,0,1.25,0,0,0,0LARGE PURPLE BABUSHKA NOTEBOOK  ,47.61,0,0,0,0,0,0,0,0,0,0,0,0,0,0,0,0,0,0,1.25,0,0,0,0CHALKBOARD KITCHEN ORGANISER,278.93,0,0,0,0,0,21.95,0,0,0,0,0,0,0,0,0,0,0,0,0,0,0,0,0FLUTED ANTIQUE CANDLE HOLDER,35.9,0,0,0,0,0,0,0,0,0,0,0,0,0,0,0,0,0,0,0,0,0,0,0CARD MOTORBIKE SANTA,24.02,0,0,0,0.42,0,0.42,0,0,0,0,0,0,0,0,0,0,0,0,0,0,0,0,0CARD CHRISTMAS VILLAGE,18.19,0,0,0,0.42,0,0,0,0,0,0,0,0,0,0,0,0,0,0,0,0,0,0,0CREAM WALL PLANTER HEART SHAPED,90.07,0,0,0,0,0,0,0,0,0,0,0,0,0,0,0,0,0,0,0,0,0,0,0VINTAGE CREAM DOG FOOD CONTAINER,331.32,0,0,0,0,0,8.5,0,0,8.5,0,0,0,0,0,0,0,0,0,0,0,0,0,0BREAD BIN DINER STYLE IVORY,348.45,0,0,0,46.85,0,50.85,0,0,0,16.95,0,0,0,0,0,0,14.95,0,0,0,0,0,0LOVE HEART NAPKIN BOX ,199.45,0,0,0,0,0,0,0,4.25,0,0,0,0,0,0,0,0,0,0,0,0,0,0,0NUMBER TILE COTTAGE GARDEN 8,12.32,0,0,0,0,0,0,0,0,0,0,0,0,0,0,0,0,0,0,0,0,0,0,0YELLOW GIANT GARDEN THERMOMETER,41.59,0,0,0,0,0,0,0,0,0,0,0,0,0,0,0,0,0,0,0,0,0,0,0METAL DECORATION NAUGHTY CHILDREN ,84.64,0.85,0,0,0.85,0,0.85,0,0,0,0,0,0,0,0,0,0,0,0,0,0,0,0,036 DOILIES DOLLY GIRL,20.78,0,0,0,1.45,0,0,0,0,0,0,0,0,0,0,0,0,0,0,1.45,0,0,0,0CIRCUS PARADE CHILDRENS EGG CUP ,43.85,3.75,0,0,1.25,0,0,0,0,0,0,0,0,0,0,0,0,0,0,0,0,0,0,0BLUE VICTORIAN FABRIC OVAL BOX,7.56,0,0,0,0,0,0,0,0,0,0,0,0,0,0,0,0,0,0,0,0,0,0,0RED VICTORIAN FABRIC OVAL BOX,7.56,0,0,0,0,0,0,0,0,0,0,0,0,0,0,0,0,0,0,0,0,0,0,0SET OF 3 BIRD LIGHT PINK FEATHER ,23.82,0,0,0,0,0,0,0,0,0,0,0,0,0,0,0,0,0,0,0,0,0,0,0PINK/WHITE CHRISTMAS TREE 60CM,27,0,0,0,0,0,0,0,0,0,0,0,0,0,0,0,0,0,0,0,0,0,0,0PINK AND WHITE CHRISTMAS TREE 120CM,41.37,0,0,0,0,0,0,0,0,0,0,0,0,0,0,0,0,0,0,0,0,0,0,0PINK CHRISTMAS FLOCK DROPLET ,6.27,0,0,0,0,0,0,0,0,0,0,0,0,0,0,0,0,0,0,0,0,0,0,0ACRYLIC JEWEL ICICLE- PINK,3.36,0,0,0,0,0,0,0,0,0,0,0,0,0,0,0,0,0,0,0,0,0,0,0SMALLFOLKART BAUBLE CHRISTMAS DEC,43.56,0,0,0,0,0,0.19,0,0,0,0,0,0,0,0,0,0,0,0,0,0,0,0,0FOLKART ZINC HEART CHRISTMAS DEC,50.08,0,0,0,0,0,0,0,0.85,0,0,0,0,0,0,0,0,0,0.85,0,0,0,0,0ROSE FOLKART HEART DECORATIONS,23.81,0,0,0,0,0,0,0,0,0,0,0,0,0,0,0,0,0,0,0,0,0,0,0CERAMIC CAKE STAND + HANGING CAKES,265.51,0,0,0,0,0,0,0,0,0,0,0,0,0,0,0,0,0,0,0,8.5,0,0,0CONDIMENT TRAY 4 BOWLS AND 4 SPOONS,65.99,0,0,0,0,0,0,0,0,0,0,0,0,0,0,0,0,0,0,0,0,0,0,0TEA TIME OVEN GLOVE,71.3,0,0,0,1.25,0,1.25,0,0,0,0,0,0,0,0,0,0,0,0,0,0,0,0,0SCOTTIES CHILDRENS APRON,46.42,0,0,0,0,0,0,0,0,0,0,0,0,0,0,0,0,0,0,0,0,0,0,0PINK FAIRY CAKE CHILDRENS APRON,133.73,0,0,0,0,0,1.95,0,0,0,1.95,0,0,0,0,0,0,0,0,0,0,0,0,0SCOTTIE DOGS BABY BIB,16.95,0,0,0,0,0,0,0,0,0,0,0,0,0,0,0,0,0,0,0,0,0,0,0DOORMAT WELCOME PUPPIES,151.92,0,0,0,0,0,15.9,0,0,0,0,0,0,0,0,0,0,0,0,0,0,0,0,0HANGING JAM JAR T-LIGHT HOLDER,15.59,0,0,0,0,0,0,0,0,0,0,0,0,0,0,0,0,0,0,0,0,0,0,0SET OF 6 HALLOWEEN GHOST T-LIGHTS,3.4,0,0,0,0,0,0,0,0,0,0,0,0,0,0,0,0,0,0,0,0,0,0,0IVORY PILLAR CANDLE SILVER FLOCK,49.25,0,0,0,0,0,0,0,0,0,0,0,0,0,0,0,0,0,0,0,0,0,0,0IVORY PILLAR CANDLE GOLD FLOCK,30.32,0,0,0,0,0,0,0,0,0,0,0,0,0,0,0,0,0,0,0,0,0,0,0SET/3 ROSE CANDLE IN JEWELLED BOX,169.14,0,0,0,0,0,0,0,0,0,0,0,0,0,0,0,0,0,0,0,0,0,0,0SET/3 OCEAN SCENT CANDLE JEWEL BOX,118.32,0,0,0,0,0,4.25,0,0,0,0,0,0,0,0,0,0,0,0,0,0,0,0,0SET/3 VANILLA SCENTED CANDLE IN BOX,135.29,0,0,0,0,0,4.25,0,0,0,0,4.25,0,0,0,0,0,0,0,0,0,0,0,0SET/3 CHRISTMAS DECOUPAGE CANDLES,37.42,0,0,0,0,0,1.25,0,0,0,0,0,0,0,0,0,0,0,0,0,0,0,0,0TUMBLER- BAROQUE,16.02,0,0,0,0,0,0,0,0,0,0,0,0,0,0,0,0,0,0,0,0,0,0,0TUMBLER- NEW ENGLAND,14.37,0,0,0,0,0,0,0,0,0,0,0,0,0,0,0,0,0,0,0,0,0,0,0LAUNDRY 15C METAL SIGN,49.36,0,0,0,0,0,0,0,0,0,0,0,0,0,0,0,0,0,0,0,0,0,0,0HOT BATHS METAL SIGN,163.24,0,0,0,0,0,0,0,0,0,0,0,0,0,0,0,0,0,0,0,0,0,0,0METAL SIGN-CUPCAKE SINGLE HOOK,70.8,0.42,0,0,0.42,0,0,0,0,0,0,0,0,0,0,0,0,0,0,0,0,0,0,0METAL SIGN CUPCAKE SINGLE HOOK,34.38,0.42,0,0,0.42,0,0,0,0,0,0,0,0,0,0,0,0,0,0,0,0,0,0,0CHARLIE+LOLA RED HOT WATER BOTTLE ,168.02,0,0,0,0,0,0,0,0,0,0,4.65,0,0,0,0,0,0,0,0,0,0,0,0CHARLIE LOLA BLUE HOT WATER BOTTLE ,146.09,0,0,0,0,0,0,0,0,0,0,0,0,0,0,0,0,0,0,0,0,0,0,0CHARLIE+LOLA PINK HOT WATER BOTTLE,208.83,0,0,0,0,0,2.95,0,0,0,0,0,0,0,0,0,0,0,0,0,0,0,0,0PINK/PURPLE RETRO RADIO,31.09,0,0,0,0,0,0,0,0,0,0,0,0,0,0,0,0,0,0,0,0,0,0,0CHERRY BLOSSOM  DECORATIVE FLASK,70.18,7.5,0,0,0,0,0,0,0,0,0,0,0,0,0,0,0,0,0,0,0,0,0,0SET OF 12  VINTAGE POSTCARD SET,23.32,0,0,0,0,0,0,0,0,0,0,0,0,0,2.55,0,0,0,0,0,0,0,0,0SET OF 6 VINTAGE NOTELETS KIT,10.08,0,0,0,0,0,0,0,0,0,0,0,0,0,2.55,0,0,0,0,0,0,0,0,0ENVELOPE 50 ROMANTIC IMAGES,4.25,0,0,0,0,0,0,0,0,0,0,0,0,0,0,0,0,0,0,0,0,0,0,0ENVELOPE 50 BLOSSOM IMAGES,14.45,0,0,0,0,0,0,0,0,0,0,0,0,0,0.85,0,0,0,0,0,0,0,0,0YULETIDE IMAGES GIFT WRAP SET,32.52,0,0,0,0,0,2.1,0,0,0,0,0,0,0,0,0,0,0,0,0,0,0,0,0SET/4 RED MINI ROSE CANDLE IN BOWL,41.6,0,0,0,0,0,0,0,0,0,0,0,0,0,0,0,0,0,0,0,0,0,0,015CM CHRISTMAS GLASS BALL 20 LIGHTS,443.42,0,0,0,0,0,0,0,0,0,0,0,0,0,0,0,0,0,0,0,0,0,0,0