Product,United Kingdom,France,Australia,Netherlands,Germany,Norway,EIRE,Switzerland,Spain,Poland,Portugal,Italy,Belgium,Lithuania,Japan,Iceland,Channel Islands,Denmark,Cyprus,Sweden,Austria,Israel,Finland,BahrainMULTICOLOUR HONEYCOMB FAN,5.01,0,0,0,0,0,0,0,0,0,0,0,0,0,0,0,0,0,0,0,0,0,0,0RETROSPOT PADDED SEAT CUSHION,11.25,0,3.39,0,3.75,0,0,0,0,0,0,0,3.39,0,0,0,0,0,0,0,0,0,0,0MADRAS NOTEBOOK LARGE ,7.5,0,0,0,0,0,0,0,0,0,0,0,0,0,0,0,0,0,0,0,0,0,0,0VINTAGE BEAD NOTEBOOK,53.18,0,0,0,0,0,0,0,0,0,0,0,0,0,0,0,0,0,0,0,0,0,0,0BEADED CRYSTAL HEART PINK LARGE,3.3,0,0,0,0,0,0,0,0,0,0,0,0,0,0,0,0,0,0,0,0,0,0,0SANDALWOOD FAN,6.72,0,0,0,0,0,0,0,0,0,0,0,0,0,0,0,0,0,0,0,0,0,0,0HANGING HEART JAR T-LIGHT HOLDER,41.61,0,0,0,0,0,0,0,0,0,0,0,0,0,0,0,0,0,0,0,0,0,0,0PACK 6 HEART/ICE-CREAM PATCHES,12.17,0,0,0,0,0,0,0,0,0,0,0,0,0,0,0,0,0,0,0,0,0,0,0CREAM AND PINK FLOWERS PONY ,3.75,0,0,0,0,0,0,0,0,0,0,0,0,0,0,0,0,0,0,0,0,0,0,0BLUE CIRCLES DESIGN TEDDY,7.61,0,0,0,0,0,0,0,0,0,0,0,0,0,0,0,0,0,0,0,0,0,0,0CRYSTAL FROG PHONE CHARM,7.49,0,0,0,0,0,0,0,0,0,0,0,0,0,0,0,0,0,0,0,0,0,0,0SOMBRERO ,9.05,0,0,0,0,0,0,0,0,0,0,0,0,0,0,0,0,0,0,0,0,0,0,0ANIMAL STICKERS,0.84,0,0,0,0,0,0,0,0,0,0,0,0,0,0,0,0,0,0,0,0,0,0,0GREEN BITTY LIGHT CHAIN,32.96,0,0,0,0,0,0,0,0,0,0,0,0,0,0,0,0,0,0,0,0,0,0,0RAIN PONCHO ,4.21,0,0,0,0,0,0,0,0,0,0,0,0,0,0,0,0,0,0,0,0,0,0,0ASSORTED TUTTI FRUTTI BRACELET,9.87,0,0,0,0,0,0,0,0,0,0,0,0,0,0,0,0,0,0,0,0,0,0,0BLUE TRAVEL FIRST AID KIT,1.65,0,0,0,0,0,0,0,0,0,0,0,0,0,0,0,0,0,0,0,0,0,0,0FRENCH TOILET SIGN BLUE METAL,17.53,0,0,0,0,0,0,0,0,0,0,0,0,0,0,0,0,0,0,0,0,0,0,0BAG OF SILVER STONES,2.52,0,0,0,0,0,0,0,0,0,0,0,0,0,0,0,0,0,0,0,0,0,0,0ABSTRACT CIRCLES SKETCHBOOK ,41.49,0,0,0,0,0,0,0,0,0,0,0,0,0,0,0,0,0,0,0,0,0,0,0TEA TIME BREAKFAST BASKET,2.1,0,0,0,0,0,0,0,0,0,0,0,0,0,0,0,0,0,0,0,0,0,0,0ALPHABET HEARTS STICKER SHEET,9.27,0,0,0,0,0,0,0,0,0,0,0,0,0,0,0,0,0,0,0,0,0,0,0FOLKART STAR CHRISTMAS DECORATIONS,13.47,0,0,0,0,0,0,0,0,0,0,0,0,0,0,0,0,0,0,0,0,0,0,0ASS COLOUR GLOWING TIARAS,0.85,0.85,0,0,0,0,0,0,0,0,0,0,0,0,0,0,0,0,0,0,0,0,0,0WHITE BELL HONEYCOMB PAPER GARLAND ,44.77,0,0,0,0,0,0,0,0,0,0,0,0,0,0,0,0,0,0,0,0,0,0,0SMALL SILVER TRELLIS CANDLEPOT,26.57,0,0,0,0,0,0,0,0,0,0,0,0,0,0,0,0,0,0,0,0,0,0,0ROBIN CHRISTMAS CARD,0.84,0,0,0,0,0,0,0,0,0,0,0,0,0,0,0,0,0,0,0,0,0,0,036 PENCILS TUBE POSY,3.75,0,0,0,0,0,0,0,0,0,0,0,0,0,0,0,0,0,0,0,0,0,0,0FOLKART ZINC STAR CHRISTMAS DEC,1.7,0,0,0,0,0,0,0,0.85,0,0,0,0,0,0,0,0,0,0,0,0,0,0,0STRING OF 8 BUTTERFLIES-PINK,6.6,0,0,0,0,0,0,0,0,0,0,0,0,0,0,0,0,0,0,0,0,0,0,0UTILTY CABINET WITH HOOKS,120.63,0,0,0,0,0,0,0,0,0,0,0,0,0,0,0,0,0,0,0,0,0,0,0FRENCH BLUE METAL DOOR SIGN 9,10.03,0,0,0,0,0,0,0,0,0,0,0,0,0,0,0,0,0,0,0,0,0,0,0BATHROOM SCALES RUBBER DUCKS,3.75,0,0,0,0,0,0,0,0,0,0,0,0,0,0,0,0,0,0,0,0,0,0,0FLOOR CUSHION ELEPHANT CARNIVAL,91.84,0,0,0,0,0,0,0,0,0,0,0,0,0,0,0,8.95,0,0,0,0,0,0,0RABBIT  DESIGN  COTTON TOTE BAG,6.75,0,0,0,0,0,0,0,0,0,0,0,0,0,0,0,0,0,0,0,0,0,0,0JIGSAW TREE WITH BIRDHOUSE,8.7,0,0,0,0,0,0,0,0,0,0,0,0,0,1.45,0,0,0,0,0,0,0,0,0EASTER TIN BUNNY BOUQUET,15.09,3.3,1.65,1.45,1.65,0,0,0,0,0,0,0,1.65,0,1.65,0,0,0,0,0,0,0,0,0EASTER TIN CHICKS PINK DAISY,3.3,0,1.65,0,0,0,0,0,0,0,0,0,1.65,0,0,0,0,0,0,0,0,0,0,0MOTORING TISSUE BOX,12.52,1.25,0,0,0,0,0,0,0,0,0,0,0,0,0,0,0,0,0,0,0,0,0,0KENSINGTON COFFEE SET,76.5,0,0,0,0,0,0,0,0,0,0,0,0,0,0,0,0,0,0,0,0,0,0,0SET/12 FUNKY FELT FLOWER PEG IN BAG,14.71,0,0,0,0,0,0,0,0,0,0,0,0,0,0,0,0,0,0,0,0,0,0,0PARTY CONES CANDY TREE DECORATION,2.55,0,0,0,0,0,0,0,0,0,0,0,0,0,0,0,0,0,0,0,0,0,0,0SET OF 6 T-LIGHTS EASTER CHICKS,14.75,0,0,0,2.95,0,0,0,0,0,0,0,0,0,0,0,0,0,0,0,0,0,0,0PINK PADDED MOBILE,8.5,0,0,0,4.25,0,0,0,0,0,0,0,0,0,0,0,0,0,0,0,0,0,0,0S/12 MINI RABBIT EASTER,3.3,0,0,0,0,0,0,0,0,0,0,0,0,0,0,0,0,0,0,0,0,0,0,0MEDIUM MEDINA STAMPED METAL BOWL ,17.71,0,0,0,0,0,0,0,0,0,0,0,0,0,0,0,0,0,2.95,0,0,0,0,0MIRROR CORNICE,44.85,0,0,0,0,0,0,0,0,0,0,0,0,0,0,0,0,0,0,0,0,0,0,0BLUE & WHITE BREAKFAST TRAY,14.37,0,0,0,0,0,0,0,0,0,0,0,0,0,0,0,0,0,0,0,0,0,0,0RETRO PLASTIC 70'S TRAY,2.11,0,0,0,0,0,0,0,0,0,0,0,0,0,0,0,0,0,0,0,0,0,0,0PAPER POCKET TRAVELING FAN ,5.66,0,0,0,0,0,0,0,0,0,0,0,0,0,0,0,0,0,0,0,0,0,0,0BEADED CRYSTAL HEART GREEN SMALL,11.28,0,0,0,0,0,0,0,0,0,0,0,0,0,0,0,0,0,0,0,0,0,0,0HANGING FAIRY CAKE DECORATION,28.63,0,0,0,0,0,0,0,0,0,0,0,0,0,0,0,0,0,2.1,0,0,0,0,0BLUE TEATIME PRINT BOWL ,2.5,0,0,0,0,0,0,0,0,0,0,0,0,0,0,0,0,0,0,0,0,0,0,0HOUSE WRECKING METAL SIGN ,14.7,0,0,0,0,0,0,0,0,0,0,0,0,0,0,0,0,0,0,0,0,0,0,0BISCUIT TIN VINTAGE GREEN,54,0,0,0,6.75,0,0,0,0,0,0,0,0,0,0,0,0,0,0,0,0,0,0,0FRYING PAN RED RETROSPOT,127.17,0,0,0,8,0,0,0,0,0,0,0,0,0,0,0,0,0,0,0,0,0,0,0SET OF 16 VINTAGE ROSE CUTLERY,195.31,0,0,0,25.5,0,0,0,0,0,0,0,0,0,0,0,0,0,0,0,0,0,0,0NEW ENGLAND MUG W GIFT BOX,5.1,0,0,0,0,0,0,0,0,0,0,0,0,0,0,0,0,0,0,0,0,0,0,0PINK GREEN EMBROIDERY COSMETIC BAG,17.71,0,0,0,0,0,0,0,0,0,0,0,0,0,0,0,0,0,0,0,0,0,0,0BLUE GREEN EMBROIDERY COSMETIC BAG,2.95,0,0,0,0,0,0,0,0,0,0,0,0,0,0,0,0,0,0,0,0,0,0,0PAIR PADDED HANGERS PINK CHECK,20.55,0,0,0,0,0,0,0,0,0,0,0,0,0,0,0,0,0,0,0,0,0,0,0SMALL SILVER FLOWER CANDLE POT,5.9,0,0,0,0,0,0,0,0,0,0,0,0,0,0,0,0,0,0,0,0,0,0,0RED ROSE AND LACE C/COVER,2.95,0,0,0,0,0,0,0,0,0,0,0,0,0,0,0,0,0,0,0,0,0,0,0WOODLAND STORAGE BOX LARGE ,0,0,0,0,2.95,0,0,0,0,0,0,0,0,0,0,0,0,0,0,0,0,0,0,0GLITTER CHRISTMAS STAR ,14.33,0,0,0,0,0,0,0,0,0,0,0,0,0,0,0,0,0,0,0,0,0,0,0CARD SUKI BIRTHDAY,9.76,0,0,0,0,0,0,0,0,0,0,0,0,0,0,0,0,0,0,0,0,0,0,0WRAP SUKI AND FRIENDS,2.1,0,0,0,0,0,0,0,0,0,0,0,0,0,0,0,0,0,0,0,0,0,0,0BIRDCAGE DECORATION TEALIGHT HOLDER,2.31,0,0,0,0,0,0,0,0,0,0,0,0,0,0,0,0,0,0,0,0,0,0,0BLUE PUDDING SPOON,2.53,0,0,0,0,0,0,0,0,0,0,0,0,0,0,0,0,0,0,0,0,0,0,0RETRO PINK BALL ASHTRAY ,2.5,0,0,0,0,0,0,0,0,0,0,0,0,0,0,0,0,0,0,0,0,0,0,0SUMMER FUN DESIGN SHOWER CAP,3.75,0,0,0,0,0,0,0,0,0,0,0,0,0,0,0,0,0,0,0,0,0,0,0STRIPY DESIGN SHOWER CAP,6.25,0,0,0,0,0,0,0,0,0,0,0,0,0,0,0,0,0,0,0,0,0,0,0SET/4 DAISY MIRROR MAGNETS,10.92,0,0,0,0,0,0,0,0,0,0,0,0,0,0,0,0,0,0,0,0,0,0,0SET/4 BIRD MIRROR MAGNETS ,9.66,0,0,0,0,0,0,0,0,0,0,0,0,0,0,0,0,0,0,0,0,0,0,0SET/4 BUTTERFLY MIRROR MAGNETS,4.2,0,0,0,0,0,0,0,0,0,0,0,0,0,0,0,0,0,0,0,0,0,0,0FRENCH STYLE EMBOSSED HEART CABINET,21.95,0,0,0,0,0,0,0,0,0,0,0,0,0,0,0,0,0,0,0,0,0,0,0SKULL DESIGN TV DINNER TRAY,115.62,0,0,0,0,0,0,0,0,0,0,0,0,0,0,0,0,0,0,0,0,0,0,0GREEN SWEETHEART BRACELET,29.72,0,0,0,0,0,0,0,0,0,0,0,0,0,0,0,0,0,0,0,0,0,0,0CARNIVAL BRACELET,140.25,0,0,0,0,0,0,0,0,0,0,0,0,0,0,0,0,0,0,0,0,0,0,04 PEAR BOTANICAL DINNER CANDLES,21.26,0,0,0,0,0,0,0,0,0,0,0,0,0,0,0,0,0,0,0,0,0,0,0FUNKY MONKEY MUG,1.25,0,0,0,0,0,0,0,0,0,0,0,0,0,0,0,0,0,0,0,0,0,0,0ECONOMY LUGGAGE TAG,8.81,0,0,0,0,0,0,0,0,0,0,0,0,0,0,0,0,0,0,0,0,0,0,0HEART CALCULATOR,22.57,0,0,0,0,0,0,0,0,0,0,0,0,0,0,0,0,0,0,0,0,0,0,0BISCUITS SMALL BOWL LIGHT BLUE,11.76,0,0,0,0,0,0,0,0,0,0,0,0,0,0,0,0,0,0,0,0,0,0,0SMALL MARSHMALLOWS PINK BOWL,20.35,0,0,0,0,0,0,0,0,0,0,0,0,0,0,0,0,0,0,0,0,0,0,0PARTY PIZZA DISH GREEN POLKADOT,5.24,0,0,0.21,1.06,0,0,0,0,0,0,0,0,0,0,0,0,0,0,0,0,0,0,0PARTY PIZZA DISH PINK POLKADOT,6.9,0,0,0.21,1.06,0,0,0,0,0,0,0,0,0,0,0,0,0,0,0,0,0,0,0ASSORTED CHEESE FRIDGE MAGNETS,2.57,0,0,0,0,0,0,0,0,0,0,0,0,0,0,0,0,0,0,0,0,0,0,0PEARL CRYSTAL PUMPKIN T-LIGHT HLDR,25.68,0,0,0,0,0,0,0,0,0,0,0,0,0,0,0,0,0,0,0,0,0,0,0BREAD BIN- DINER STYLE- MINT,14.95,0,0,0,0,0,0,0,0,0,0,0,0,0,0,0,0,0,0,0,0,0,0,0BREAD BIN- DINER STYLE- IVORY,14.95,0,0,0,0,0,0,0,0,0,0,0,0,0,0,0,0,0,0,0,0,0,0,0CARD GINGHAM ROSE ,3.37,0,0,0,0,0,0,0,0,0,0,0,0,0,0.42,0,0,0,0,0,0,0,0,0ROSE 1 WICK MORRIS BOXED CANDLE,29.27,0,0,0,0,0,0,0,0,0,0,0,0,0,0,0,0,0,0,0,0,0,0,0DOLLY HONEYCOMB GARLAND,3.95,0,0,0.65,0,0,0,0,0,0,0,0,0,0,0,0,0,0,0,0,0,0,0,0PINK KNITTED EGG COSY,5.85,0,0,0,0,0,0,0,0,0,0,0,0,0,0,0,0,0,0,0,0,0,0,0BLUE KNITTED EGG COSY,5.85,0,0,0,0,0,0,0,0,0,0,0,0,0,0,0,0,0,0,0,0,0,0,0WAY OUT METAL SIGN ,4.95,0,0,0,0,0,0,0,0,0,0,0,0,0,0,0,0,0,0,0,0,0,0,0SAVOY ART DECO CLOCK,191.2,0,0,0,0,0,0,0,0,0,0,0,0,0,0,0,0,0,0,0,0,0,0,0HALL CABINET WITH 3 DRAWERS,82.64,0,0,0,0,0,0,0,0,0,0,0,0,0,0,0,0,0,0,0,0,0,0,0DOORMAT HOME SWEET HOME BLUE ,135.78,0,0,0,0,7.95,0,0,0,0,0,0,0,0,0,0,7.95,0,0,0,0,0,0,0BLUE WIRE SPIRAL CANDLE HOLDER,25.42,0,0,0,0,0,0,0,0,0,0,0,0,0,0,0,0,0,0,0,0,0,0,0S/12 VANILLA  BOTANICAL T-LIGHTS,20.66,0,0,0,0,0,0,0,0,0,0,0,0,0,0,0,0,0,0,0,0,0,0,0SMALL HAMMERED SILVER CANDLEPOT ,29.51,0,0,0,0,0,0,0,0,0,0,0,0,0,0,0,0,0,0,0,0,0,0,0WHITE CHRYSANTHEMUMS ART FLOWER,4.2,0,0,0,0,0,0,0,0,0,0,0,0,0,0,0,0,0,0,0,0,0,0,0RETRO PLASTIC DAISY TRAY,5.43,0,0,0,0,0,0,0,0,0,0,0,0,0,0,0,0,0,0,0,0,0,0,0ANGEL DECORATION WITH LACE PADDED,5.95,0,0,0,0,0,0,0,0,0,0,0,0,0,0,0,0,0,0,0,0,0,0,0SUNSET CHECK HAMMOCK,32.88,0,0,0,0,0,0,0,0,0,0,0,0,0,0,0,0,0,0,0,0,0,0,0CHRYSANTHEMUM  JOURNAL,7.65,0,0,0,0,0,0,0,0,0,0,0,0,0,0,0,0,0,0,0,0,0,0,0ASSTD MULTICOLOUR CIRCLES MUG,24.57,0,0,0,0,0,0,0,0,0,0,0,0,0,0,0,0,0,0,0,0,0,0,0FRENCH CHATEAU LARGE PLATTER ,15.9,0,0,0,0,0,0,0,0,0,0,0,0,0,0,0,0,0,0,0,0,0,0,0ENVELOPE 50 CURIOUS IMAGES,0.85,0,0,0,0,0,0,0,0,0,0,0,0,0,0,0,0,0,0,0,0,0,0,0FOLDING CAMPING SCISSOR W/KNIF & S,0.12,0,0,0,0,0,0,0,0,0,0,0,0,0,0,0,0,0,0,0,0,0,0,0HAND OPEN SHAPE DECO.WHITE,15.42,0,0,0,0,0,0,0,0,0,0,0,0,0,0,0,0,0,0,0,0,0,0,0PINK JEWELLED MIRROR TRINKET TRAY,24.33,0,0,0,0,0,0,0,0,0,0,0,0,0,0,0,0,0,0,0,0,0,0,0WHITE SAGE INCENSE,2.79,0,0,0,0,0,0,0,0,0,0,0,0,0,0,0,0,0,0,0,0,0,0,0AFGHAN SLIPPER SOCK PAIR,30.55,0,0,0,0,0,0,0,0,0,0,0,0,0,0,0,0,0,0,0,0,0,0,0CITRONELLA CANDLE FLOWERPOT,12.62,0,0,0,0,0,0,0,0,0,0,0,0,0,0,0,0,0,0,0,0,0,0,0SMALL GLASS SUNDAE DISH CLEAR,17.07,0,0,0,0,0,0,0,0,0,0,0,0,0,0,0,0,0,0,0,0,0,0,0VINTAGE CARAVAN GIFT WRAP,1.68,0.42,0,0,0,0,0,0,0,0,0,0,0,0,0,0,0,0,0,0,0,0,0,0GOLD EAR MUFF HEADPHONES,38.51,0,0,0,0,0,0,0,0,0,0,0,0,0,0,0,0,0,0,0,0,0,0,0PAPERWEIGHT SAVE THE PLANET,11.9,0,0,0,0,0,0,0,0,0,0,0,0,0,0,0,0,0,0,0,0,0,0,0SWEETHEART CARRY-ALL BASKET,50.94,0,0,0,0,0,0,0,0,0,0,0,0,0,0,0,0,0,0,0,0,0,0,0RED RETROSPOT STORAGE JAR,33.39,0,0,0,0,0,0,0,0,0,3.75,0,0,0,3.39,0,0,0,0,0,0,0,0,0PARTY FOOD SHOPPER BAG,16.29,0,0,0,0,0,0,0,1.25,0,0,0,0,0,0,0,0,0,0,0,0,0,0,0CAMOUFLAGE EAR MUFF HEADPHONES,44,0,0,0,0,0,0,0,0,0,0,0,0,0,0,5.49,0,0,0,0,0,0,0,0ZINC HEART LATTICE CHARGER LARGE,18.99,0,0,0,0,0,0,0,0,0,0,0,0,0,0,0,0,0,0,0,0,0,0,0SMALL POLKADOT CHOCOLATE GIFT BAG ,11.78,0,0,0,0,0,0,0,0,0,0,0,0,0,0,0,0,0,0,0,0,0,0,0GLASS CHALICE GREEN  SMALL ,8.17,0,0,0,0,0,0,0,0,0,0,0,0,0,0,0,0,0,0,0,0,0,0,0RELAX LARGE WOOD LETTERS,49.95,0,0,0,0,0,0,0,0,0,0,0,0,0,0,0,0,0,0,0,0,0,0,0BLUE POLKADOT EGG CUP ,11.33,0,0,0,0,0,0,0,0,0,0,0,0,0,0,0,0,0,0,0,0,0,0,0ELEPHANT CARNIVAL POUFFE,164.01,0,0,0,0,0,0,0,0,0,0,0,0,0,0,0,14.95,0,0,0,0,0,0,0VINTAGE PINK DECORATIVE PARASOL,79.12,0,0,0,0,0,0,0,0,0,0,0,0,0,0,0,0,0,0,0,0,0,0,0MIRROR MOSAIC HURRICANE LAMP ,35.42,0,0,0,0,0,0,0,0,0,0,0,0,0,0,0,0,0,0,0,0,0,0,0PING! MICROWAVE PLATE,31.88,0,0,0,0,0,0,3.75,0,0,0,0,0,0,0,0,0,0,0,0,0,0,0,0CAKE STAND LOVEBIRD 2 TIER PINK,20.38,0,0,0,9.95,0,0,0,0,0,0,9.95,0,0,0,0,0,0,0,0,0,0,0,0CAKE PLATE LOVEBIRD PINK,36.56,1.95,0,0,4.95,0,0,0,0,0,0,1.95,0,0,0,0,0,0,0,0,0,0,0,012 EGG HOUSE PAINTED WOOD,229.42,0,0,0,0,0,0,0,0,0,0,0,0,0,0,0,0,0,0,0,0,0,0,0ROUND CONTAINER SET OF 5 RETROSPOT,21.75,0,0,0,0,0,0,0,0,0,0,0,0,0,0,0,0,0,0,0,0,0,0,0SET OF 36 DOILIES SPACEBOY DESIGN ,7.33,0,0,0,0,0,0,0,0,0,0,0,0,0,0,0,0,0,0,0,0,0,0,0PACK OF 20 SPACEBOY NAPKINS,6.72,0,0,0.85,0,0,0,0,0,0,0,0,0,0,0,0,0,0,0,0,0,0,0,0VINTAGE BEAD PINK PURSE ,34.06,0,0,0,0,0,0,0,0,0,0,0,0,0,0,0,0,0,0,0,0,0,0,0VINTAGE BEAD PINK SCARF ,53.59,0,0,0,1.65,0,0,0,0,0,0,0,0,0,0,0,0,0,0,0,0,0,0,0CERAMIC CAKE DESIGN SPOTTED PLATE,35.58,0,0,0,0,0,0,0,0,0,0,0,0,0,0,0,0,0,0,0,0,0,0,0FUNKY MONKEY CUSHION COVER,21.91,0,0,0,0,0,0,0,0,0,0,0,0,0,0,0,0,0,0,0,0,0,0,0WOVEN FROST CUSHION COVER,21.05,0,0,0,0,0,0,0,0,0,0,0,0,0,0,0,0,0,0,0,0,0,0,0WOVEN CANDY CUSHION COVER ,8.42,0,0,0,0,0,0,0,0,0,0,0,0,0,0,0,0,0,0,0,0,0,0,0TURQ ICE CREAM BUM BAG ,12.67,0,0,0,0,0,0,0,0,0,0,0,0,0,0,0,0,0,0,0,0,0,0,0SET/4 WHITE RETRO STORAGE CUBES ,146.45,0,0,0,0,0,0,0,0,0,0,0,0,0,0,0,0,0,0,0,0,0,0,0HEN HOUSE W CHICK STANDING,1.68,0,0.37,0,0.42,0,0,0,0,0,0,0,0.37,0,0,0,0,0,0,0,0,0,0,0GIRLS ALPHABET IRON ON PATCHES ,3.44,0,0,0,0,0,0,0,0,0,0,0,0,0,0,0,0,0,0,0,0,0,0,0ENCHANTED BIRD PLANT CAGE,15.12,0,0,0,0,0,0,0,0,0,0,0,0,0,0,0,0,0,0,0,0,0,0,0SET OF 4 DIAMOND NAPKIN RINGS,71.31,0,0,0,0,0,0,0,0,0,0,0,0,0,0,0,0,0,0,0,0,0,0,0CANDY SPOT EGG WARMER HARE,7.53,0,0,0,0,0,0,0,0,0,0,0,0,0,0,0,0,0,0,0,0,0,0,0HILDA CANDY SPOT RABBIT,26.61,0,0,0,0,0,0,0,0,0,0,0,0,0,0,0,0,0,0,0,0,0,0,0HANGING WOOD AND FELT HEART,5.08,0,0,0,0,0,0,0,0,0,0,0,0,0,0,0,0,0,0,0,0,0,0,0HANGING WOOD AND FELT FLOWER,2.54,0,0,0,0,0,0,0,0,0,0,0,0,0,0,0,0,0,0,0,0,0,0,0ANTIQUE OLIVE GREEN FLOWER EARRINGS,4.24,0,0,0,0,0,0,0,0,0,0,0,0,0,0,0,0,0,0,0,0,0,0,0GREEN VINTAGE EARRINGS ,29.68,0,0,0,0,0,0,0,0,0,0,0,0,0,0,0,0,0,0,0,0,0,0,0GOLD M PEARL  ORBIT NECKLACE,20.57,0,0,0,0,0,0,0,0,0,0,0,0,0,0,0,0,0,0,0,0,0,0,0CRYSTAL STILETTO PHONE CHARM,3.32,0,0,0,0,0,0,0,0,0,0,0,0,0,0,0,0,0,0,0,0,0,0,0LIGHT TOPAZ TEAL/AQUA COL NECKLACE,5.09,0,0,0,0,0,0,0,0,0,0,0,0,0,0,0,0,0,0,0,0,0,0,0PINK SWEETIE NECKLACE,7.64,0,0,0,0,0,0,0,0,0,0,0,0,0,0,0,0,0,0,0,0,0,0,0IVORY PENDANT TRIPLE SHELL NECKLACE,5.09,0,0,0,0,0,0,0,0,0,0,0,0,0,0,0,0,0,0,0,0,0,0,0ST TROPEZ NECKLACE,20.36,0,0,0,0,0,0,0,0,0,0,0,0,0,0,0,0,0,0,0,0,0,0,0AMBER DROP EARRINGS W LONG BEADS,11.84,0,0,0,0,0,0,0,0,0,0,0,0,0,0,0,0,0,0,0,0,0,0,0AMETHYST DROP EARRINGS W LONG BEADS,8.88,0,0,0,0,0,0,0,0,0,0,0,0,0,0,0,0,0,0,0,0,0,0,0BLACK ENAMEL FLOWER RING,11.84,0,0,0,0,0,0,0,0,0,0,0,0,0,0,0,0,0,0,0,0,0,0,0JET BLACK LAS VEGAS BRACELET ROUND,15.18,0,0,0,0,0,0,0,0,0,0,0,0,0,0,0,0,0,0,0,0,0,0,0PINK JEWELLED PHOTO FRAME,15.57,0,0,0,0,0,0,0,0,0,0,0,0,0,0,0,0,0,0,0,0,0,0,0POCKET BAG BLUE PAISLEY RED SPOT,18.45,0,0,0,0,0,0,0,0,0,0,0,0,0,0,0,0,0,0,0,0,0,0,0POCKET BAG PINK PAISELY BROWN SPOT,4.65,0,0,0,0,0,0,0,0,0,0,0,0,0,0,0,0,0,0,0,0,0,0,0BOTTLE BAG RETROSPOT ,44.57,0,0,0,0,0,0,0,0,0,0,0,0,0,0,0,0,0,0,0,0,0,0,0SET OF 2 ROUND TINS CAMEMBERT ,70.91,2.95,2.95,0,0,0,0,0,0,0,0,0,2.95,0,0,0,0,0,0,0,0,0,0,0CHILDS GARDEN TROWEL PINK,6.72,0,0,0,0,0,0,0,0,0,0,0,0,0,0,0,0,0,0,0,0,0,0,0CHILDS GARDEN FORK PINK,5.91,0,0,0,0,0,0,0,0,0,0,0,0,0,0,0,0,0,0,0,0,0,0,0FRENCH BLUE METAL DOOR SIGN 2,21.31,0,0,0,0,0,0,0,0,0,0,0,0,0,0,0,0,0,0,0,0,0,0,0FRENCH BLUE METAL DOOR SIGN 7,10.03,0,0,0,0,0,0,0,0,0,0,0,0,0,0,0,0,0,0,0,0,0,0,0CARD WEDDING DAY,3.39,0,0,0,0,0,0,0,0,0,0,0,0,0,0,0,0,0,0,0,0,0,0,0SET OF PICTURE FRAME  STICKERS,47.27,0,0,0,0,0,0,0,0,0,0,0,0,0,0,0,0,0,0,0,0,0,0,0PINK GOOSE FEATHER TREE 60CM,11.82,0,0,0,0,0,0,0,0,0,0,0,0,0,0,0,0,0,0,0,0,0,0,0IVORY HANGING DECORATION  BIRD,8.38,0,0,0,0,0,0,0,0,0,0.85,0,0,0,0,0,0,0,0,0,0,0,0,0FRENCH LAVENDER SCENT HEART,23.15,0,0,0,0,0,0,0,0,0,0,0,0,0,0,0,0,0,0,0,0,0,0,0BLUE EGG  SPOON,2.48,0,0,0,0,0,0,0,0,0,0,0,0,0,0,0,0,0,0,0,0,0,0,0DAIRY MAID LARGE MILK JUG,75.6,0,0,0,0,0,0,0,0,0,0,0,0,0,0,0,0,0,0,0,0,0,0,04 WILDFLOWER BOTANICAL CANDLES,23.9,0,0,0,0,0,0,0,0,0,0,0,0,0,0,0,0,0,0,0,0,0,0,0GARLAND WITH HEARTS AND BELLS,85.77,0,0,0,0,0,0,0,0,0,0,0,0,0,0,0,0,0,0,0,0,0,0,0GREEN  DIAMANTE PEN IN GIFT BOX,13.4,0,0,0,0,0,0,0,0,0,0,0,0,0,0,0,0,0,0,0,0,0,0,0CAKES AND RABBITS DESIGN FLANNEL ,7.49,0,0,0,0,0,0,0,0,0,0,0,0,0,0,0,0,0,0,0,0,0,0,0MIRROR MOSAIC CANDLE PLATE,9.96,0,0,0,0,0,0,0,0,0,0,0,0,0,0,0,0,0,0,0,0,0,0,0BIRD DECORATION GREEN POLKADOT,17.33,0,0,0,0,0,0,0,0,0,0,0,0,0,0,0,0,0,0,0,0,0,0,0NOEL GARLAND PAINTED ZINC ,13.44,0,0,0,0,0,0,0,0,0,0,0,0,0,0,0,0,0,0,0,0,0,0,04 GOLD FLOCK CHRISTMAS BALLS,3.36,0,0,0,0,0,0,0,0,0,0,0,0,0,0,0,0,0,0,0,0,0,0,0YELLOW FELT HANGING HEART W FLOWER,3.32,0,0,0,0,0,0,0,0,0,0,0,0,0,0,0,0,0,0,0,0,0,0,0WOVEN BUBBLE GUM CUSHION COVER,8.42,0,0,0,0,0,0,0,0,0,0,0,0,0,0,0,0,0,0,0,0,0,0,0SET/6 PINK  BUTTERFLY T-LIGHTS,72.37,0,0,0,0,0,0,0,0,0,0,0,0,0,0,0,0,0,0,0,0,0,0,0PINK METAL CHICKEN HEART ,26.88,0,0,1.25,0,0,0,0,0,0,0,0,0,0,0,0,0,0,0,0,0,0,0,0KITCHEN FLOWER POTS WALL PLAQUE,24.62,0,0,0,0,0,0,0,0,0,0,0,0,0,0,0,0,0,0,0,0,0,0,0S/4 IVORY MINI ROSE CANDLE IN BOWL,29.86,0,0,0,0,0,0,0,0,0,0,0,0,0,0,0,0,0,0,0,0,0,0,0S/4 BLACK MINI ROSE CANDLE IN BOWL,21.98,0,0,0,0,0,0,0,0,0,0,0,0,0,0,0,0,0,0,0,0,0,0,0BEADED CRYSTAL HEART BLUE ON STICK,3.4,0,0,0,0,0,0,0,0,0,0,0,0,0,0,0,0,0,0,0,0,0,0,0AMBER GLASS/SILVER BRACELET,18.68,0,0,0,0,0,0,0,0,0,0,0,0,0,0,0,0,0,0,0,0,0,0,0FIRE POLISHED GLASS BRACELET BLACK,3.81,0,0,0,0,0,0,0,0,0,0,0,0,0,0,0,0,0,0,0,0,0,0,0CHUNKY CRACKED GLAZE NECKLACE IVORY,11.05,0,0,0,0,0,0,0,0,0,0,0,0,0,0,0,0,0,0,0,0,0,0,0LILY BROOCH OLIVE COLOUR,10.04,0,0,0,0,0,0,0,0,0,0,0,0,0,0,0,0,0,0,0,0,0,0,0WHITE FRANGIPANI NECKLACE,5.08,0,0,0,0,0,0,0,0,0,0,0,0,0,0,0,0,0,0,0,0,0,0,0TURQ STONE/CRYSTAL EARRINGS,14.8,0,0,0,0,0,0,0,0,0,0,0,0,0,0,0,0,0,0,0,0,0,0,0GREEN STONE/CRYSTAL EARRINGS,11.84,0,0,0,0,0,0,0,0,0,0,0,0,0,0,0,0,0,0,0,0,0,0,0PURPLE PAPER PARASOL,17.72,0,0,0,0,0,0,0,0,0,0,0,0,0,0,0,0,0,0,0,0,0,0,0GREEN FERN SKETCHBOOK ,41.49,0,0,0,0,0,0,0,0,0,0,0,0,0,0,0,0,0,0,0,0,0,0,0SMALL PINK GLASS SUNDAE DISH,7.98,0,0,0,0,0,0,0,0,0,0,0,0,0,0,0,0,0,0,0,0,0,0,0ESSENTIAL BALM 3.5g TIN IN ENVELOPE,2.44,0,0,0,0,0,0,0,0,0,0,0,0,0,0,0,0,0,0,0,0,0,0,0CAKE SHOP  STICKER SHEET,1.7,0,0,0,0,0,0,0,0,0,0,0,0,0,0,0,0,0,0,0,0,0,0,072 CAKE CASES VINTAGE CHRISTMAS,0.55,0,0,0,0,0,0,0,0,0,0,0,0,0,0,0,0,0,0,0,0,0,0,0SET OF 16 VINTAGE SKY BLUE CUTLERY,208.05,0,0,0,0,0,0,0,0,0,0,0,0,0,0,0,0,0,0,0,0,0,0,0LARGE STRIPES CHOCOLATE GIFT BAG,3.75,0,0,0,0,0,0,0,0,0,0,0,0,0,0,0,0,0,0,0,0,0,0,0WOODEN SKITTLES GARDEN SET,97.8,0,0,0,15.95,0,0,0,0,0,0,0,0,0,0,0,0,0,0,0,0,0,0,0CUBIC MUG FLOCK BLUE ON BROWN,5.1,0,0,0,0,0,0,0,0,0,0,0,0,0,0,0,0,0,0,0,0,0,0,0CUBIC MUG PINK POLKADOT,59.4,0,0,0,0,0,0,0,0,0,0,0,0,0,0,0,0,0,0,0,0,0,0,0VINTAGE KEEPSAKE BOX TRAVELOGUE,31.79,0,0,0,0,0,0,0,0,0,0,0,0,0,0,0,0,0,0,0,0,0,0,0VINTAGE NOTEBOOK PARIS DAYS,29.54,0,0,0,0,0,0,0,0,0,0,0,0,0,0,0,0,0,0,0,0,0,0,0"PINK/WHITE ""KEEP CLEAN"" BULLET BIN",5.9,0,0,0,0,0,0,0,0,0,0,0,0,0,0,0,0,0,0,0,0,0,0,0FRENCH BLUE METAL DOOR SIGN 8,11.28,0,0,0,0,0,0,0,0,0,0,0,0,0,0,0,0,0,0,0,0,0,0,0FRENCH BLUE METAL DOOR SIGN 0,6.26,0,0,0,0,0,0,0,0,0,0,0,0,0,0,0,0,0,0,0,0,0,0,0SET OF 36 MUSHROOM PAPER DOILIES,2.9,0,0,0,0,0,0,0,0,0,0,0,0,0,0,0,0,0,0,0,0,0,0,0DOORMAT WELCOME SUNRISE,54.63,0,0,0,0,0,0,0,0,0,0,0,0,0,0,0,0,0,0,0,0,0,0,0TOXIC AREA  DOOR HANGER ,15.88,0,0,0,0,0,0,0,0,0,0,0,0,0,0,0,0,0,0,0,0,0,0,0LA PALMIERA TILE COASTER,5.43,0,0,0.42,0,0,0,0,0,0,0,0,0,0,0,0,0,0,0,0,0,0,0,0JIGSAW RABBIT AND BIRDHOUSE,3.3,0,0,0,0,0,0,0,0,0,0,0,0,0,0,0,0,0,0,0,0,0,0,0WOODEN BOX ADVENT CALENDAR ,8.95,0,0,0,0,0,0,0,0,0,0,0,0,0,0,0,0,0,0,0,0,0,0,0PLASMATRONIC LAMP,20.65,0,0,0,0,0,0,0,0,0,0,0,0,0,0,0,0,0,0,0,0,0,0,04 BURGUNDY WINE DINNER CANDLES,3.75,0,0,0,0,0,0,0,0,0,0,0,0,0,0,0,0,0,0,0,0,0,0,0SILVER OVAL SHAPE TRINKET BOX,15.86,0,0,0,0,0,0,0,0,0,0,0,0,0,0,0,0,0,0,0,0,0,0,0WRAP BLUE RUSSIAN FOLKART,0.42,0,0,0,0,0,0,0,0,0,0,0,0,0,0,0,0,0,0,0,0,0,0,0DAISY JOURNAL ,5.1,0,0,0,0,0,0,0,0,0,0,0,0,0,0,0,0,0,0,0,0,0,0,0DUSTY PINK CHRISTMAS TREE 30CM,1.25,0,0,0,0,0,0,0,0,0,0,0,0,0,0,0,0,0,0,0,0,0,0,0HANGING PHOTO CLIP ROPE LADDER,8.11,0,0,0,0,0,0,0,0,0,0,0,0,0,0,0,0,0,0,0,0,0,0,0PINK PARTY SUNGLASSES,1.95,0,0,0,0,0,0,0,0,0,0,0,0,0,0,0,0,0,0,0,0,0,0,0POSY CANDY BAG,1.25,0,0,0,0,0,0,0,0,0,0,0,0,0,0,0,0,0,0,0,0,0,0,0BLACKCHRISTMAS TREE 30CM,1.25,0,0,0,0,0,0,0,0,0,0,0,0,0,0,0,0,0,0,0,0,0,0,0SMALL DOLLY MIX DESIGN ORANGE BOWL,32.9,0,0,0,0,0,0,0,0,0,0,0,0,0,0,0,0,0,0,0,0,0,0,0POCKET MIRROR WOODLAND,2.5,0,0,0,0,0,0,0,0,0,0,0,0,0,0,0,0,0,0,0,0,0,0,0HEART SHAPE WIRELESS DOORBELL,21,0,0,0,0,0,0,0,0,0,0,0,0,0,0,0,0,0,0,0,0,0,0,0SET/6 GREEN SPRING PAPER CUPS,0.65,0,0,0,0,0,0,0,0,0,0,0,0,0,0,0,0,0,0,0,0,0,0,0ASSORTED TUTTI FRUTTI LARGE PURSE,25.2,0,0,0,0,0,0,0,0,0,0,0,0,0,0,0,0,0,0,0,0,0,0,0COFFEE SCENT PILLAR CANDLE,5.72,0,0,0,0,0,0,0,0,0,0,0,0,0,0,0,0,0,0,0,0,0,0,0PINK ROSE WASHBAG,18.75,0,0,0,0,0,0,0,0,0,0,0,0,0,0,0,0,0,0,0,0,0,0,0GARDENIA 1 WICK MORRIS BOXED CANDLE,17,0,0,0,0,0,4.25,0,0,0,0,0,0,0,0,0,0,0,0,0,0,0,0,0SILVER LATTICE VANILLA CANDLE POT,15,0,0,0,0,0,0,0,0,0,0,0,0,0,0,0,0,0,0,0,0,0,0,0PACK 3 IRON ON DOG PATCHES,9.67,0,0,0,0,0,0,0,0,0,0,0,0,0,0,0,0,0,0,0,0,0,0,0DAISY NOTEBOOK ,11.73,0,0,0,0,0,0,0,0,0,0,0,0,0,0,0,0,0,0,0,0,0,0,0BLACK FINE BEAD NECKLACE W TASSEL,5.95,0,0,0,0,0,0,0,0,0,0,0,0,0,0,0,0,0,0,0,0,0,0,0FIRE POLISHED GLASS NECKL BRONZE,17.85,0,0,0,0,0,0,0,0,0,0,0,0,0,0,0,0,0,0,0,0,0,0,0ROUND PINK HEART MIRROR,12.62,0,0,0,0,0,0,0,0,0,0,0,0,0,0,0,0,0,0,0,0,0,0,0GOLD COSMETIC BAG PINK STAR,4.2,0,0,0,0,0,0,0,0,0,0,0,0,0,0,0,0,0,0,0,0,0,0,0EIGHT PIECE CREEPY CRAWLIE SET,2.5,0,0,0,0,0,0,0,0,0,0,0,0,0,0,0,0,0,0,0,0,0,0,0SMOKEY GREY COLOUR D.O.F. GLASS,1.3,0,0,0,0,0,0,0,0,0,0,0,0,0,0,0,0,0,0,0,0,0,0,0S/3 POT POURI CUSHIONS BLUE COLOURS,2.1,0,0,0,0,0,0,0,0,0,0,0,0,0,0,0,0,0,0,0,0,0,0,0BLACK AND WHITE DOG BOWL,26.62,0,0,0,0,0,0,0,0,0,0,0,0,0,0,0,0,0,0,0,0,0,0,0SPOTS ON RED BOOKCOVER TAPE,0.42,0,0,0,0,0,0,0,0,0,0,0,0,0,0,0,0,0,0,0,0,0,0,0ASSORTED TUTTI FRUTTI HEART BOX,10,0,0,0,0,0,0,0,0,0,0,0,0,0,0,0,0,0,0,0,0,0,0,0POLYESTER FILLER PAD 65CMx65CM,8.5,0,0,0,0,0,0,0,0,0,0,0,0,0,0,0,0,0,0,0,0,0,0,0FRENCH BLUE METAL DOOR SIGN 6,11.27,0,0,0,0,0,0,0,0,0,0,0,0,0,0,0,0,0,0,0,0,0,0,0SMALL RED RETROSPOT WINDMILL,15.04,0,0,0,0,0,0,0,0,0,0,0,0,0,0,0,0,0,0,0,0,0,0,0HAND TOWEL PALE BLUE W FLOWERS,34.99,0,0,1.25,0,0,0,0,0,0,0,0,0,0,0,0,0,0,0,0,0,0,0,0BLUE ORGANDY ROUND LAMPSHADE W BEA,0.85,0,0,0,0,0,0,0,0,0,0,0,0,0,0,0,0,0,0,0,0,0,0,0WHITE AND BLUE CERAMIC OIL BURNER,7.52,0,0,0,0,0,0,0,0,0,0,0,0,0,0,0,0,0,0,0,0,0,0,0PAPER CHAIN KIT SKULLS ,11.8,0,0,0,0,0,0,0,0,0,0,0,0,0,0,0,0,0,2.95,0,0,0,0,0PINK FAIRY CAKE CUSHION COVER,35.86,0,0,0,0,0,0,0,0,0,0,0,0,0,0,0,0,0,0,0,0,0,0,0GREEN POP ART MAO CUSHION COVER ,0.19,0,0,0,0,0,0,0,0,0,0,0,0,0,0,0,0,0,0,0,0,0,0,0HEART SHAPED MIRROR,3.38,0,0,0,0,0,0,0,0,0,0,0,0,0,0,0,0,0,0,0,0,0,0,0GOLD WASHBAG,2.95,0,0,0,0,0,0,0,0,0,0,0,0,0,0,0,0,0,0,0,0,0,0,0PINK PAISLEY ROSE GIFT WRAP,1.26,0,0,0,0,0,0,0,0,0,0,0,0,0,0,0,0,0,0,0,0,0,0,0WOODLAND  STICKERS,10.04,0.85,0,0,1.7,0,0,0,0,0,0,0,0,0,0,0,0,0,0,0,0,0,0,0SILVER TEDDY BEAR,6.26,0,0,0,0,0,0,0,0,0,0,0,0,0,0,0,0,0,0,0,0,0,0,0PSYCHEDELIC WALL THERMOMETER,2.55,0,0,0,0,0,0,0,0,0,0,0,0,0,0,0,0,0,0,0,0,0,0,0MAGIC DRAWING SLATE BUNNIES ,8.87,0,0,0,0,0,0,0,0,0,0,0,0,0,0,0,0,0,0,0,0,0,0,0check,0,0,0,0,0,0,0,0,0,0,0,0,0,0,0,0,0,0,0,0,0,0,0,0WRAP FOLK ART,0.84,0,0,0,0,0,0,0,0,0,0,0,0,0,0,0,0,0,0,0,0,0,0,0damages,0,0,0,0,0,0,0,0,0,0,0,0,0,0,0,0,0,0,0,0,0,0,0,0ROSE DU SUD WASHBAG ,35.42,0,0,0,0,0,0,0,0,0,0,0,0,0,0,0,0,0,0,0,0,0,0,0NINJA RABBIT BLACK,7.57,0,0,0,0,0,0,0,0,0,0,0,0,0,0,0,0,0,0,0,0,0,0,0BATHROOM METAL SIGN ,14.43,0,0,0,0,0,0,0,0,0,0,0,0,0,0,1.45,0,0,0,0,0,0,0,0DAISIES  HONEYCOMB GARLAND ,8.37,0,0,0,0,0,0,0,0,0,0,0,0,0,0,0,0,0,0,0,0,0,0,0SET/4 BADGES BEETLES,5.87,0,0,0,0,0,0,0,0,0,0,0,0,0,0,0,0,0,0,0,0,0,0,0DINOSAUR HEIGHT CHART STICKER SET,38.41,0,0,0,0,0,0,0,0,0,0,0,0,0,0,0,0,0,0,0,0,0,0,0LARGE CAMPHOR WOOD FIELD MUSHROOM ,21.92,0,0,0,0,0,0,0,0,0,0,0,0,0,0,0,0,0,0,0,0,0,0,0Dad's Cab Electronic Meter,16.94,0,0,0,0,0,0,0,0,0,0,0,0,0,0,0,0,0,0,0,0,0,0,0MIRROR MOSAIC VOTIVE HOLDER,26.79,0,0,0,0,0,0,0,0,0,0,0,0,0,0,0,0,0,0,0,0,0,0,0PINK CHICK EGG WARMER + EGG CUP,6.31,0,0,0,0,0,0,0,0,0,0,0,0,0,0,0,0,0,0,0,0,0,0,0PET MUG- GOLDFISH,2.52,0,0,0,0,0,0,0,0,0,0,0,0,0,0,0,0,0,0,0,0,0,0,0SET/4 2 TONE EGG SHAPE MIXING BOWLS,9.95,0,0,0,0,0,0,0,0,0,0,0,0,0,0,0,0,0,0,0,0,0,0,050CM METAL STRING WITH  7 CLIPS,4.26,0,0,0,0,0,0,0,0,0,0,0,0,0,0,0,0,0,0,0,0,0,0,0BLUE TV TRAY TABLE ,94.15,0,0,0,0,0,0,0,0,0,0,0,0,0,0,0,0,0,0,0,0,0,0,0PINK/BLUE DISC/MIRROR STRING,3.32,0,0,0,0,0,0,0,0,0,0,0,0,0,0,0,0,0,0,0,0,0,0,0MEDIUM PINK BUDDHA HEAD ,11.82,0,0,0,0,0,0,0,0,0,0,0,0,0,0,0,0,0,0,0,0,0,0,0SET OF 4 POLKADOT COASTERS,20.08,0,0,0,0,0,0,0,0,0,0,0,0,0,0,0,0,0,0,0,0,0,0,0WHITE HAND TOWEL WITH BUTTERFLY,36.7,0,0,0,0,0,0,0,0,0,0,0,0,0,0,0,0,0,0,0,0,0,0,0CANDY SPOT CUSHION COVER,25.27,0,0,0,0,0,0,0,0,0,0,0,0,0,0,0,0,0,0,0,0,0,0,0CANDY SPOT EGG WARMER RABBIT,5.06,0,0,0,0,0,0,0,0,0,0,0,0,0,0,0,0,0,0,0,0,0,0,0SMALL ROUND CUT GLASS CANDLESTICK,33.87,0,0,0,0,0,0,0,0,0,0,0,0,0,0,0,0,0,0,0,0,0,0,0MIDNIGHT BLUE VINTAGE EARRINGS,26.67,0,0,0,0,0,0,0,0,0,0,0,0,0,0,0,0,0,0,0,0,0,0,0DIAMANTE HAIR GRIP PACK/2 CRYSTAL,8.45,0,0,0,0,0,0,0,0,0,0,0,0,0,0,0,0,0,0,0,0,0,0,0VINTAGE ENAMEL & CRYSTAL EARRINGS,25.45,0,0,0,0,0,0,0,0,0,0,0,0,0,0,0,0,0,0,0,0,0,0,0BLACK DIAMOND CLUSTER NECKLACE,9.77,0,0,0,0,0,0,0,0,0,0,0,0,0,0,0,0,0,0,0,0,0,0,0PURPLE FRANGIPANI HAIRCLIP,4.17,0,0,0,0,0,0,0,0,0,0,0,0,0,0,0,0,0,0,0,0,0,0,0GREEN GLASS TASSLE BAG CHARM,7.93,0,0,0,0,0,0,0,0,0,0,0,0,0,0,0,0,0,0,0,0,0,0,0AMBER GLASS TASSLE BAG CHARM,3.32,0,0,0,0,0,0,0,0,0,0,0,0,0,0,0,0,0,0,0,0,0,0,0PURPLE GLASS TASSLE BAG CHARM,6.64,0,0,0,0,0,0,0,0,0,0,0,0,0,0,0,0,0,0,0,0,0,0,0TURQ+RED BOUDICCA LARGE BRACELET,28.07,0,0,0,0,0,0,0,0,0,0,0,0,0,0,0,0,0,0,0,0,0,0,0ANT COPPER PINK BOUDICCA BRACELET,35.49,0,0,0,0,0,0,0,0,0,0,0,0,0,0,0,0,0,0,0,0,0,0,0PINK GLASS CHUNKY CHARM BRACELET,9.34,0,0,0,0,0,0,0,0,0,0,0,0,0,0,0,0,0,0,0,0,0,0,0DROP DIAMANTE EARRINGS PURPLE,8.87,0,0,0,0,0,0,0,0,0,0,0,0,0,0,0,0,0,0,0,0,0,0,0BLACK CHUNKY BEAD BRACELET W STRAP,9.34,0,0,0,0,0,0,0,0,0,0,0,0,0,0,0,0,0,0,0,0,0,0,0AMBER DIAMANTE EXPANDABLE RING,12.73,0,0,0,0,0,0,0,0,0,0,0,0,0,0,0,0,0,0,0,0,0,0,0PAIR OF PINK FLOWER CLUSTER SLIDE,10.16,0,0,0,0,0,0,0,0,0,0,0,0,0,0,0,0,0,0,0,0,0,0,0RED PAPER PARASOL,5.91,0,0,0,0,0,0,0,0,0,0,0,0,0,0,0,0,0,0,0,0,0,0,0SILVER JEWELLED MIRROR TRINKET TRAY,15.86,0,0,0,0,0,0,0,0,0,0,0,0,0,0,0,0,0,0,0,0,0,0,04 LILY  BOTANICAL DINNER CANDLES,18.75,0,0,0,0,0,0,0,0,0,0,0,0,0,0,0,0,0,0,0,0,0,0,0GROW A FLYTRAP OR SUNFLOWER IN TIN,10.75,0,0,0,0,0,0,0,0,0,0,0,0,0,0,0,0,0,0,0,0,0,0,0VINTAGE BEAD PINK EVENING BAG,27.76,0,0,0,0,0,0,0,0,0,0,0,0,0,0,0,0,0,0,0,0,0,0,0ENGLISH ROSE SCENTED HANGING FLOWER,8.5,0,0,0,0,0,0,0,0,0,0,0,0,0,0,0,0,0,4.25,0,0,0,0,0CUPID DESIGN SCENTED CANDLES,22.83,0,0,0,0,0,0,0,2.55,0,0,0,0,0,0,0,0,0,0,0,0,0,0,0SQUARE CHERRY BLOSSOM CABINET,15.85,0,0,0,0,0,0,0,0,0,0,0,0,0,0,0,0,0,0,0,0,0,0,0